23,[],False,kingofcash1,,[],,text,t2_4bdzdyjl,False,False,[],False,False,1600370195,youtube.com,https://www.reddit.com/r/cults/comments/iuqasd/dutch_elite_banker_exposes_satanic_ritual_abuse/,{},iuqasd,True,False,False,False,True,False,False,,[],dark,text,False,False,True,0,0,False,no_ads,/r/cults/comments/iuqasd/dutch_elite_banker_exposes_satanic_ritual_abuse/,False,0.0,1600370207,1,,True,False,False,cults,t5_2qzdi,61327,public,image,Dutch Elite Banker Exposes Satanic Ritual Abuse He Was A Victim To https://brave.com/sdd838,0,[],1.0,https://www.youtube.com/watch?v=T7Ow38WCybw&amp;feature=youtu.be,no_ads,0.0,rich:video,"{'enabled': False, 'images': [{'id': 'tNxyy-cP9R9AmXGALZU4yjMWHDah5U8-DwXHFILtCFU', 'resolutions': [{'height': 81, 'url': 'https://external-preview.redd.it/ygXi8CCCBSjYAP_KAt4Clw0-nuEC2FOyZDRmNETZtgI.jpg?width=108&amp;crop=smart&amp;auto=webp&amp;s=a94ea5be6be0a8052be572c5c2a03c065cbe546d', 'width': 108}, {'height': 162, 'url': 'https://external-preview.redd.it/ygXi8CCCBSjYAP_KAt4Clw0-nuEC2FOyZDRmNETZtgI.jpg?width=216&amp;crop=smart&amp;auto=webp&amp;s=3f013a2315609754eddfb0a8fcfad4de07292ae6', 'width': 216}, {'height': 240, 'url': 'https://external-preview.redd.it/ygXi8CCCBSjYAP_KAt4Clw0-nuEC2FOyZDRmNETZtgI.jpg?width=320&amp;crop=smart&amp;auto=webp&amp;s=09c3c346415e282cf9cdbe69467f8b544f71cf63', 'width': 320}], 'source': {'height': 360, 'url': 'https://external-preview.redd.it/ygXi8CCCBSjYAP_KAt4Clw0-nuEC2FOyZDRmNETZtgI.jpg?auto=webp&amp;s=3210924c407961fa23188c85b49bfac3bd921bb4', 'width': 480}, 'variants': {}}]}",105.0,140.0,https://www.youtube.com/watch?v=T7Ow38WCybw&amp;feature=youtu.be,,,"{'oembed': {'author_name': 'St ArchAngelMichael', 'author_url': 'https://www.youtube.com/channel/UC8dXGn313HMVYLH6ew1lE5A', 'height': 338, 'html': '&lt;iframe width=""600"" height=""338"" src=""https://www.youtube.com/embed/T7Ow38WCybw?feature=oembed&amp;enablejsapi=1"" frameborder=""0"" allow=""accelerometer; autoplay; clipboard-write; encrypted-media; gyroscope; picture-in-picture"" allowfullscreen&gt;&lt;/iframe&gt;', 'provider_name': 'YouTube', 'provider_url': 'https://www.youtube.com/', 'thumbnail_height': 360, 'thumbnail_url': 'https://i.ytimg.com/vi/T7Ow38WCybw/hqdefault.jpg', 'thumbnail_width': 480, 'title': 'Elite Banker Speaks Of Satanic Trafficking and Ritual Abuse', 'type': 'video', 'version': '1.0', 'width': 600}, 'type': 'youtube.com'}","{'content': '&lt;iframe width=""600"" height=""338"" src=""https://www.youtube.com/embed/T7Ow38WCybw?feature=oembed&amp;enablejsapi=1"" frameborder=""0"" allow=""accelerometer; autoplay; clipboard-write; encrypted-media; gyroscope; picture-in-picture"" allowfullscreen&gt;&lt;/iframe&gt;', 'height': 338, 'scrolling': False, 'width': 600}","{'oembed': {'author_name': 'St ArchAngelMichael', 'author_url': 'https://www.youtube.com/channel/UC8dXGn313HMVYLH6ew1lE5A', 'height': 338, 'html': '&lt;iframe width=""600"" height=""338"" src=""https://www.youtube.com/embed/T7Ow38WCybw?feature=oembed&amp;enablejsapi=1"" frameborder=""0"" allow=""accelerometer; autoplay; clipboard-write; encrypted-media; gyroscope; picture-in-picture"" allowfullscreen&gt;&lt;/iframe&gt;', 'provider_name': 'YouTube', 'provider_url': 'https://www.youtube.com/', 'thumbnail_height': 360, 'thumbnail_url': 'https://i.ytimg.com/vi/T7Ow38WCybw/hqdefault.jpg', 'thumbnail_width': 480, 'title': 'Elite Banker Speaks Of Satanic Trafficking and Ritual Abuse', 'type': 'video', 'version': '1.0', 'width': 600}, 'type': 'youtube.com'}","{'content': '&lt;iframe width=""600"" height=""338"" src=""https://www.youtube.com/embed/T7Ow38WCybw?feature=oembed&amp;enablejsapi=1"" frameborder=""0"" allow=""accelerometer; autoplay; clipboard-write; encrypted-media; gyroscope; picture-in-picture"" allowfullscreen&gt;&lt;/iframe&gt;', 'height': 338, 'media_domain_url': 'https://www.redditmedia.com/mediaembed/iuqasd', 'scrolling': False, 'width': 600}",,,,,,,,
24,[],False,theswervepodcast,,[],,text,t2_6ykhj2dh,False,False,[],False,False,1600369191,youtu.be,https://www.reddit.com/r/cults/comments/iupynl/keith_raniere_was_the_founder_and_leader_of_nxivm/,{},iupynl,True,False,False,False,True,False,False,,[],dark,text,False,False,True,0,0,False,no_ads,/r/cults/comments/iupynl/keith_raniere_was_the_founder_and_leader_of_nxivm/,False,0.0,1600369203,1,,True,False,False,cults,t5_2qzdi,61326,public,image,"""Keith Raniere"" was the founder and leader of ""NXIVM"", a cult disguised as a multi-level marketing self development organization. Multiple sexual abuse allegations, missing persons cases, and other criminal accusations have come out against NXIVM and Keith Raniere. What say you?",0,[],1.0,https://youtu.be/tJVn701V3r8,no_ads,0.0,rich:video,"{'enabled': False, 'images': [{'id': 'VJb5dxT5Kj8y8IhNbRe-nf1JZvxl8CMl4W8woy0usDs', 'resolutions': [{'height': 81, 'url': 'https://external-preview.redd.it/VNVR7KIarzqHdPEg6w7-AnesSrKz7jhEjJv-smA_AiU.jpg?width=108&amp;crop=smart&amp;auto=webp&amp;s=84fc7210a3e45f58d95acdbe4543f66bde08fa95', 'width': 108}, {'height': 162, 'url': 'https://external-preview.redd.it/VNVR7KIarzqHdPEg6w7-AnesSrKz7jhEjJv-smA_AiU.jpg?width=216&amp;crop=smart&amp;auto=webp&amp;s=d12fa39cff1c8ba169724343767d92722af59568', 'width': 216}, {'height': 240, 'url': 'https://external-preview.redd.it/VNVR7KIarzqHdPEg6w7-AnesSrKz7jhEjJv-smA_AiU.jpg?width=320&amp;crop=smart&amp;auto=webp&amp;s=3942d5122925310f0f371c433b91f6da81703cf5', 'width': 320}], 'source': {'height': 360, 'url': 'https://external-preview.redd.it/VNVR7KIarzqHdPEg6w7-AnesSrKz7jhEjJv-smA_AiU.jpg?auto=webp&amp;s=a6b52e36501c0a8f59e7f301cc16f521ea4ab22e', 'width': 480}, 'variants': {}}]}",105.0,140.0,https://youtu.be/tJVn701V3r8,,,"{'oembed': {'author_name': 'The Swerve Podcast', 'author_url': 'https://www.youtube.com/channel/UC7h2NhzQRRIfaU8V1313a-A', 'height': 338, 'html': '&lt;iframe width=""600"" height=""338"" src=""https://www.youtube.com/embed/tJVn701V3r8?feature=oembed&amp;enablejsapi=1"" frameborder=""0"" allow=""accelerometer; autoplay; clipboard-write; encrypted-media; gyroscope; picture-in-picture"" allowfullscreen&gt;&lt;/iframe&gt;', 'provider_name': 'YouTube', 'provider_url': 'https://www.youtube.com/', 'thumbnail_height': 360, 'thumbnail_url': 'https://i.ytimg.com/vi/tJVn701V3r8/hqdefault.jpg', 'thumbnail_width': 480, 'title': 'Keith Raniere + NXIVM – Narcissist Genius, Blackmail, Smallville Sex Cult, and Blue Light Orgasms?', 'type': 'video', 'version': '1.0', 'width': 600}, 'type': 'youtube.com'}","{'content': '&lt;iframe width=""600"" height=""338"" src=""https://www.youtube.com/embed/tJVn701V3r8?feature=oembed&amp;enablejsapi=1"" frameborder=""0"" allow=""accelerometer; autoplay; clipboard-write; encrypted-media; gyroscope; picture-in-picture"" allowfullscreen&gt;&lt;/iframe&gt;', 'height': 338, 'scrolling': False, 'width': 600}","{'oembed': {'author_name': 'The Swerve Podcast', 'author_url': 'https://www.youtube.com/channel/UC7h2NhzQRRIfaU8V1313a-A', 'height': 338, 'html': '&lt;iframe width=""600"" height=""338"" src=""https://www.youtube.com/embed/tJVn701V3r8?feature=oembed&amp;enablejsapi=1"" frameborder=""0"" allow=""accelerometer; autoplay; clipboard-write; encrypted-media; gyroscope; picture-in-picture"" allowfullscreen&gt;&lt;/iframe&gt;', 'provider_name': 'YouTube', 'provider_url': 'https://www.youtube.com/', 'thumbnail_height': 360, 'thumbnail_url': 'https://i.ytimg.com/vi/tJVn701V3r8/hqdefault.jpg', 'thumbnail_width': 480, 'title': 'Keith Raniere + NXIVM – Narcissist Genius, Blackmail, Smallville Sex Cult, and Blue Light Orgasms?', 'type': 'video', 'version': '1.0', 'width': 600}, 'type': 'youtube.com'}","{'content': '&lt;iframe width=""600"" height=""338"" src=""https://www.youtube.com/embed/tJVn701V3r8?feature=oembed&amp;enablejsapi=1"" frameborder=""0"" allow=""accelerometer; autoplay; clipboard-write; encrypted-media; gyroscope; picture-in-picture"" allowfullscreen&gt;&lt;/iframe&gt;', 'height': 338, 'media_domain_url': 'https://www.redditmedia.com/mediaembed/iupynl', 'scrolling': False, 'width': 600}",,,,,,,,
25,[],False,_cant_get_no_worse_,,[],,text,t2_84hydnqs,False,False,[],False,False,1600363714,self.cults,https://www.reddit.com/r/cults/comments/iuo590/243768_1283242/,{},iuo590,True,False,False,False,True,True,False,,[],dark,text,False,False,True,3,0,False,no_ads,/r/cults/comments/iuo590/243768_1283242/,False,0.0,1600363730,1,A tourist went missing last summer and about 6 months later i found their camera. There was no sd card in it. No pictures. I still have it. And it works. Going into the brush today. Lets hope i find my way out of it later. So much has been going on and i am going to try to get everything on film. I want to get out of here. Today he is testing the strength of 3 people and their bodies. Its ritual day since they arrived yesterday. Gants or shark food,True,False,False,cults,t5_2qzdi,61320,public,self,24.3768 128.3242,0,[],1.0,https://www.reddit.com/r/cults/comments/iuo590/243768_1283242/,no_ads,0.0,,,,,,,,,,,,,,,,,,,
26,[],False,vampscars,,[],,text,t2_2gu255gu,False,False,[],False,False,1600357669,self.cults,https://www.reddit.com/r/cults/comments/ium30d/my_brother_recently_joined_a_cult/,{},ium30d,True,False,False,False,True,True,False,,[],dark,text,False,False,True,15,0,False,no_ads,/r/cults/comments/ium30d/my_brother_recently_joined_a_cult/,False,0.0,1600357697,1,"Hi everyone I’m seeking out some guidance on what to do to help my 20 year old brother who has recently joined a cult. I also believe that he is having a mental health episode. I also have bipolar disorder with psychotic features and it runs in our family. I am now in therapy and properly medicated so I’m doing well with it. Over the summer I believe he had a depressive episode and now I believe that he’s having a manic episode. 
He was telling me about this church he joined called Antioch Community Church. I did a little research and found that it is considered a cult by many people including ex members. I will attach an article I found about it. [article ](https://medium.com/@jessica.cobaugh9/to-a-close-9c8ff0671b62) . He’s talking about how he believes that his diabetes is caused by a demon and it could be gone next week and he might not need his insulin anymore and I’m concerned that he’s going to stop taking his insulin. I also read about how the church believes that mental illness is demonic possession. 
Right now he doesn’t seem willing to listen to any reason. Our mom has said that she can’t deal with him anymore but I plan to continue to keep contact with him and my hope is to get him out of the cult. Any advice would be helpful.",True,False,False,cults,t5_2qzdi,61314,public,self,My brother recently joined a cult,0,[],1.0,https://www.reddit.com/r/cults/comments/ium30d/my_brother_recently_joined_a_cult/,no_ads,0.0,self,"{'enabled': False, 'images': [{'id': 'aGrBIwHi32nisAjNB5lXpWgjCSDIxATICy-h-m44a1s', 'resolutions': [{'height': 86, 'url': 'https://external-preview.redd.it/P29GPHwGTdk9ZMgly6b7OpuoU92ZzYPPh5f5cKuRg-0.jpg?width=108&amp;crop=smart&amp;auto=webp&amp;s=1b78435b041e8db0f7ec8d29969feb7405ae5548', 'width': 108}, {'height': 172, 'url': 'https://external-preview.redd.it/P29GPHwGTdk9ZMgly6b7OpuoU92ZzYPPh5f5cKuRg-0.jpg?width=216&amp;crop=smart&amp;auto=webp&amp;s=0f7b38f18d792a132a523659a776c3698c84a77b', 'width': 216}, {'height': 256, 'url': 'https://external-preview.redd.it/P29GPHwGTdk9ZMgly6b7OpuoU92ZzYPPh5f5cKuRg-0.jpg?width=320&amp;crop=smart&amp;auto=webp&amp;s=2b5ae5fab7f30bad6379b5f7b4b5fabcb4a59d94', 'width': 320}], 'source': {'height': 400, 'url': 'https://external-preview.redd.it/P29GPHwGTdk9ZMgly6b7OpuoU92ZzYPPh5f5cKuRg-0.jpg?auto=webp&amp;s=a494043e634f396cb210b61a462774ccd3f9c896', 'width': 500}, 'variants': {}}]}",,,,,,,,,,,,,,,,,
27,[],False,neiw,,[],,text,t2_156oq3,False,False,[],False,False,1600353338,self.cults,https://www.reddit.com/r/cults/comments/iukohs/how_watching_the_vow_on_hbo_made_me_reconsider/,{},iukohs,True,False,False,False,True,True,False,,[],dark,text,False,False,True,17,0,False,no_ads,/r/cults/comments/iukohs/how_watching_the_vow_on_hbo_made_me_reconsider/,False,0.0,1600353351,1,"For those of you who have not seen *the Vow* on HBO, it is positively mesmerizing. I won't ruin it, but it's a recent documentary on how a popular self-improvement program for people in the business world became the front for a sex cult. 

The narrative is told from the perspective of a few influential, long-term members of the group who slowly began to realize that the program which they had dedicated almost every facet of their lives to was not what it seemed. The story documents a charismatic leader, Keith Rainere, who created this program for self improvement, and recruits powerful people to help bolster and spread his message.

What strikes me most about Keith is that he is a genuinely sincere, intelligent person who seems very intent on understanding people at their core. The documentary records several personal interactions with Keith and his followers, and the dialogue is incredibly raw and private - you almost feel like a voyeur watching these conversations. There is nothing nefarious about the overall arching content of the program. It's very much centered around self-fulfillment and releasing the bonds of your own limitations. 

As I watched this documentary, it dawned on me that all of this - the content of the program NXIVM, the complete and total dedication of the followers - it happened in 2017. In an age where cults like Heaven's Gate, Branch Davidians, and the People's Temple have come and gone with worldwide coverage. Where any knowledge of cults and cult-like behavior are at your fingertips. 

How many religions in the ancient world began the same way? With the same type of charismatic leader, who with utmost sincerity, reached the right audience at the right point in history? And how much more susceptible were these citizens of ancient cultures to movements such as these, with no access to universal information, very little (if any) formal education, and a staggeringly low literacy rate. All underscored by the unique plight of life in the ancient world, with little access to effective medicine, brutal wars, totalitarian governance. These are the circumstances under which major world religions such as Christianity and Islam came forth.

It just seems poignant to me that a common understanding of major world religions is that their origin stories somehow exist outside of the realm of cult-like behavior, when in reality, the similarities are striking. 

What's that saying? The difference between a religion and a cult is time and the amount of followers? Curious to know your thoughts.",True,False,False,cults,t5_2qzdi,61310,public,self,How watching 'the Vow' on HBO made me reconsider the origin of the world's most influential religions,0,[],1.0,https://www.reddit.com/r/cults/comments/iukohs/how_watching_the_vow_on_hbo_made_me_reconsider/,no_ads,0.0,,,,,,,,,,,,,,,,,,,
28,[],False,1904t,,[],,text,t2_4fvm5mmj,False,False,[],False,False,1600335084,self.cults,https://www.reddit.com/r/cults/comments/iug5gm/how_growing_up_in_a_cult_affected_my_mindset_can/,{},iug5gm,True,False,False,False,True,True,False,,[],dark,text,False,False,True,2,0,False,no_ads,/r/cults/comments/iug5gm/how_growing_up_in_a_cult_affected_my_mindset_can/,False,0.0,1600335096,1,"how growing up in a cult affected my mindset -

1.a. black and white emotions about undertanding in relationships - all or nothing - you're either fully understood, or being partly understood equals completely misunderstood 》 which results in putting person in the ""outsider"" position to you which is also feeling betrayed and lonely AKA miserable.
1.b. people either should lack all boundries with me/have same emotional reactions as me or they're outsiders and i push them away/exclude them from me emotionally/mentally. no inbetween. (the consequences are that i don't interact with people or have friends because I'm not interested in connections that arent extreme. i'm very lonely but being with other people makes me feel lonelier)
1.c. basically the concept and term of the outsider (vs insider or ally) is something very present in my life and an obsticle

2. loneliness = misery. i was groomed and shaped into the mindset that happiness=lack of boundries to the point of becoming one with another person. i wasn't allowed or taught boundries and both physical and mental privacy didn't exist.

3. objectifying myself - i was taught I'm a tool to make others happy and a tool to teach others to ""see the light"". i view my mind, my body, my worth through the eyes of others. if I'm not smart in the eyes of others, if I'm not physically attractive in the eyes of others (including even my own dad), then i AM worthless.

some stuff i struggle with my entire life (which i didn't even realize is abnormal until this year) that i wanted to let out and vent. thank you if you took the time to read and hear my voice and have a great day and a beautiful weekend. if anyone who grew up in a cult as well can relate I'd love to hear.",True,False,False,cults,t5_2qzdi,61297,public,self,how growing up in a cult affected my mindset. can anyone relate?,0,[],1.0,https://www.reddit.com/r/cults/comments/iug5gm/how_growing_up_in_a_cult_affected_my_mindset_can/,no_ads,0.0,,,,,,,,,,,,,,,,,,,
29,[],False,DVeinot,,[],,text,t2_336i3adz,False,False,[],False,False,1600331518,midwestoutreach.org,https://www.reddit.com/r/cults/comments/iufgt8/a_quarter_century_ago_we_were_on_a_qa_panel_at_an/,{},iufgt8,True,False,False,False,True,False,False,,[],dark,text,False,False,True,0,0,False,no_ads,/r/cults/comments/iufgt8/a_quarter_century_ago_we_were_on_a_qa_panel_at_an/,False,0.0,1600331529,1,,False,False,False,cults,t5_2qzdi,61295,public,default,"A quarter century ago, we were on a Q&amp;A panel at an apologetics conference MCOI was hosting with a local church. One of the questions asked of the panel was whether we thought same-gender marriage would someday become legal.",0,[],1.0,https://midwestoutreach.org/?p=11151,no_ads,0.0,link,"{'enabled': False, 'images': [{'id': '_eUKuLL4UL9a1MXPPMGY1U-HXQFtvqkzCfSyhJyMEeo', 'resolutions': [{'height': 78, 'url': 'https://external-preview.redd.it/MBt0MhNaFb1KnRu0yYGYXwadOg-hYB1yqh1tLzkSN8I.jpg?width=108&amp;crop=smart&amp;auto=webp&amp;s=37616ec297345d137132c1f4041595423e832bb1', 'width': 108}, {'height': 157, 'url': 'https://external-preview.redd.it/MBt0MhNaFb1KnRu0yYGYXwadOg-hYB1yqh1tLzkSN8I.jpg?width=216&amp;crop=smart&amp;auto=webp&amp;s=3b43a480fc1f1b4a2c566bdbdbe75c46d82ca30d', 'width': 216}, {'height': 233, 'url': 'https://external-preview.redd.it/MBt0MhNaFb1KnRu0yYGYXwadOg-hYB1yqh1tLzkSN8I.jpg?width=320&amp;crop=smart&amp;auto=webp&amp;s=7f4854427a3f5d741e2745985c43b9c72962bb8b', 'width': 320}], 'source': {'height': 437, 'url': 'https://external-preview.redd.it/MBt0MhNaFb1KnRu0yYGYXwadOg-hYB1yqh1tLzkSN8I.jpg?auto=webp&amp;s=5252aa2580e7a52f47fb6032c25765d13c92bc89', 'width': 600}, 'variants': {}}]}",101.0,140.0,https://midwestoutreach.org/?p=11151,,,,,,,,,,,,,,
30,[],False,not-moses,,[],,text,t2_10s3dj,False,True,[],False,False,1600313307,reddit.com,https://www.reddit.com/r/cults/comments/iubfpk/belief_is_not_the_route_to_growth_and_ethical/,{},iubfpk,True,False,False,False,True,False,False,,[],dark,text,False,False,True,1,0,False,no_ads,/r/cults/comments/iubfpk/belief_is_not_the_route_to_growth_and_ethical/,False,0.0,1600313318,1,,True,False,False,cults,t5_2qzdi,61286,public,default,Belief is NOT the route to growth and ethical functionality. Belief is the route to being dependent upon the approval and influence of others and being subject to their control.,0,[],1.0,https://www.reddit.com/r/exchristian/comments/iube9a/belief_is_not_the_route_to_growth_and_ethical/,no_ads,0.0,,,,,https://www.reddit.com/r/exchristian/comments/iube9a/belief_is_not_the_route_to_growth_and_ethical/,,,,,,,,,,,,,,
31,[],False,Sad_Grapefruit123,,[],,text,t2_7nimp9a2,False,False,[],False,False,1600308089,self.cults,https://www.reddit.com/r/cults/comments/iua0sj/started_a_cult_on_my_discord_server_join_it/,{},iua0sj,True,False,False,False,True,True,False,,[],dark,text,False,False,True,0,0,False,,/r/cults/comments/iua0sj/started_a_cult_on_my_discord_server_join_it/,False,,1600308100,1,"&amp;#x200B;

https://preview.redd.it/o82h8sc18mn51.png?width=780&amp;format=png&amp;auto=webp&amp;s=dbe0500794820c13b88f40d3fc4cd9324aabd392",True,False,False,cults,t5_2qzdi,61275,public,self,started a cult on my discord server. join it.,0,[],1.0,https://www.reddit.com/r/cults/comments/iua0sj/started_a_cult_on_my_discord_server_join_it/,,,,,62.0,140.0,,,,,,,,,,"{'o82h8sc18mn51': {'e': 'Image', 'id': 'o82h8sc18mn51', 'm': 'image/png', 'p': [{'u': 'https://preview.redd.it/o82h8sc18mn51.png?width=108&amp;crop=smart&amp;auto=webp&amp;s=7def4bd4d2e78ed1524d6297827d5007c8349eb5', 'x': 108, 'y': 48}, {'u': 'https://preview.redd.it/o82h8sc18mn51.png?width=216&amp;crop=smart&amp;auto=webp&amp;s=cb33466b6dc24f0819b41577ea35d30abd97bd8b', 'x': 216, 'y': 96}, {'u': 'https://preview.redd.it/o82h8sc18mn51.png?width=320&amp;crop=smart&amp;auto=webp&amp;s=f52d83f65e48478847234c29b118b71ed9798d97', 'x': 320, 'y': 142}, {'u': 'https://preview.redd.it/o82h8sc18mn51.png?width=640&amp;crop=smart&amp;auto=webp&amp;s=6eb4b813a82f17c842f56a22a3ff7e697c578386', 'x': 640, 'y': 285}], 's': {'u': 'https://preview.redd.it/o82h8sc18mn51.png?width=780&amp;format=png&amp;auto=webp&amp;s=dbe0500794820c13b88f40d3fc4cd9324aabd392', 'x': 780, 'y': 348}, 'status': 'valid'}}",,,,,
32,[],False,ourherocomic,,[],,text,t2_6r3jf,False,False,[],False,False,1600299818,podcasts.apple.com,https://www.reddit.com/r/cults/comments/iu7pzq/my_new_cult_investigation_podcast/,{},iu7pzq,True,False,False,False,True,False,False,,[],dark,text,False,False,True,6,0,False,no_ads,/r/cults/comments/iu7pzq/my_new_cult_investigation_podcast/,False,0.0,1600299829,1,,True,False,False,cults,t5_2qzdi,61267,public,default,My new cult investigation podcast,0,[],1.0,https://podcasts.apple.com/us/podcast/hashtag-cult/id1525639915,no_ads,0.0,link,"{'enabled': False, 'images': [{'id': 'GCTW8Nw_JLBdSEfpuFA63PqtLzNmN4P9GgeGHpKUcFI', 'resolutions': [{'height': 56, 'url': 'https://external-preview.redd.it/yOHXm1CRTeeeaZF9f2ikyv7mJhexzial8LVPTPfmY-8.jpg?width=108&amp;crop=smart&amp;auto=webp&amp;s=65405aab9f8628e554ae3301cda217e4e7727096', 'width': 108}, {'height': 113, 'url': 'https://external-preview.redd.it/yOHXm1CRTeeeaZF9f2ikyv7mJhexzial8LVPTPfmY-8.jpg?width=216&amp;crop=smart&amp;auto=webp&amp;s=95fc1ff0f5b3d177da6b9fe6fa6992807448dded', 'width': 216}, {'height': 168, 'url': 'https://external-preview.redd.it/yOHXm1CRTeeeaZF9f2ikyv7mJhexzial8LVPTPfmY-8.jpg?width=320&amp;crop=smart&amp;auto=webp&amp;s=0f7223c18f9499fb588324e19ffce76c5ced924c', 'width': 320}, {'height': 336, 'url': 'https://external-preview.redd.it/yOHXm1CRTeeeaZF9f2ikyv7mJhexzial8LVPTPfmY-8.jpg?width=640&amp;crop=smart&amp;auto=webp&amp;s=06809f53ce3bae1ae0ffde8c27806534454ca019', 'width': 640}, {'height': 504, 'url': 'https://external-preview.redd.it/yOHXm1CRTeeeaZF9f2ikyv7mJhexzial8LVPTPfmY-8.jpg?width=960&amp;crop=smart&amp;auto=webp&amp;s=7c4e369e656a5542afb58fae0519fbbb84f58f82', 'width': 960}, {'height': 567, 'url': 'https://external-preview.redd.it/yOHXm1CRTeeeaZF9f2ikyv7mJhexzial8LVPTPfmY-8.jpg?width=1080&amp;crop=smart&amp;auto=webp&amp;s=066e61ad869cbe95d8a03a87ac4aa0bcb473ec70', 'width': 1080}], 'source': {'height': 630, 'url': 'https://external-preview.redd.it/yOHXm1CRTeeeaZF9f2ikyv7mJhexzial8LVPTPfmY-8.jpg?auto=webp&amp;s=c45a58c583d01f3299b739cb49c87effe622a226', 'width': 1200}, 'variants': {}}]}",73.0,140.0,https://podcasts.apple.com/us/podcast/hashtag-cult/id1525639915,,,,,,,,,,,,,,
