61,[],False,DVeinot,,[],,text,t2_336i3adz,False,False,[],False,False,1600118224,youtu.be,https://www.reddit.com/r/cults/comments/isud55/random_musings_of_a_former_mormon_david_montoya/,{},isud55,True,False,False,False,True,False,False,,[],dark,text,False,False,True,0,0,False,no_ads,/r/cults/comments/isud55/random_musings_of_a_former_mormon_david_montoya/,False,0.0,1600118241,1,,False,False,False,cults,t5_2qzdi,61060,public,image,“Random Musings of a Former Mormon” - David Montoya - 207,0,[],1.0,https://youtu.be/rIJxpg2Dgkc,no_ads,0.0,rich:video,"{'enabled': False, 'images': [{'id': 'M3rjwA-PIjwtSNwK1sY6Rv8aFwfOqsBVRFluyUijLww', 'resolutions': [{'height': 81, 'url': 'https://external-preview.redd.it/srrjI8vXSt6p2VuSn86HqCFtbavB5Qm3Whr0s53jIHI.jpg?width=108&amp;crop=smart&amp;auto=webp&amp;s=5379f5502dc00c35277f4cfb1338719eb027555d', 'width': 108}, {'height': 162, 'url': 'https://external-preview.redd.it/srrjI8vXSt6p2VuSn86HqCFtbavB5Qm3Whr0s53jIHI.jpg?width=216&amp;crop=smart&amp;auto=webp&amp;s=43f67cb89fc3d70f61b4d399341cd2147ecb2655', 'width': 216}, {'height': 240, 'url': 'https://external-preview.redd.it/srrjI8vXSt6p2VuSn86HqCFtbavB5Qm3Whr0s53jIHI.jpg?width=320&amp;crop=smart&amp;auto=webp&amp;s=c880f1993c536786af0d565a2efd8fbb81301d1b', 'width': 320}], 'source': {'height': 360, 'url': 'https://external-preview.redd.it/srrjI8vXSt6p2VuSn86HqCFtbavB5Qm3Whr0s53jIHI.jpg?auto=webp&amp;s=1fc84b761920461514c8c619cddabef0aa08f96b', 'width': 480}, 'variants': {}}]}",105.0,140.0,https://youtu.be/rIJxpg2Dgkc,,,"{'oembed': {'author_name': 'Midwest Christian Outreach, Inc', 'author_url': 'https://www.youtube.com/channel/UCK4TLxG_1ZabHloT-FRLE7g', 'height': 338, 'html': '&lt;iframe width=""600"" height=""338"" src=""https://www.youtube.com/embed/rIJxpg2Dgkc?feature=oembed&amp;enablejsapi=1"" frameborder=""0"" allow=""accelerometer; autoplay; clipboard-write; encrypted-media; gyroscope; picture-in-picture"" allowfullscreen&gt;&lt;/iframe&gt;', 'provider_name': 'YouTube', 'provider_url': 'https://www.youtube.com/', 'thumbnail_height': 360, 'thumbnail_url': 'https://i.ytimg.com/vi/rIJxpg2Dgkc/hqdefault.jpg', 'thumbnail_width': 480, 'title': '“Random Musings of a Former Mormon” - David Montoya - 207', 'type': 'video', 'version': '1.0', 'width': 600}, 'type': 'youtube.com'}","{'content': '&lt;iframe width=""600"" height=""338"" src=""https://www.youtube.com/embed/rIJxpg2Dgkc?feature=oembed&amp;enablejsapi=1"" frameborder=""0"" allow=""accelerometer; autoplay; clipboard-write; encrypted-media; gyroscope; picture-in-picture"" allowfullscreen&gt;&lt;/iframe&gt;', 'height': 338, 'scrolling': False, 'width': 600}","{'oembed': {'author_name': 'Midwest Christian Outreach, Inc', 'author_url': 'https://www.youtube.com/channel/UCK4TLxG_1ZabHloT-FRLE7g', 'height': 338, 'html': '&lt;iframe width=""600"" height=""338"" src=""https://www.youtube.com/embed/rIJxpg2Dgkc?feature=oembed&amp;enablejsapi=1"" frameborder=""0"" allow=""accelerometer; autoplay; clipboard-write; encrypted-media; gyroscope; picture-in-picture"" allowfullscreen&gt;&lt;/iframe&gt;', 'provider_name': 'YouTube', 'provider_url': 'https://www.youtube.com/', 'thumbnail_height': 360, 'thumbnail_url': 'https://i.ytimg.com/vi/rIJxpg2Dgkc/hqdefault.jpg', 'thumbnail_width': 480, 'title': '“Random Musings of a Former Mormon” - David Montoya - 207', 'type': 'video', 'version': '1.0', 'width': 600}, 'type': 'youtube.com'}","{'content': '&lt;iframe width=""600"" height=""338"" src=""https://www.youtube.com/embed/rIJxpg2Dgkc?feature=oembed&amp;enablejsapi=1"" frameborder=""0"" allow=""accelerometer; autoplay; clipboard-write; encrypted-media; gyroscope; picture-in-picture"" allowfullscreen&gt;&lt;/iframe&gt;', 'height': 338, 'media_domain_url': 'https://www.redditmedia.com/mediaembed/isud55', 'scrolling': False, 'width': 600}",,,,,,,,
62,[],False,dertigo,,[],,text,t2_bdtnh,False,False,[],False,False,1600103389,self.cults,https://www.reddit.com/r/cults/comments/isp6eo/is_there_a_definitive_articlebookpodcast_on_nxivm/,{},isp6eo,True,False,False,False,True,True,False,,[],dark,text,False,False,True,10,0,False,no_ads,/r/cults/comments/isp6eo/is_there_a_definitive_articlebookpodcast_on_nxivm/,False,0.0,1600103402,1,"About 10 years ago I read Lawrence Wright's New Yorker article on Scientology which seemed to collect the most comprehensive information on Scientology. It was great to see such a well-written piece that really showed what the cult was like. Is there something similar for NXIVM? I've been watching the VOW but I'd rather get more information before the series is over.

In case you haven't read it here's the Wright article https://www.newyorker.com/magazine/2011/02/14/the-apostate-lawrence-wright",True,False,False,cults,t5_2qzdi,61043,public,self,Is there a definitive article/book/podcast on NXIVM?,0,[],1.0,https://www.reddit.com/r/cults/comments/isp6eo/is_there_a_definitive_articlebookpodcast_on_nxivm/,no_ads,0.0,self,"{'enabled': False, 'images': [{'id': 'wFxvo-npP-L6Zawzf9W-ghLBocbfV5emGUAT8idAjgQ', 'resolutions': [{'height': 60, 'url': 'https://external-preview.redd.it/fjNQS-56tZfnv8QUgjXTVhTB4_MEJpls5aCGk9LZfmI.jpg?width=108&amp;crop=smart&amp;auto=webp&amp;s=9d9d5c641c1a1946d59b39b7d44e497596a2d824', 'width': 108}, {'height': 121, 'url': 'https://external-preview.redd.it/fjNQS-56tZfnv8QUgjXTVhTB4_MEJpls5aCGk9LZfmI.jpg?width=216&amp;crop=smart&amp;auto=webp&amp;s=d3289db32c5c545053be5c13131a8a1322f4c9c1', 'width': 216}, {'height': 180, 'url': 'https://external-preview.redd.it/fjNQS-56tZfnv8QUgjXTVhTB4_MEJpls5aCGk9LZfmI.jpg?width=320&amp;crop=smart&amp;auto=webp&amp;s=bf83fd4d79a0104b0007a60bc22550159556ed35', 'width': 320}, {'height': 360, 'url': 'https://external-preview.redd.it/fjNQS-56tZfnv8QUgjXTVhTB4_MEJpls5aCGk9LZfmI.jpg?width=640&amp;crop=smart&amp;auto=webp&amp;s=a2464efbb1485b9f7f24e09f5794f2ba75b519b1', 'width': 640}, {'height': 540, 'url': 'https://external-preview.redd.it/fjNQS-56tZfnv8QUgjXTVhTB4_MEJpls5aCGk9LZfmI.jpg?width=960&amp;crop=smart&amp;auto=webp&amp;s=ab73c7134306e9dd8e92ef957e7e9428db515a55', 'width': 960}, {'height': 607, 'url': 'https://external-preview.redd.it/fjNQS-56tZfnv8QUgjXTVhTB4_MEJpls5aCGk9LZfmI.jpg?width=1080&amp;crop=smart&amp;auto=webp&amp;s=5961a40bdcacc3e595e96341a38c7507684da18e', 'width': 1080}], 'source': {'height': 720, 'url': 'https://external-preview.redd.it/fjNQS-56tZfnv8QUgjXTVhTB4_MEJpls5aCGk9LZfmI.jpg?auto=webp&amp;s=00ac84b1a6af4dbc7c4c0388c0f5cb965a287912', 'width': 1280}, 'variants': {}}]}",,,,,,,,,,,,,,,,,
63,[],False,Soft_Kangaroo_2605,,[],,text,t2_795j4pa9,False,False,[],False,False,1600093885,self.cults,https://www.reddit.com/r/cults/comments/islyl5/veganism_as_a_cult_examining_the_coercive/,{},islyl5,True,False,False,False,True,True,False,,[],dark,text,False,False,True,34,0,False,no_ads,/r/cults/comments/islyl5/veganism_as_a_cult_examining_the_coercive/,False,0.0,1600094016,1,"If you browse over to r/exvegan or r/AntiVegan then you will see many people who state that veganism is a cult. I sympathize with those thoughts, since I see veganism as critical and destructive, but perhaps calling it a ""cult"" isn't accurate. I have received many negative responses from non-vegans when I call veganism a ""cult"". I think many people respond negatively to that because A) they see veganism as a ""diet"" (it's not -- vegans will strongly deny that point), B) veganism has no single leader, and C) veganism is not a money-making operation. But none of this means that veganism doesn't employ the same coercive techniques that typify cult behavior.

Let's examine veganism through that lens [https://pairadocks.blogspot.com/2017/01/coercive-persuasion-and-attitude-change.html](https://pairadocks.blogspot.com/2017/01/coercive-persuasion-and-attitude-change.html)

I am not describing the disconnected vegan who knows no other vegans. I'm describing the highly-connected vegans who only associate with other vegans. I'm not talking about your ""nice vegan friend"" that has ""never been pushy with you"".

&gt;1) The group is focused on a living leader to whom members seem to display excessively zealous, unquestioning commitment.

Not true for veganism. Some vegans will quote vegan sources like they are scripture, and the dogma is strident. 
   
&gt; 2) The group is preoccupied with bringing in new members.

Yes, big time. With other cults, the pretend goal is ""helping humanity"". With veganism, it's ""helping animals"".
   
&gt; 3) The group is preoccupied with making money. 

Not true for veganism. Though I wonder if there are some hucksters making money in it. 
   
&gt; 4) Questioning, doubt, and dissent are discouraged or even punished.

Absolutely true in veganism. Just check out some of the ""responses to ex-vegans"" on YouTube. They will use language like ""so and so was never vegan to begin with"", which is religious language.
   
&gt; 5)  Mind-numbing techniques (such as meditation, chanting, speaking in  tongues, denunciation sessions, debilitating work routines) are used to  suppress doubts about the group and its leaders. 

Not true for veganism. Though I wonder if ""vegan activism"" can apply. 
   
&gt; 6) The  leadership dictates -- sometimes in great detail -- how members should  think, act, and feel (e.g.: members must get permission from leaders to  date, change jobs, get married; leaders may prescribe what types of  clothes to wear, where to live, how to discipline children, and so  forth).  

There is no ""leadership"" in veganism, but there is quite a bit of intra-vegan enforcement (""Are you sure that's vegan?""). They forbid other members from wearing leather, feeding their children (or their cats!) non-vegan food, et cetera.
   
&gt; 7) The  group is elitist, claiming a special exalted status for itself, its  leader(s) and members (e.g.: the leader is considered the messiah or an  avatar; the group and/or the leader has a special mission to save  humanity). 

Oh hell yes. Vegans crow about being ""morally superior"", and call veganism the ""moral baseline"" (that everyone in the out-group is beneath).
   
&gt; 8) The group has a polarized us-versus-them mentality, which causes conflict with the wider society.  

HUUUUUGE in veganism. They call non-vegans ""murderers, slavers, rapists, carnists"", et cetera.
   
&gt; 9) The  group's leader is not accountable to any authorities (as are, for  example, military commanders and ministers, priests, monks, and rabbis  of mainstream denominations). The group teaches or implies that its  supposedly exalted ends justify means that members would have considered  unethical before joining the group (e.g.: collecting money for bogus  charities). 

Not in veganism. 
   
&gt; 10) The  leadership induces feelings of guilt \[embarrassment, humiliation, and  shame, as well as self-doubt and anxiety\] in members in order to control  them. 

No leadership to speak of, but the shaming is certainly there. ""Are you sure that's vegan?"" 
   
&gt; 11)  Members subservience to the group causes them to cut ties with family,  friends, and personal group goals and activities that were of interest  before joining the group. 

Partially. Members have conflicts with family (who don't appreciate being told that they are sinners and often react with hostility) and there is some conversation about cutting ties in vegans. 
   
&gt; 12) Members are expected to devote inordinate amounts of time to the group. 

Partially. Some vegans will express these kinds of pressures, others won't. 
   
&gt; 13) Members are encouraged or required to live and/or socialize only with other group members.

Partially. See number 11.",True,False,False,cults,t5_2qzdi,61036,public,self,Veganism as a cult - examining the coercive techniques,0,[],1.0,https://www.reddit.com/r/cults/comments/islyl5/veganism_as_a_cult_examining_the_coercive/,no_ads,0.0,,,,,,,,,,,,,,,,,,,
