65,[],False,External_Attorney_86,,[],,text,t2_7k5vvubl,False,False,[],False,False,1600083561,self.cults,https://www.reddit.com/r/cults/comments/isj7xf/moonies_unification_church/,{},isj7xf,True,False,False,False,True,True,False,,[],dark,text,False,False,True,3,0,False,no_ads,/r/cults/comments/isj7xf/moonies_unification_church/,False,0.0,1600086145,1,"I was unlucky enough to be born in this cult. So, there are mainly 2 types of members, the first generation and the second generation. The first generation are the ones that joined the church and the second generation are the ones who are born in the church.

Basically what the members believe is that through the blessing (a process where you get married to someone random) they remove the original sin and the kids born in this church are born without original sin however if they don’t keep their chastity before getting blessed they become fallen like the rest of the world. Everyone with the original sin will burn in hell forever after they die, basically anyone outside the church will burn in hell forever.

How the church grew so large: this is because the first generation could not get the blessing unless they find 3 new members. Many first generation were so desperate to get the blessing that they did months hunting for member and found many members to make sure that at least 3 of those members will stay in the cult until they get blessed. Recently say 15 years ago this was removed and you can get the blessing immediately because it was becoming too hard to find 3 members to join and many would just give up. Having said that parents complain that the process for them to get to the blessing was very hard and we should appreciate their efforts and complain that the life of the second generation is much easier (they are the ones that joined the cult and complaining). Also the first generation were told to have many kids as possible of course to have more organic growth and at lease if one of your child becomes fallen you have another child that can continue the linage. The first generation are so desperate that their kids go to the blessing because if they don’t go their life would be wasted, one of the first generation had a mentally disabled child and forced the child through the whole process and in the end the child remained alone. Many first generation hate each other and still stay together, some don’t even speak to each other which is really creepy when you see them together. Even the family of Sun Myung Moon is falling apart, one of the sons committed suicide and another used to be a drug addict and beat his wife. After Sun Myung Moon died the cult split into 3 because the family fought against each other for the wealth of the cult. 

Second generation had to go to classes to learn the divine principle which used to be a waste of time for everyone. Second generation have a lot of pressure on them because if they become fallen, all the sacrifices (basically regrets) of the first generation will be lost. If all the children of the first generation become fallen, the first generation loses the will to live and if the second generation becomes fallen they will be shamed. In fact there are a lot of suicides happening in the church and when a suicide happen the church leader sends an email saying that this happened because the person committing suicide was not following the divine principle which is disgusting. After the suicide the other members make sure that the family members that experienced the suicide keeps going to the cult meetings and if they don’t, they ask why didn’t you come to the meeting, they go to meet the family for a ‘chat’. Suicides are also common amongst first generation.

Second generation are encouraged not to socialize with the outside world because the cult is afraid that the second generation becomes fallen and the first generation don’t allow relationships with members outside the cult. So the second generation have no idea on what a relationship is and go to the blessing to find a random person and have to live with their partner for the rest of their life. Now the blessing process of the second generation changed and the parents find the partner for their kids. There is a website were second generation upload their photos and the parents find the partner for their kids. Once they think there is a match parents of both second generation have a chat and allow the second generation to start talking with each other. If the marriage fails they are considered fallen which of course the majority fails. Many stay together hating (same as first generation) each other just not to become fallen. Most second generation don’t have kids together after years being together, some over 10 years. Some second generation get blessed and you never see them again, they get the blessing and “leave” the cult as in reality they don’t want to have anything to do with the cult.

I would say that 90% of the marriages are mixed race and couples are matched from countries that hate each other because they think that the grandparents won’t hate their grand kids. They couldn’t have been more wrong, some parents of the first generation still won’t want to have anything to do with their kids and grandkids. Also the second generation would be living in the enemy country and makes life difficult for them because of the half side coming from the enemy country. Also the grandkids won’t be able to communicate or make a proper conversation with the grandparents that live in the other country which defeats the whole purpose. The first generation (the one’s that have their partner speaking the same language) would  say that the children should have learn both languages which is impossible because both parents always broke and working and wasting their time in the cult so they have no time for their kids.

The cult became so rich because a lot of members gave up all they had to the cult so it could grow. Sun Myung Moon used to tell members that to spread the truth, all members should give everything to the cult. Some members gave their homes and land to the cult and some of them did years working and giving 100% of their salary. The first generation used to live in one building and everyone used to eat the same food and sleeping in bunk beds. The first generation were mainly money makers for the cult and the cult fed them and gave them shelter. Also the ones that didn’t make enough money would go door to door selling staff to people to make more money. The cult leader of the community at the end of the month would show who was giving the most and who was giving the least which was shameful for the ones in the bottom of the list. Now the cult ask huge amounts of donations, sometimes asking 1.5k dollars per family and members are now required to pay 10% of their salaries to the cult.

The cult also believe in the 3 generation process which they think that after 3 generations the life of the cult members will become easier because the grandparents, parents and kids can grow in the cult freely and all should be able to understand each other. The problem is that many first generation had kids when they were over 35 years old and now many second generations are doing the same or not having kids. Now if the second generation has a kid at 35, the first generation would be 70 years old and before the child reaches their teens most first generations are dead or crippled and the process start again.

Now a days the cult is falling apart. Most second generation leave the cult by becoming ‘fallen’ and don’t want to have anything to do with the cult and some leave because how dumb the first generation are. Once all the second generation of the family leaves the cult, the first generation also will want nothing to do with the cult because now there is no point in meeting with the other cult member. Overall the first generation hate each because of the history they had together. This first generation sacrificed more than the other first generation; some say that other first generation are dumb (the pot calling the kettle black).  

It is difficult to say how many members are in this cult. They do a count once in a while, but leaders are afraid to show the actual numbers because they will be shamed. Normally if the leader doesn’t know if the second generation is ‘fallen’ they are added to the list as members and some just add all the family members as members. 

They promote peace but in all my life in this cult I can’t remember that they did anything for peace, sure they did a few meetings but nothing ever came out of the meetings just waste of money and effort. The only things I can remember are; that the cult was always asking for money, I am not putting effort to meet up (who wants to meet up with close minded idiots), this and that are not good and loads of waste of time. 

In short stay away and if you are in it find away to get out.",True,False,False,cults,t5_2qzdi,61028,public,self,Moonies - Unification Church,0,[],1.0,https://www.reddit.com/r/cults/comments/isj7xf/moonies_unification_church/,no_ads,0.0,,,,,,,,,,,,,,,,,,,
66,[],False,themorticianscode,,[],,text,t2_5qehma55,False,False,[],False,False,1600075000,i.imgur.com,https://www.reddit.com/r/cults/comments/ishk21/saw_this_shop_not_far_from_where_i_live_i_am_very/,{},ishk21,True,False,False,False,True,False,False,,[],dark,text,False,False,False,27,0,False,no_ads,/r/cults/comments/ishk21/saw_this_shop_not_far_from_where_i_live_i_am_very/,False,0.0,1600081069,30,,True,False,False,cults,t5_2qzdi,61023,public,image,Saw this shop not far from where I live. I am very suspicious.,0,[],1.0,https://i.imgur.com/W9iiqpE.jpg,no_ads,0.0,image,"{'enabled': True, 'images': [{'id': 'Vt7r3ehG86Yx456Fio0eA9JizPGoUpTOGuCQHHSm51s', 'resolutions': [{'height': 144, 'url': 'https://external-preview.redd.it/BRaaqfSYJ04pgx3hXJrcOiU2w838K3jKy_Nq_-WBvug.jpg?width=108&amp;crop=smart&amp;auto=webp&amp;s=d451d2a633b7f81fa08e5b9dff9acd51d36612bf', 'width': 108}, {'height': 288, 'url': 'https://external-preview.redd.it/BRaaqfSYJ04pgx3hXJrcOiU2w838K3jKy_Nq_-WBvug.jpg?width=216&amp;crop=smart&amp;auto=webp&amp;s=0e8a3d8665dbfcdf066fa796d2ee9e930d28d8a8', 'width': 216}, {'height': 426, 'url': 'https://external-preview.redd.it/BRaaqfSYJ04pgx3hXJrcOiU2w838K3jKy_Nq_-WBvug.jpg?width=320&amp;crop=smart&amp;auto=webp&amp;s=bde9dd9c6440e655c621849b8c0ddbe1902d7ad3', 'width': 320}, {'height': 853, 'url': 'https://external-preview.redd.it/BRaaqfSYJ04pgx3hXJrcOiU2w838K3jKy_Nq_-WBvug.jpg?width=640&amp;crop=smart&amp;auto=webp&amp;s=4bce3e987897aaa306fa95df243f7feaaab83b7b', 'width': 640}, {'height': 1280, 'url': 'https://external-preview.redd.it/BRaaqfSYJ04pgx3hXJrcOiU2w838K3jKy_Nq_-WBvug.jpg?width=960&amp;crop=smart&amp;auto=webp&amp;s=1db6e81db8c66a51dff3f175f57fdaa7eb5dd2ad', 'width': 960}, {'height': 1440, 'url': 'https://external-preview.redd.it/BRaaqfSYJ04pgx3hXJrcOiU2w838K3jKy_Nq_-WBvug.jpg?width=1080&amp;crop=smart&amp;auto=webp&amp;s=bede40aba16671ac67de7cdf7ce93cf4bd2c76d2', 'width': 1080}], 'source': {'height': 4032, 'url': 'https://external-preview.redd.it/BRaaqfSYJ04pgx3hXJrcOiU2w838K3jKy_Nq_-WBvug.jpg?auto=webp&amp;s=bf3ceb92f5d498484a1292de34dc136e5cb92dad', 'width': 3024}, 'variants': {}}]}",140.0,140.0,https://i.imgur.com/W9iiqpE.jpg,,,,,,,,,,,,,,
67,[],False,peterlaska,,[],,text,t2_34ui3j7b,False,False,[],False,False,1600032702,self.cults,https://www.reddit.com/r/cults/comments/is78qr/transcripts_of_ouija_session/,{},is78qr,True,False,False,False,True,True,False,,[],dark,text,False,False,True,18,0,False,no_ads,/r/cults/comments/is78qr/transcripts_of_ouija_session/,False,0.0,1600057154,0,I've updated my Ouija board session transcripts: https://detailsofrealitytwo.wordpress.com/ch-11-9-5-2020-data/,True,False,False,cults,t5_2qzdi,61006,public,self,Transcripts of Ouija Session,0,[],0.33,https://www.reddit.com/r/cults/comments/is78qr/transcripts_of_ouija_session/,no_ads,0.0,self,"{'enabled': False, 'images': [{'id': '9mGVBBxt6BKqoYEbIgg6Sc25vaYeWER6EepzkZ8za_k', 'resolutions': [{'height': 81, 'url': 'https://external-preview.redd.it/Wj-MzDbl5bucLkkljskmBM_UWqbsjXJVEQI7WvRCkZ0.jpg?width=108&amp;crop=smart&amp;auto=webp&amp;s=92eec93a90830dc8a2164d6a550ad9c03705eddc', 'width': 108}, {'height': 162, 'url': 'https://external-preview.redd.it/Wj-MzDbl5bucLkkljskmBM_UWqbsjXJVEQI7WvRCkZ0.jpg?width=216&amp;crop=smart&amp;auto=webp&amp;s=1e3e14a3fcc5b22351fa74aa9069f0f26c20696c', 'width': 216}, {'height': 240, 'url': 'https://external-preview.redd.it/Wj-MzDbl5bucLkkljskmBM_UWqbsjXJVEQI7WvRCkZ0.jpg?width=320&amp;crop=smart&amp;auto=webp&amp;s=4cb90bd817881b5699065ba9012bbc59a4c1c8dd', 'width': 320}], 'source': {'height': 360, 'url': 'https://external-preview.redd.it/Wj-MzDbl5bucLkkljskmBM_UWqbsjXJVEQI7WvRCkZ0.jpg?auto=webp&amp;s=41fc3c9d387bd6592cbd5d18921f954bc436d4f4', 'width': 480}, 'variants': {}}]}",,,,,,,,,,,,,,,,,
68,[],False,[deleted],,,,,,,,[],False,False,1600026922,self.cults,https://www.reddit.com/r/cults/comments/is5e9x/looking_for_academic_sources_on_cult_persuasion/,{},is5e9x,False,False,False,False,False,True,False,,[],dark,text,False,False,True,2,0,False,no_ads,/r/cults/comments/is5e9x/looking_for_academic_sources_on_cult_persuasion/,False,0.0,1600053556,1,[deleted],True,False,False,cults,t5_2qzdi,61004,public,default,Looking for academic sources on cult persuasion techniques,0,[],1.0,https://www.reddit.com/r/cults/comments/is5e9x/looking_for_academic_sources_on_cult_persuasion/,no_ads,0.0,,,,,,,,,,,,,,,,dark,deleted,,
69,[],False,OrbSwitzer,,[],,text,t2_5kr6bcox,False,False,[],False,False,1600017873,self.cults,https://www.reddit.com/r/cults/comments/is2ebg/blood_over_intent_leader_starting_irl_cult/,{},is2ebg,True,False,False,False,True,True,False,,[],dark,text,False,False,False,45,0,False,no_ads,/r/cults/comments/is2ebg/blood_over_intent_leader_starting_irl_cult/,False,0.0,1600047698,41,"[BOI Leader YouTube House Announcement](https://youtu.be/gHQvSaohhqE)

I posted a comment on an old thread about this but don't think anyone saw it, so this is an edited re-post of that.

I've been following ""Blood Over Intent"" for years and feel something significant just happened. If you don't know what that is, it's a subset of the Flat Earth community that got into a form of blood magic, that as of now seems to have almost entirely lost its steam (along with the larger FE community). They would write their ""divine intent"" to bring heaven on Earth on paper, then cut themselves and post a video of themselves spreading their blood over it.

As has been noted, it was apparently started by the truly psychotic Mark Braun or ""QuasiLuminous"" (now usually going by Saturn or Satan on YouTube, where he disappears and reappears frequently), but there have been other clear leaders among them. One is Devin Madgy, now ""Flat Earth Paradise"" on YT.

I could go on forever about this guy, but here's the gist: unlike QL, he comes off as intelligent and charismatic. For a long time he posted about BOI and random New-Agey nonsense, but he made very high-quality videos and before long had tens of thousands of subs. Notable things he's done: Had a big falling-out with QL and basically became the movement's biggest voice. Planned, raised money for, and ultimately abandoned the ""S.E.A.L."" Project in which he aimed to travel to the north pole to prove there's a giant hole there leading to the Garden of Eden. Largely abandoned BOI topics, becoming more focused on bizarre New Age crap. Traveled the country mooching off his supporters, including a weeks-long road trip he called ""The Ride of Remembrance"". Announced he is the reincarnation of Hermes/Thoth, ""messenger of the gods,"" and could ""manipulate matter at will"". Made predictions about vague yet supposedly cataclysmic events.

Anyway here's where I'm going with this... I used to comment on his videos, and once asked him when he's getting a Cult House and moving disciples in. He actually made a smart-ass reply.

I was joking, but the bastard's gone and done it, and my link is his announcement and invitation. It's a beautiful property with gardens. I feel an IRL cult is forming before my eyes. He's even gone Full Jesus with his appearance. I THINK he's from SE Michigan (like me!), but the property is in Oregon. Cult experts and enthusiasts: tell me what you think.",True,False,False,cults,t5_2qzdi,61001,public,self,Blood Over Intent Leader Starting IRL Cult?,0,[],0.93,https://www.reddit.com/r/cults/comments/is2ebg/blood_over_intent_leader_starting_irl_cult/,no_ads,0.0,self,"{'enabled': False, 'images': [{'id': 'vXDJftp2bLRDDc-znhpGvi6FrOFicKn4MawzvjJSzGs', 'resolutions': [{'height': 81, 'url': 'https://external-preview.redd.it/yyitn6nIaTvQgpCD_5A6u13GlpD_YPdPCGJIrrECUPQ.jpg?width=108&amp;crop=smart&amp;auto=webp&amp;s=d7f26145023f63d3efeb052f38fbca4c12b09cd7', 'width': 108}, {'height': 162, 'url': 'https://external-preview.redd.it/yyitn6nIaTvQgpCD_5A6u13GlpD_YPdPCGJIrrECUPQ.jpg?width=216&amp;crop=smart&amp;auto=webp&amp;s=25ff8ecd5145428aeba863b8bd7ecdb5a832e675', 'width': 216}, {'height': 240, 'url': 'https://external-preview.redd.it/yyitn6nIaTvQgpCD_5A6u13GlpD_YPdPCGJIrrECUPQ.jpg?width=320&amp;crop=smart&amp;auto=webp&amp;s=7fea947c4d9d5232d29305a109599fdee85d8885', 'width': 320}], 'source': {'height': 360, 'url': 'https://external-preview.redd.it/yyitn6nIaTvQgpCD_5A6u13GlpD_YPdPCGJIrrECUPQ.jpg?auto=webp&amp;s=a744e903c968266b7608b2d0d99d68bc8cad0bf7', 'width': 480}, 'variants': {}}]}",,,,,,,,,,,,,,,,,1600021015.0
70,[],False,sorvivordemigod,,[],,text,t2_64wu7469,False,False,[],False,False,1600017571,self.cults,https://www.reddit.com/r/cults/comments/is2ax2/hey_i_am_looking_for_books_that_are_a_guide_to/,{},is2ax2,True,False,False,False,True,True,False,,[],dark,text,False,False,True,2,0,False,no_ads,/r/cults/comments/is2ax2/hey_i_am_looking_for_books_that_are_a_guide_to/,False,0.0,1600047538,1,,True,False,False,cults,t5_2qzdi,61000,public,self,hey i am looking for books that are a guide to active cults,0,[],0.67,https://www.reddit.com/r/cults/comments/is2ax2/hey_i_am_looking_for_books_that_are_a_guide_to/,no_ads,0.0,,,,,,,,,,,,,,,,,,,
71,[],False,Guernic,,[],,text,t2_bczmh,False,False,[],False,False,1600010788,youtube.com,https://www.reddit.com/r/cults/comments/is07bt/love_has_wonheavens_gate_pt_1/,{},is07bt,True,False,False,False,True,False,False,,[],dark,text,False,False,False,10,0,False,no_ads,/r/cults/comments/is07bt/love_has_wonheavens_gate_pt_1/,False,0.0,1600043337,8,,True,False,False,cults,t5_2qzdi,60995,public,image,Love Has Won/Heaven's Gate pt 1,0,[],0.76,https://www.youtube.com/watch?v=FPzvGe32pF0,no_ads,0.0,rich:video,"{'enabled': False, 'images': [{'id': 'rDnKxgUDPnB3fblg4CoZ9twh0pL1lW9sqEYbnG8Hh9I', 'resolutions': [{'height': 81, 'url': 'https://external-preview.redd.it/_6qx2OHeug6uuQB4-MIMmpLM7Peqzd0DE_9JcKBvgfo.jpg?width=108&amp;crop=smart&amp;auto=webp&amp;s=8ef4ab17bf1567fa9f00f812f44423e9a0a5a2af', 'width': 108}, {'height': 162, 'url': 'https://external-preview.redd.it/_6qx2OHeug6uuQB4-MIMmpLM7Peqzd0DE_9JcKBvgfo.jpg?width=216&amp;crop=smart&amp;auto=webp&amp;s=d41d75a4fb5d2afc017c9411378f83d869b04d14', 'width': 216}, {'height': 240, 'url': 'https://external-preview.redd.it/_6qx2OHeug6uuQB4-MIMmpLM7Peqzd0DE_9JcKBvgfo.jpg?width=320&amp;crop=smart&amp;auto=webp&amp;s=a9c66b9159efbfe8182e2982c95c137790966c43', 'width': 320}], 'source': {'height': 360, 'url': 'https://external-preview.redd.it/_6qx2OHeug6uuQB4-MIMmpLM7Peqzd0DE_9JcKBvgfo.jpg?auto=webp&amp;s=42d6074e6aa7db33373f63536f813aaadb360596', 'width': 480}, 'variants': {}}]}",105.0,140.0,https://www.youtube.com/watch?v=FPzvGe32pF0,,,"{'oembed': {'author_name': 'GorexLord', 'author_url': 'https://www.youtube.com/channel/UCzcH1--6rmkMwNv6PIYWa6g', 'height': 338, 'html': '&lt;iframe width=""600"" height=""338"" src=""https://www.youtube.com/embed/FPzvGe32pF0?feature=oembed&amp;enablejsapi=1"" frameborder=""0"" allow=""accelerometer; autoplay; encrypted-media; gyroscope; picture-in-picture"" allowfullscreen&gt;&lt;/iframe&gt;', 'provider_name': 'YouTube', 'provider_url': 'https://www.youtube.com/', 'thumbnail_height': 360, 'thumbnail_url': 'https://i.ytimg.com/vi/FPzvGe32pF0/hqdefault.jpg', 'thumbnail_width': 480, 'title': ""Love Has Won/Heaven's Gate Pt 1"", 'type': 'video', 'version': '1.0', 'width': 600}, 'type': 'youtube.com'}","{'content': '&lt;iframe width=""600"" height=""338"" src=""https://www.youtube.com/embed/FPzvGe32pF0?feature=oembed&amp;enablejsapi=1"" frameborder=""0"" allow=""accelerometer; autoplay; encrypted-media; gyroscope; picture-in-picture"" allowfullscreen&gt;&lt;/iframe&gt;', 'height': 338, 'scrolling': False, 'width': 600}","{'oembed': {'author_name': 'GorexLord', 'author_url': 'https://www.youtube.com/channel/UCzcH1--6rmkMwNv6PIYWa6g', 'height': 338, 'html': '&lt;iframe width=""600"" height=""338"" src=""https://www.youtube.com/embed/FPzvGe32pF0?feature=oembed&amp;enablejsapi=1"" frameborder=""0"" allow=""accelerometer; autoplay; encrypted-media; gyroscope; picture-in-picture"" allowfullscreen&gt;&lt;/iframe&gt;', 'provider_name': 'YouTube', 'provider_url': 'https://www.youtube.com/', 'thumbnail_height': 360, 'thumbnail_url': 'https://i.ytimg.com/vi/FPzvGe32pF0/hqdefault.jpg', 'thumbnail_width': 480, 'title': ""Love Has Won/Heaven's Gate Pt 1"", 'type': 'video', 'version': '1.0', 'width': 600}, 'type': 'youtube.com'}","{'content': '&lt;iframe width=""600"" height=""338"" src=""https://www.youtube.com/embed/FPzvGe32pF0?feature=oembed&amp;enablejsapi=1"" frameborder=""0"" allow=""accelerometer; autoplay; encrypted-media; gyroscope; picture-in-picture"" allowfullscreen&gt;&lt;/iframe&gt;', 'height': 338, 'media_domain_url': 'https://www.redditmedia.com/mediaembed/is07bt', 'scrolling': False, 'width': 600}",,,,,,,,
72,[],False,chrisallenyates,,[],,text,t2_5sxt6sgr,False,False,[],False,False,1600008857,self.cults,https://www.reddit.com/r/cults/comments/irzmoj/cults_in_our_midst/,{},irzmoj,True,False,False,False,True,True,False,,[],dark,text,False,False,True,0,0,False,no_ads,/r/cults/comments/irzmoj/cults_in_our_midst/,False,0.0,1600042208,1,"I recently finally was able to get a copy of Marget Thaler Singer's book Cults in Our Midst. I really couldn't find a decently priced copy for a long time and finally found one. 

I've read reviews that its a great read, but was wondering if anyone here has any thoughts/reviews/comments on the content.",True,False,False,cults,t5_2qzdi,60993,public,self,Cults in Our Midst,0,[],0.67,https://www.reddit.com/r/cults/comments/irzmoj/cults_in_our_midst/,no_ads,0.0,,,,,,,,,,,,,,,,,,,
73,[],False,fansometwoer,,[],,text,t2_3s9kaegu,False,False,[],False,False,1600003871,self.cults,https://www.reddit.com/r/cults/comments/irybn3/manipulation_by_gaslighting/,{},irybn3,True,False,False,False,True,True,False,,[],dark,text,False,False,True,2,0,False,no_ads,/r/cults/comments/irybn3/manipulation_by_gaslighting/,False,0.0,1600038914,1,https://youtu.be/qWrgSZ593JY,True,False,False,cults,t5_2qzdi,60992,public,self,Manipulation by Gaslighting,0,[],1.0,https://www.reddit.com/r/cults/comments/irybn3/manipulation_by_gaslighting/,no_ads,0.0,self,"{'enabled': False, 'images': [{'id': 'pxrOXc6m58g2PUhiADzGeVKkO2AOBdFDpl5EeqHZ2UI', 'resolutions': [{'height': 81, 'url': 'https://external-preview.redd.it/JCS9hAh1BvEdHSL8OACWPMvd-FPlsGZjaEr2fCjPaYY.jpg?width=108&amp;crop=smart&amp;auto=webp&amp;s=d76888cd6794ac4b5615290c99aa9a977d79de0b', 'width': 108}, {'height': 162, 'url': 'https://external-preview.redd.it/JCS9hAh1BvEdHSL8OACWPMvd-FPlsGZjaEr2fCjPaYY.jpg?width=216&amp;crop=smart&amp;auto=webp&amp;s=3cbec44b5e31c816823ef3ede41e9ff4317caaea', 'width': 216}, {'height': 240, 'url': 'https://external-preview.redd.it/JCS9hAh1BvEdHSL8OACWPMvd-FPlsGZjaEr2fCjPaYY.jpg?width=320&amp;crop=smart&amp;auto=webp&amp;s=56e74e190436b468d5b4a28efe10dcbeade6b7b7', 'width': 320}], 'source': {'height': 360, 'url': 'https://external-preview.redd.it/JCS9hAh1BvEdHSL8OACWPMvd-FPlsGZjaEr2fCjPaYY.jpg?auto=webp&amp;s=a213533ddba0b9b7fb11c514ad3acaa218532e0f', 'width': 480}, 'variants': {}}]}",,,,,,,,,,,,,,,,,
74,[],False,[deleted],,,,,,,,[],False,False,1599995313,self.cults,https://www.reddit.com/r/cults/comments/irwe1v/questions_of_having_a_relationship_with_the_inc/,{},irwe1v,False,False,False,False,False,True,False,,[],dark,text,False,False,True,2,0,False,no_ads,/r/cults/comments/irwe1v/questions_of_having_a_relationship_with_the_inc/,False,0.0,1600032698,1,[deleted],True,False,False,cults,t5_2qzdi,60989,public,default,Questions of having a relationship with the INC (iglesia ni cristo) member...,0,[],1.0,https://www.reddit.com/r/cults/comments/irwe1v/questions_of_having_a_relationship_with_the_inc/,no_ads,0.0,,,,,,,,,,,,,,,,dark,deleted,,1599995521.0
