,all_awardings,allow_live_comments,author,author_flair_css_class,author_flair_richtext,author_flair_text,author_flair_type,author_fullname,author_patreon_flair,author_premium,awarders,can_mod_post,contest_mode,created_utc,domain,full_link,gildings,id,is_crosspostable,is_meta,is_original_content,is_reddit_media_domain,is_robot_indexable,is_self,is_video,link_flair_background_color,link_flair_richtext,link_flair_text_color,link_flair_type,locked,media_only,no_follow,num_comments,num_crossposts,over_18,parent_whitelist_status,permalink,pinned,pwls,retrieved_on,score,selftext,send_replies,spoiler,stickied,subreddit,subreddit_id,subreddit_subscribers,subreddit_type,thumbnail,title,total_awards_received,treatment_tags,upvote_ratio,url,whitelist_status,wls,post_hint,preview,thumbnail_height,thumbnail_width,url_overridden_by_dest,crosspost_parent,crosspost_parent_list,media,media_embed,secure_media,secure_media_embed,gallery_data,is_gallery,media_metadata,author_flair_background_color,author_flair_text_color,removed_by_category,poll_data,edited
0,[],False,jessiesoutier,,[],,text,t2_7uakn6wb,False,False,[],False,False,1600555927,self.cults,https://www.reddit.com/r/cults/comments/iw2gyr/cults_sit_down_lets_have_a_chat/,{},iw2gyr,True,False,False,False,True,True,False,,[],dark,text,False,False,True,0,0,False,no_ads,/r/cults/comments/iw2gyr/cults_sit_down_lets_have_a_chat/,False,0.0,1600555938,1,"Okay so I'm only going to say this once and no I won't be replying to anybody because again I'm only saying this once if you ,your brother ,your sister, your mother, your cousin, your boyfriend whoever says that they are in a cult they are most certainly not in a cult I got a feeling half of y'all don't know what a cult is Cults are really secretive they will not let anybody who is in their cult tell others who r  not in that cult that they are currently active and if you tell those people they will most certainly be killed probably the next day or a few days after that because people will be watching you because it's a CULT it doesn't matter what type of cult it is bloodthirsty or not because they don't want information about them getting out so whoever you told they r probably gonna  be kidnapped sold or killed so thats how u know that they're not in a cult 

And I know some of you might want to think that it is cool to say that you're in a cult but I guarantee you if something happens that they call upon you or called you out you will not like what happened if you say that you are in a cult and you're not just like when you say that you're in a gang and you're not you will get your ass killed and you'll never be seen again so stop before you really do get envolved with shit you dont wanna be envolved with",True,False,False,cults,t5_2qzdi,61518,public,self,"Cults ,sit down lets have a chat",0,[],1.0,https://www.reddit.com/r/cults/comments/iw2gyr/cults_sit_down_lets_have_a_chat/,no_ads,0.0,,,,,,,,,,,,,,,,,,,
1,[],False,bob101910,,[],,text,t2_5k2rn,False,False,[],False,False,1600551498,self.cults,https://www.reddit.com/r/cults/comments/iw1bdp/in_new_paris_hilton_documentary_she_talks_about/,{},iw1bdp,True,False,False,False,True,True,False,,[],dark,text,False,False,True,0,0,False,no_ads,/r/cults/comments/iw1bdp/in_new_paris_hilton_documentary_she_talks_about/,False,0.0,1600551509,1,"By schools, definitely cults. It's scary knowing how many she went to and that even rich families aren't safe.",True,False,False,cults,t5_2qzdi,61508,public,self,"In New Paris Hilton documentary, she talks about some of the ""schools"" she was sent to",0,[],1.0,https://www.reddit.com/r/cults/comments/iw1bdp/in_new_paris_hilton_documentary_she_talks_about/,no_ads,0.0,,,,,,,,,,,,,,,,,,,
2,[],False,Horizon2910,,[],,text,t2_4pzej9fb,False,False,[],False,False,1600550878,self.cults,https://www.reddit.com/r/cults/comments/iw15e5/tom_cruise/,{},iw15e5,True,False,False,False,True,True,False,,[],dark,text,False,False,True,9,0,False,no_ads,/r/cults/comments/iw15e5/tom_cruise/,False,0.0,1600550889,1,I’ve heard of some cult he’s in (source=my sister told me) is this true,True,False,False,cults,t5_2qzdi,61506,public,self,Tom cruise,0,[],1.0,https://www.reddit.com/r/cults/comments/iw15e5/tom_cruise/,no_ads,0.0,,,,,,,,,,,,,,,,,,,
3,[],False,Cuboner420,,[],,text,t2_q02tvul,False,False,[],False,False,1600541491,imgur.com,https://www.reddit.com/r/cults/comments/ivye32/for_the_past_5_years_i_have_been_hunting_down/,{},ivye32,True,False,False,False,True,False,False,,[],dark,text,False,False,True,15,0,False,no_ads,/r/cults/comments/ivye32/for_the_past_5_years_i_have_been_hunting_down/,False,0.0,1600541503,1,,True,False,False,cults,t5_2qzdi,61493,public,default,For the past 5 years I have been hunting down items from Jonestown and The Peoples Temple. This is a gallery of some of the highlights and most rare pieces.,0,[],1.0,https://imgur.com/gallery/lZ5Rmth,no_ads,0.0,link,"{'enabled': False, 'images': [{'id': 'Nu2IMM3Jts84zvvoai5D57e_Fjg2hg_fnfswQVCKQR0', 'resolutions': [{'height': 56, 'url': 'https://external-preview.redd.it/jCMqdQmQpRJ2wJvla258uLaFuSO1LCRyqRTJEvwmWKs.jpg?width=108&amp;crop=smart&amp;auto=webp&amp;s=8cee991d4859637d58067a28a4700f130e63235b', 'width': 108}, {'height': 113, 'url': 'https://external-preview.redd.it/jCMqdQmQpRJ2wJvla258uLaFuSO1LCRyqRTJEvwmWKs.jpg?width=216&amp;crop=smart&amp;auto=webp&amp;s=491ef2fa9a02a8854e8748b51bdd700711f244b8', 'width': 216}, {'height': 168, 'url': 'https://external-preview.redd.it/jCMqdQmQpRJ2wJvla258uLaFuSO1LCRyqRTJEvwmWKs.jpg?width=320&amp;crop=smart&amp;auto=webp&amp;s=3c1fafbed9c02eb08782c18eb7b8804eedaf0a2e', 'width': 320}], 'source': {'height': 315, 'url': 'https://external-preview.redd.it/jCMqdQmQpRJ2wJvla258uLaFuSO1LCRyqRTJEvwmWKs.jpg?auto=webp&amp;s=b53cca2826f2ed15214fe6fd8d94365488637335', 'width': 600}, 'variants': {}}]}",73.0,140.0,https://imgur.com/gallery/lZ5Rmth,,,,,,,,,,,,,,
4,[],False,spanks27,,[],,text,t2_6qoeju0y,False,False,[],False,False,1600531774,self.cults,https://www.reddit.com/r/cults/comments/ivvcvg/how_do_i_get_out_he_already_fucked_my_wife_and/,{},ivvcvg,True,False,False,False,True,True,False,,[],dark,text,False,False,True,3,0,False,no_ads,/r/cults/comments/ivvcvg/how_do_i_get_out_he_already_fucked_my_wife_and/,False,0.0,1600531785,1,,True,False,False,cults,t5_2qzdi,61482,public,self,How do i get out he already fucked my wife and took my retirement money. My kids are completely brainwashed.,0,[],1.0,https://www.reddit.com/r/cults/comments/ivvcvg/how_do_i_get_out_he_already_fucked_my_wife_and/,no_ads,0.0,,,,,,,,,,,,,,,,,,,
5,[],False,wayne_joe,,[],,text,t2_5k14v3v7,False,False,[],False,False,1600527104,self.cults,https://www.reddit.com/r/cults/comments/ivtx5e/daytona_beach_raven_church_a_suspicious_church_in/,{},ivtx5e,True,False,False,False,True,True,False,,[],dark,text,False,False,True,1,0,False,no_ads,/r/cults/comments/ivtx5e/daytona_beach_raven_church_a_suspicious_church_in/,False,0.0,1600527117,1,,True,False,False,cults,t5_2qzdi,61477,public,self,"Daytona Beach Raven Church : A suspicious church in daytona beach florida :: they took my friend’s best friend and she is totally lost and gave up her beautiful life, talents, smarts and family . So sad",0,[],1.0,https://www.reddit.com/r/cults/comments/ivtx5e/daytona_beach_raven_church_a_suspicious_church_in/,no_ads,0.0,,,,,,,,,,,,,,,,,,,
6,[],False,Patroclus_trash,,[],,text,t2_7t0sryq4,False,False,[],False,False,1600526881,self.cults,https://www.reddit.com/r/cults/comments/ivturr/my_boyfriend_is_in_a_cult_please_help/,{},ivturr,True,False,False,False,True,True,False,,[],dark,text,False,False,True,37,0,False,no_ads,/r/cults/comments/ivturr/my_boyfriend_is_in_a_cult_please_help/,False,0.0,1600526891,1,"I don't know if this fits here, but I'm desperate. 

He got in about an year ago because of drama and eventual breakup with his ex-boyfriend. Since then his mother put him in a Christian cult. 

The cult's name is ""Пробуждане"" or in English the literal translation would be ""Awakening"" ( I know even the name sounds cultish.) I don't know what to do, how to get him out, especially because his mother is part of the cult and is the one encouraging him. 

We have gotten in arguments about this cult before, but it is today that he finally told me the name of the church (He was refusing to tell me before.) and that I could finally do some research that only confirmed my concerns about this church being a money-hungry cult. I don't know how to get him out and many of our friends are concerned as well. We are all really scared for him.",True,False,False,cults,t5_2qzdi,61477,public,self,"MY BOYFRIEND IS IN A CULT, PLEASE HELP!",0,[],1.0,https://www.reddit.com/r/cults/comments/ivturr/my_boyfriend_is_in_a_cult_please_help/,no_ads,0.0,,,,,,,,,,,,,,,,,,,
7,[],False,CultAwarenessNetwork,,[],,text,t2_6oe6jdx8,False,False,[],False,False,1600487106,i.redd.it,https://www.reddit.com/r/cults/comments/ivl5oo/theres_wisdom_for_me_and_wisdom_for_you_peasants/,{},ivl5oo,True,False,False,True,True,False,False,,[],dark,text,False,False,True,0,0,False,no_ads,/r/cults/comments/ivl5oo/theres_wisdom_for_me_and_wisdom_for_you_peasants/,False,0.0,1600487117,1,,False,False,False,cults,t5_2qzdi,61450,public,image,"""There's wisdom for me and wisdom for you peasants... """,0,[],1.0,https://i.redd.it/1snjjxc301o51.jpg,no_ads,0.0,image,"{'enabled': True, 'images': [{'id': 'NrLmqt6zxZXlrWVpq79z1UBrT_hcI5pd7tnRrmRvPQw', 'resolutions': [{'height': 79, 'url': 'https://preview.redd.it/1snjjxc301o51.jpg?width=108&amp;crop=smart&amp;auto=webp&amp;s=93719010418dbba95686b797759b458df028a3e7', 'width': 108}, {'height': 159, 'url': 'https://preview.redd.it/1snjjxc301o51.jpg?width=216&amp;crop=smart&amp;auto=webp&amp;s=633429ec2b5a446b1c67677e289d1b866ee4064d', 'width': 216}, {'height': 236, 'url': 'https://preview.redd.it/1snjjxc301o51.jpg?width=320&amp;crop=smart&amp;auto=webp&amp;s=8ae95646872fd6e67594f663cc1c3ab4974ab0ee', 'width': 320}, {'height': 473, 'url': 'https://preview.redd.it/1snjjxc301o51.jpg?width=640&amp;crop=smart&amp;auto=webp&amp;s=d9bc722a916ef71611cfead65a062004ee781271', 'width': 640}], 'source': {'height': 591, 'url': 'https://preview.redd.it/1snjjxc301o51.jpg?auto=webp&amp;s=ecdc5035e36dd915bd870bbb89e83a7166930b90', 'width': 798}, 'variants': {}}]}",103.0,140.0,https://i.redd.it/1snjjxc301o51.jpg,t3_ivl4un,"[{'all_awardings': [], 'allow_live_comments': False, 'approved_at_utc': None, 'approved_by': None, 'archived': False, 'author': 'CultAwarenessNetwork', 'author_flair_background_color': None, 'author_flair_css_class': None, 'author_flair_richtext': [], 'author_flair_template_id': None, 'author_flair_text': None, 'author_flair_text_color': None, 'author_flair_type': 'text', 'author_fullname': 't2_6oe6jdx8', 'author_patreon_flair': False, 'author_premium': False, 'awarders': [], 'banned_at_utc': None, 'banned_by': None, 'can_gild': True, 'can_mod_post': False, 'category': None, 'clicked': False, 'content_categories': None, 'contest_mode': False, 'created': 1600515815.0, 'created_utc': 1600487015.0, 'discussion_type': None, 'distinguished': None, 'domain': 'i.redd.it', 'downs': 0, 'edited': False, 'gilded': 0, 'gildings': {}, 'hidden': False, 'hide_score': True, 'id': 'ivl4un', 'is_crosspostable': True, 'is_meta': False, 'is_original_content': False, 'is_reddit_media_domain': True, 'is_robot_indexable': True, 'is_self': False, 'is_video': False, 'likes': None, 'link_flair_background_color': '', 'link_flair_css_class': None, 'link_flair_richtext': [], 'link_flair_text': None, 'link_flair_text_color': 'dark', 'link_flair_type': 'text', 'locked': False, 'media': None, 'media_embed': {}, 'media_only': False, 'mod_note': None, 'mod_reason_by': None, 'mod_reason_title': None, 'mod_reports': [], 'name': 't3_ivl4un', 'no_follow': True, 'num_comments': 0, 'num_crossposts': 1, 'num_reports': None, 'over_18': False, 'parent_whitelist_status': None, 'permalink': '/r/chicoinescultreport/comments/ivl4un/garys_double_standard_wisdom/', 'pinned': False, 'post_hint': 'image', 'preview': {'enabled': True, 'images': [{'id': 'NrLmqt6zxZXlrWVpq79z1UBrT_hcI5pd7tnRrmRvPQw', 'resolutions': [{'height': 79, 'url': 'https://preview.redd.it/1snjjxc301o51.jpg?width=108&amp;crop=smart&amp;auto=webp&amp;s=93719010418dbba95686b797759b458df028a3e7', 'width': 108}, {'height': 159, 'url': 'https://preview.redd.it/1snjjxc301o51.jpg?width=216&amp;crop=smart&amp;auto=webp&amp;s=633429ec2b5a446b1c67677e289d1b866ee4064d', 'width': 216}, {'height': 236, 'url': 'https://preview.redd.it/1snjjxc301o51.jpg?width=320&amp;crop=smart&amp;auto=webp&amp;s=8ae95646872fd6e67594f663cc1c3ab4974ab0ee', 'width': 320}, {'height': 473, 'url': 'https://preview.redd.it/1snjjxc301o51.jpg?width=640&amp;crop=smart&amp;auto=webp&amp;s=d9bc722a916ef71611cfead65a062004ee781271', 'width': 640}], 'source': {'height': 591, 'url': 'https://preview.redd.it/1snjjxc301o51.jpg?auto=webp&amp;s=ecdc5035e36dd915bd870bbb89e83a7166930b90', 'width': 798}, 'variants': {}}]}, 'pwls': None, 'quarantine': False, 'removal_reason': None, 'removed_by': None, 'removed_by_category': None, 'report_reasons': None, 'saved': False, 'score': 1, 'secure_media': None, 'secure_media_embed': {}, 'selftext': '', 'selftext_html': None, 'send_replies': True, 'spoiler': False, 'stickied': False, 'subreddit': 'chicoinescultreport', 'subreddit_id': 't5_2taz87', 'subreddit_name_prefixed': 'r/chicoinescultreport', 'subreddit_subscribers': 30, 'subreddit_type': 'public', 'suggested_sort': None, 'thumbnail': 'https://b.thumbs.redditmedia.com/BWYydb14RV0blHdYsYQytai-thpCwZMJjxs8qumiCls.jpg', 'thumbnail_height': 103, 'thumbnail_width': 140, 'title': ""Gary's double standard wisdom"", 'top_awarded_type': None, 'total_awards_received': 0, 'treatment_tags': [], 'ups': 1, 'upvote_ratio': 1.0, 'url': 'https://i.redd.it/1snjjxc301o51.jpg', 'url_overridden_by_dest': 'https://i.redd.it/1snjjxc301o51.jpg', 'user_reports': [], 'view_count': None, 'visited': False, 'whitelist_status': None, 'wls': None}]",,,,,,,,,,,,
8,[],False,CultAwarenessNetwork,,[],,text,t2_6oe6jdx8,False,False,[],False,False,1600482421,i.redd.it,https://www.reddit.com/r/cults/comments/ivk07c/a_gift_sent_my_way_by_the_baba_kalki_cult_for/,{},ivk07c,True,False,False,True,True,False,False,,[],dark,text,False,False,True,23,0,False,no_ads,/r/cults/comments/ivk07c/a_gift_sent_my_way_by_the_baba_kalki_cult_for/,False,0.0,1600482432,1,,False,False,False,cults,t5_2qzdi,61441,public,image,A gift sent my way by the Baba Kalki Cult for refusing to return and insulting them (years ago),0,[],1.0,https://i.redd.it/91z4oryul0o51.jpg,no_ads,0.0,image,"{'enabled': True, 'images': [{'id': 'kjg91W51I1U2G2WPXW09s68se6LJmfRMdlK4CUwQjBM', 'resolutions': [{'height': 144, 'url': 'https://preview.redd.it/91z4oryul0o51.jpg?width=108&amp;crop=smart&amp;auto=webp&amp;s=94df335c33bbcdf6d4f97e29c41099dfd2fdaf83', 'width': 108}, {'height': 288, 'url': 'https://preview.redd.it/91z4oryul0o51.jpg?width=216&amp;crop=smart&amp;auto=webp&amp;s=b537c8a019203162ef60dcb2590336ec902b5038', 'width': 216}, {'height': 426, 'url': 'https://preview.redd.it/91z4oryul0o51.jpg?width=320&amp;crop=smart&amp;auto=webp&amp;s=a8ddbbb7cfb1cfc37c1291de169b4dae36873452', 'width': 320}, {'height': 853, 'url': 'https://preview.redd.it/91z4oryul0o51.jpg?width=640&amp;crop=smart&amp;auto=webp&amp;s=ec6e69168531417d03732dbfad66aad66c668211', 'width': 640}, {'height': 1280, 'url': 'https://preview.redd.it/91z4oryul0o51.jpg?width=960&amp;crop=smart&amp;auto=webp&amp;s=5dc845ef1b6a8b198e5b0219b2c3954a04382c5f', 'width': 960}, {'height': 1440, 'url': 'https://preview.redd.it/91z4oryul0o51.jpg?width=1080&amp;crop=smart&amp;auto=webp&amp;s=34de94b4b89545be5808f08955b5ac3bdb3d756e', 'width': 1080}], 'source': {'height': 4160, 'url': 'https://preview.redd.it/91z4oryul0o51.jpg?auto=webp&amp;s=769876651f21bc62252831ffda33f0083a529b4b', 'width': 3120}, 'variants': {}}]}",140.0,140.0,https://i.redd.it/91z4oryul0o51.jpg,t3_ivjyiv,"[{'all_awardings': [], 'allow_live_comments': False, 'approved_at_utc': None, 'approved_by': None, 'archived': False, 'author': 'CultAwarenessNetwork', 'author_flair_background_color': None, 'author_flair_css_class': None, 'author_flair_richtext': [], 'author_flair_template_id': None, 'author_flair_text': None, 'author_flair_text_color': None, 'author_flair_type': 'text', 'author_fullname': 't2_6oe6jdx8', 'author_patreon_flair': False, 'author_premium': False, 'awarders': [], 'banned_at_utc': None, 'banned_by': None, 'can_gild': True, 'can_mod_post': False, 'category': None, 'clicked': False, 'content_categories': None, 'contest_mode': False, 'created': 1600511031.0, 'created_utc': 1600482231.0, 'discussion_type': None, 'distinguished': None, 'domain': 'i.redd.it', 'downs': 0, 'edited': False, 'gilded': 0, 'gildings': {}, 'hidden': False, 'hide_score': True, 'id': 'ivjyiv', 'is_crosspostable': True, 'is_meta': False, 'is_original_content': False, 'is_reddit_media_domain': True, 'is_robot_indexable': True, 'is_self': False, 'is_video': False, 'likes': None, 'link_flair_background_color': '', 'link_flair_css_class': None, 'link_flair_richtext': [], 'link_flair_text': None, 'link_flair_text_color': 'dark', 'link_flair_type': 'text', 'locked': False, 'media': None, 'media_embed': {}, 'media_only': False, 'mod_note': None, 'mod_reason_by': None, 'mod_reason_title': None, 'mod_reports': [], 'name': 't3_ivjyiv', 'no_follow': True, 'num_comments': 0, 'num_crossposts': 1, 'num_reports': None, 'over_18': False, 'parent_whitelist_status': None, 'permalink': '/r/chicoinescultreport/comments/ivjyiv/a_little_gift_sent_by_the_baba_kalki_cult_to_show/', 'pinned': False, 'post_hint': 'image', 'preview': {'enabled': True, 'images': [{'id': 'kjg91W51I1U2G2WPXW09s68se6LJmfRMdlK4CUwQjBM', 'resolutions': [{'height': 144, 'url': 'https://preview.redd.it/91z4oryul0o51.jpg?width=108&amp;crop=smart&amp;auto=webp&amp;s=94df335c33bbcdf6d4f97e29c41099dfd2fdaf83', 'width': 108}, {'height': 288, 'url': 'https://preview.redd.it/91z4oryul0o51.jpg?width=216&amp;crop=smart&amp;auto=webp&amp;s=b537c8a019203162ef60dcb2590336ec902b5038', 'width': 216}, {'height': 426, 'url': 'https://preview.redd.it/91z4oryul0o51.jpg?width=320&amp;crop=smart&amp;auto=webp&amp;s=a8ddbbb7cfb1cfc37c1291de169b4dae36873452', 'width': 320}, {'height': 853, 'url': 'https://preview.redd.it/91z4oryul0o51.jpg?width=640&amp;crop=smart&amp;auto=webp&amp;s=ec6e69168531417d03732dbfad66aad66c668211', 'width': 640}, {'height': 1280, 'url': 'https://preview.redd.it/91z4oryul0o51.jpg?width=960&amp;crop=smart&amp;auto=webp&amp;s=5dc845ef1b6a8b198e5b0219b2c3954a04382c5f', 'width': 960}, {'height': 1440, 'url': 'https://preview.redd.it/91z4oryul0o51.jpg?width=1080&amp;crop=smart&amp;auto=webp&amp;s=34de94b4b89545be5808f08955b5ac3bdb3d756e', 'width': 1080}], 'source': {'height': 4160, 'url': 'https://preview.redd.it/91z4oryul0o51.jpg?auto=webp&amp;s=769876651f21bc62252831ffda33f0083a529b4b', 'width': 3120}, 'variants': {}}]}, 'pwls': None, 'quarantine': False, 'removal_reason': None, 'removed_by': None, 'removed_by_category': None, 'report_reasons': None, 'saved': False, 'score': 1, 'secure_media': None, 'secure_media_embed': {}, 'selftext': '', 'selftext_html': None, 'send_replies': True, 'spoiler': False, 'stickied': False, 'subreddit': 'chicoinescultreport', 'subreddit_id': 't5_2taz87', 'subreddit_name_prefixed': 'r/chicoinescultreport', 'subreddit_subscribers': 30, 'subreddit_type': 'public', 'suggested_sort': None, 'thumbnail': 'https://b.thumbs.redditmedia.com/zgEfefpaovLS3MtxYvi8oCaBmaKc3vQUFe8yGakyXxI.jpg', 'thumbnail_height': 140, 'thumbnail_width': 140, 'title': 'A little gift sent by the Baba Kalki cult to show appreciation (years ago)', 'top_awarded_type': None, 'total_awards_received': 0, 'treatment_tags': [], 'ups': 1, 'upvote_ratio': 1.0, 'url': 'https://i.redd.it/91z4oryul0o51.jpg', 'url_overridden_by_dest': 'https://i.redd.it/91z4oryul0o51.jpg', 'user_reports': [], 'view_count': None, 'visited': False, 'whitelist_status': None, 'wls': None}]",,,,,,,,,,,,
9,[],False,Cuboner420,,[],,text,t2_q02tvul,False,False,[],False,False,1600464122,i.redd.it,https://www.reddit.com/r/cults/comments/ivevxw/the_adventures_of_david_koresh_in_the_temple_of/,{},ivevxw,True,False,False,True,True,False,False,,[],dark,text,False,False,True,2,0,False,no_ads,/r/cults/comments/ivevxw/the_adventures_of_david_koresh_in_the_temple_of/,False,0.0,1600464133,1,,True,False,False,cults,t5_2qzdi,61409,public,image,‘The Adventures of David Koresh in the Temple of Doom.’ Vintage souvenir shirt sold at the Waco siege in 1993,0,[],1.0,https://i.redd.it/xq5tz9w04zn51.jpg,no_ads,0.0,image,"{'enabled': True, 'images': [{'id': 'e84pThAsdYDZUSf5nCGAG1UcJeWbcUSG9cQceDrOxco', 'resolutions': [{'height': 119, 'url': 'https://preview.redd.it/xq5tz9w04zn51.jpg?width=108&amp;crop=smart&amp;auto=webp&amp;s=1a37c73fce4659b1f87769e56f716844bcfbe4dc', 'width': 108}, {'height': 238, 'url': 'https://preview.redd.it/xq5tz9w04zn51.jpg?width=216&amp;crop=smart&amp;auto=webp&amp;s=56e292dcbcd3855058c38a539d86b15a6176bf32', 'width': 216}, {'height': 354, 'url': 'https://preview.redd.it/xq5tz9w04zn51.jpg?width=320&amp;crop=smart&amp;auto=webp&amp;s=4ad0f5d3cd43a1df56b406e826cb5e000af25115', 'width': 320}, {'height': 708, 'url': 'https://preview.redd.it/xq5tz9w04zn51.jpg?width=640&amp;crop=smart&amp;auto=webp&amp;s=fb6218e131053e2a5c3e6e68d09539013d43706f', 'width': 640}], 'source': {'height': 916, 'url': 'https://preview.redd.it/xq5tz9w04zn51.jpg?auto=webp&amp;s=4effe4f800f0db12922f7edabe0d7ded2715a2e7', 'width': 828}, 'variants': {}}]}",140.0,140.0,https://i.redd.it/xq5tz9w04zn51.jpg,,,,,,,,,,,,,,
10,[],False,Balthactor,,[],,text,t2_ujjw3,False,False,[],False,False,1600463622,self.cults,https://www.reddit.com/r/cults/comments/iveqd0/shree_maa/,{},iveqd0,True,False,False,False,True,True,False,,[],dark,text,False,False,True,1,0,False,no_ads,/r/cults/comments/iveqd0/shree_maa/,False,0.0,1600463633,1,"Does anyone know anything about this group, built around a ""living goddess""? In dire straights my girlfriend and I happened into a community associated with them, and they are actively involved in covering up some unsavory stuff.",True,False,False,cults,t5_2qzdi,61408,public,self,Shree Maa,0,[],1.0,https://www.reddit.com/r/cults/comments/iveqd0/shree_maa/,no_ads,0.0,,,,,,,,,,,,,,,,,,,
