73,[],False,Matthew_Umbarger,,[],,text,t2_a75pbo83,False,False,[],False,False,1613014059,smokingaziggurat.com,https://www.reddit.com/r/religion/comments/lhbt12/the_food_of_the_dead/,{},lhbt12,True,False,False,False,True,False,False,,[],dark,text,False,False,False,0,0,False,all_ads,/r/religion/comments/lhbt12/the_food_of_the_dead/,False,6,1613015079,0,,True,False,False,religion,t5_2qh39,62472,public,https://b.thumbs.redditmedia.com/qxyjKkr9C5K5TbeT1Q7CQjEQrZrLpgrvMy05t99lClY.jpg,The Food of the Dead,0,[],0.5,https://smokingaziggurat.com/the-food-of-the-dead-my-first-vlog-post/,all_ads,6,,link,"{'enabled': False, 'images': [{'id': 'qXUy_qZ0svhmoowOq9QLkOY-YJS06-3WTRjq7REUF3s', 'resolutions': [{'height': 216, 'url': 'https://external-preview.redd.it/yAMQ1CUFsG5j-VUbkIbzzJVxQAT_8xX_Lx36foNmK6E.jpg?width=108&amp;crop=smart&amp;auto=webp&amp;s=1c1769efbf9aae7d3f03f6b05f123501b6492925', 'width': 108}, {'height': 432, 'url': 'https://external-preview.redd.it/yAMQ1CUFsG5j-VUbkIbzzJVxQAT_8xX_Lx36foNmK6E.jpg?width=216&amp;crop=smart&amp;auto=webp&amp;s=44bd3ff0318dfeecb1ebeddc4e9fde76817f22a3', 'width': 216}], 'source': {'height': 501, 'url': 'https://external-preview.redd.it/yAMQ1CUFsG5j-VUbkIbzzJVxQAT_8xX_Lx36foNmK6E.jpg?auto=webp&amp;s=e909e44cab8e210e295a0c699e76343ae1f8dcff', 'width': 220}, 'variants': {}}]}",140.0,140.0,https://smokingaziggurat.com/the-food-of-the-dead-my-first-vlog-post/,,,,,,,,,,,,
74,[],False,Maverick4209,,[],Eclectic Pagan/Non-theistic Satanist,text,t2_3h4sm1bw,False,False,[],False,False,1613012005,self.religion,https://www.reddit.com/r/religion/comments/lhb6i9/how_do_you_deal_with_strangers_preaching_to_you/,{},lhb6i9,True,False,False,False,True,True,False,,[],dark,text,False,False,True,68,0,False,all_ads,/r/religion/comments/lhb6i9/how_do_you_deal_with_strangers_preaching_to_you/,False,6,1613013565,1,"I’ll try to keep this short and to the point, but no promises.

Religious background: 
for most of my life I’ve identified as a non-theistic Satanist with no ties to any organization, recently I’ve been dabbling into paganism and exploring my own spirituality(excluding Abrahamic faiths, I have a grudge and I’m biased. But I mostly keep it to myself unless I’m engaged in debates online) 

Situation: 
I have been driving for Lyft for the past 2 months. I have just over 500 rides completed with a perfect 5 star rating. Due to covid regulations we have to wear masks while riding with passengers in the car. I purchased a mask from the company Black Craft Cult that has an image of the Sigil of Baphomet with words “Believe in yourself” on it. 

Twice in the past month I’ve had 2 separate riders initiate a conversation with me that led to them preaching to me, saying they were going to pray for me(which I find highly, highly offensive btw) and suggesting me to different preachers and resources so I can “find Jesus” 

Normally, in an online environment I have no problem coming up with retorts and debating my position, however when confronted in person I froze up, I knew what I wanted to say, but I held back at risk of them reporting me to Lyft or giving me a bad review. And while I’m confident my religious rights would ultimately prevail, I just haven’t gotten the nerve to push the subject. What ended up happening was I awkwardly and politely just noted their concerns and said thank you. Even tho on the inside I was literally boiling with rage at the arrogance of these people. One of which was legitimately surprised when I informed him that I am happily married but didn’t go to church on Sundays. I heard him gasp out loud in my back seat.

Some other relevant notes: 

I live in California(not the Bible Belt), I dress sort of goth/punk whatever that means these days(piercings, tattoos, black clothing, leather jackets, combat boots). Not wearing my mask isn’t an option and suggesting so would be just as offensive as asking a Christian not to wear a cross. My tattoos are also visible and include various satanic and pagan images including upside crosses and pentagrams. So even if I didn’t wear my mask, people could still identify me as a Satanist/Pagan 

Questions:

How would others in my situation have handled this differently? Should I have been more firm with my desire to not be proselytized to? Why should I have to hide my beliefs or censor myself when others are free to openly judge and question my beliefs with impunity? Or should I just keep doing what I have been doing and just politely let them preach to me?",True,False,False,religion,t5_2qh39,62471,public,self,How do you deal with strangers preaching to you about their religion unsolicited?,0,[],1.0,https://www.reddit.com/r/religion/comments/lhb6i9/how_do_you_deal_with_strangers_preaching_to_you/,all_ads,6,,,,,,,,,,,e9960ca0-3f4e-11e4-87bd-12313d148adf,dark,,,,,1613012299.0,
75,[],False,SilverAssasin337,,[],,text,t2_kn5ydvr,False,False,[],False,False,1613010701,self.religion,https://www.reddit.com/r/religion/comments/lharaq/how_did_mesopotamian_religion_assyrian_babylonian/,{},lharaq,True,False,False,False,True,True,False,,[],dark,text,False,False,False,27,0,False,all_ads,/r/religion/comments/lharaq/how_did_mesopotamian_religion_assyrian_babylonian/,False,6,1613012596,3,,True,False,False,religion,t5_2qh39,62471,public,self,"How did Mesopotamian Religion (Assyrian, Babylonian) influence Christianity?",0,[],1.0,https://www.reddit.com/r/religion/comments/lharaq/how_did_mesopotamian_religion_assyrian_babylonian/,all_ads,6,,,,,,,,,,,,,,,,,,
76,[],False,jakovinspire,,[],,text,t2_825nr8cr,False,False,[],False,False,1613009180,anchor.fm,https://www.reddit.com/r/religion/comments/lha9jd/the_veil_of_truth_remember_how_the_veil_in_the/,{},lha9jd,True,False,False,False,True,False,False,,[],dark,text,False,False,True,4,0,False,all_ads,/r/religion/comments/lha9jd/the_veil_of_truth_remember_how_the_veil_in_the/,False,6,1613011471,1,,True,False,False,religion,t5_2qh39,62472,public,https://b.thumbs.redditmedia.com/pafTOqMtb349fStx_cntyw-WD5UI0cW27B688HoaZHo.jpg,The Veil of Truth: Remember how the veil in the temple was torn apart when Jesus died? What did it really mean to you?,0,[],1.0,https://anchor.fm/afrifa-osei-kwame-jnr/episodes/The-Veil-of-Truth-eq5ig2,all_ads,6,,link,"{'enabled': False, 'images': [{'id': 'A2qP_XcnZXAYnG7a6Vt0dMZJayf51QkfPk6IpgNtvGk', 'resolutions': [{'height': 108, 'url': 'https://external-preview.redd.it/9N_rqOSJQkjaDozS_kFgNvEZFUPefmCLZH1xCC0-r0c.jpg?width=108&amp;crop=smart&amp;auto=webp&amp;s=7c99f5c9fbc3593fdd73c9c3268e484f59add784', 'width': 108}, {'height': 216, 'url': 'https://external-preview.redd.it/9N_rqOSJQkjaDozS_kFgNvEZFUPefmCLZH1xCC0-r0c.jpg?width=216&amp;crop=smart&amp;auto=webp&amp;s=d1aeefe358ef8716573989609d1df06af5bf36c6', 'width': 216}, {'height': 320, 'url': 'https://external-preview.redd.it/9N_rqOSJQkjaDozS_kFgNvEZFUPefmCLZH1xCC0-r0c.jpg?width=320&amp;crop=smart&amp;auto=webp&amp;s=c5e1ff269f506e1687944af446153a0d2b3b6a32', 'width': 320}], 'source': {'height': 400, 'url': 'https://external-preview.redd.it/9N_rqOSJQkjaDozS_kFgNvEZFUPefmCLZH1xCC0-r0c.jpg?auto=webp&amp;s=3a049a5435f6d7552329ba706591283303fcbcea', 'width': 400}, 'variants': {}}]}",140.0,140.0,https://anchor.fm/afrifa-osei-kwame-jnr/episodes/The-Veil-of-Truth-eq5ig2,"{'oembed': {'author_name': 'The Veil of Truth by Kwame Afrifa Podcast Show', 'description': 'In this episode learn about the subtlety of the secondary principle and how it take foothold to control all aspect of human lives. We reveal the primary principle as the truth we need in other to form a new lifestyle that depicts our relationship with God.', 'height': 102, 'html': '&lt;iframe class=""embedly-embed"" src=""https://cdn.embedly.com/widgets/media.html?src=https%3A%2F%2Fanchor.fm%2Fafrifa-osei-kwame-jnr%2Fembed%2Fepisodes%2FThe-Veil-of-Truth-eq5ig2&amp;display_name=Anchor+FM+Inc.&amp;url=https%3A%2F%2Fanchor.fm%2Fafrifa-osei-kwame-jnr%2Fepisodes%2FThe-Veil-of-Truth-eq5ig2&amp;image=https%3A%2F%2Fd3t3ozftmdmh3i.cloudfront.net%2Fproduction%2Fpodcast_uploaded400%2F11547412%2F11547412-1609081638515-c8e39a4c381ba.jpg&amp;key=ed8fa8699ce04833838e66ce79ba05f1&amp;type=text%2Fhtml&amp;schema=anchor"" width=""400"" height=""102"" scrolling=""no"" title=""Anchor FM Inc. embed"" frameborder=""0"" allow=""autoplay; fullscreen"" allowfullscreen=""true""&gt;&lt;/iframe&gt;', 'provider_name': 'Anchor FM Inc.', 'provider_url': 'https://anchor.fm', 'thumbnail_height': 400, 'thumbnail_url': 'https://d3t3ozftmdmh3i.cloudfront.net/production/podcast_uploaded400/11547412/11547412-1609081638515-c8e39a4c381ba.jpg', 'thumbnail_width': 400, 'title': 'The Veil of Truth by Kwame Afrifa Podcast Show', 'type': 'rich', 'version': '1.0', 'width': 400}, 'type': 'anchor.fm'}","{'content': '&lt;iframe class=""embedly-embed"" src=""https://cdn.embedly.com/widgets/media.html?src=https%3A%2F%2Fanchor.fm%2Fafrifa-osei-kwame-jnr%2Fembed%2Fepisodes%2FThe-Veil-of-Truth-eq5ig2&amp;display_name=Anchor+FM+Inc.&amp;url=https%3A%2F%2Fanchor.fm%2Fafrifa-osei-kwame-jnr%2Fepisodes%2FThe-Veil-of-Truth-eq5ig2&amp;image=https%3A%2F%2Fd3t3ozftmdmh3i.cloudfront.net%2Fproduction%2Fpodcast_uploaded400%2F11547412%2F11547412-1609081638515-c8e39a4c381ba.jpg&amp;key=ed8fa8699ce04833838e66ce79ba05f1&amp;type=text%2Fhtml&amp;schema=anchor"" width=""400"" height=""102"" scrolling=""no"" title=""Anchor FM Inc. embed"" frameborder=""0"" allow=""autoplay; fullscreen"" allowfullscreen=""true""&gt;&lt;/iframe&gt;', 'height': 102, 'scrolling': False, 'width': 400}","{'oembed': {'author_name': 'The Veil of Truth by Kwame Afrifa Podcast Show', 'description': 'In this episode learn about the subtlety of the secondary principle and how it take foothold to control all aspect of human lives. We reveal the primary principle as the truth we need in other to form a new lifestyle that depicts our relationship with God.', 'height': 102, 'html': '&lt;iframe class=""embedly-embed"" src=""https://cdn.embedly.com/widgets/media.html?src=https%3A%2F%2Fanchor.fm%2Fafrifa-osei-kwame-jnr%2Fembed%2Fepisodes%2FThe-Veil-of-Truth-eq5ig2&amp;display_name=Anchor+FM+Inc.&amp;url=https%3A%2F%2Fanchor.fm%2Fafrifa-osei-kwame-jnr%2Fepisodes%2FThe-Veil-of-Truth-eq5ig2&amp;image=https%3A%2F%2Fd3t3ozftmdmh3i.cloudfront.net%2Fproduction%2Fpodcast_uploaded400%2F11547412%2F11547412-1609081638515-c8e39a4c381ba.jpg&amp;key=ed8fa8699ce04833838e66ce79ba05f1&amp;type=text%2Fhtml&amp;schema=anchor"" width=""400"" height=""102"" scrolling=""no"" title=""Anchor FM Inc. embed"" frameborder=""0"" allow=""autoplay; fullscreen"" allowfullscreen=""true""&gt;&lt;/iframe&gt;', 'provider_name': 'Anchor FM Inc.', 'provider_url': 'https://anchor.fm', 'thumbnail_height': 400, 'thumbnail_url': 'https://d3t3ozftmdmh3i.cloudfront.net/production/podcast_uploaded400/11547412/11547412-1609081638515-c8e39a4c381ba.jpg', 'thumbnail_width': 400, 'title': 'The Veil of Truth by Kwame Afrifa Podcast Show', 'type': 'rich', 'version': '1.0', 'width': 400}, 'type': 'anchor.fm'}","{'content': '&lt;iframe class=""embedly-embed"" src=""https://cdn.embedly.com/widgets/media.html?src=https%3A%2F%2Fanchor.fm%2Fafrifa-osei-kwame-jnr%2Fembed%2Fepisodes%2FThe-Veil-of-Truth-eq5ig2&amp;display_name=Anchor+FM+Inc.&amp;url=https%3A%2F%2Fanchor.fm%2Fafrifa-osei-kwame-jnr%2Fepisodes%2FThe-Veil-of-Truth-eq5ig2&amp;image=https%3A%2F%2Fd3t3ozftmdmh3i.cloudfront.net%2Fproduction%2Fpodcast_uploaded400%2F11547412%2F11547412-1609081638515-c8e39a4c381ba.jpg&amp;key=ed8fa8699ce04833838e66ce79ba05f1&amp;type=text%2Fhtml&amp;schema=anchor"" width=""400"" height=""102"" scrolling=""no"" title=""Anchor FM Inc. embed"" frameborder=""0"" allow=""autoplay; fullscreen"" allowfullscreen=""true""&gt;&lt;/iframe&gt;', 'height': 102, 'media_domain_url': 'https://www.redditmedia.com/mediaembed/lha9jd', 'scrolling': False, 'width': 400}",,,,t3_lgbi6c,"[{'all_awardings': [], 'allow_live_comments': False, 'approved_at_utc': None, 'approved_by': None, 'archived': False, 'author': 'jakovinspire', 'author_flair_background_color': None, 'author_flair_css_class': None, 'author_flair_richtext': [], 'author_flair_template_id': None, 'author_flair_text': None, 'author_flair_text_color': None, 'author_flair_type': 'text', 'author_fullname': 't2_825nr8cr', 'author_patreon_flair': False, 'author_premium': False, 'awarders': [], 'banned_at_utc': None, 'banned_by': None, 'can_gild': True, 'can_mod_post': False, 'category': None, 'clicked': False, 'content_categories': None, 'contest_mode': False, 'created': 1612928376.0, 'created_utc': 1612899576.0, 'discussion_type': None, 'distinguished': None, 'domain': 'anchor.fm', 'downs': 0, 'edited': False, 'gilded': 0, 'gildings': {}, 'hidden': False, 'hide_score': False, 'id': 'lgbi6c', 'is_crosspostable': True, 'is_meta': False, 'is_original_content': False, 'is_reddit_media_domain': False, 'is_robot_indexable': True, 'is_self': False, 'is_video': False, 'likes': None, 'link_flair_background_color': '', 'link_flair_css_class': None, 'link_flair_richtext': [], 'link_flair_text': None, 'link_flair_text_color': 'dark', 'link_flair_type': 'text', 'locked': False, 'media': {'oembed': {'author_name': 'The Veil of Truth by Kwame Afrifa Podcast Show', 'description': 'In this episode learn about the subtlety of the secondary principle and how it take foothold to control all aspect of human lives. We reveal the primary principle as the truth we need in other to form a new lifestyle that depicts our relationship with God.', 'height': 102, 'html': '&lt;iframe class=""embedly-embed"" src=""https://cdn.embedly.com/widgets/media.html?src=https%3A%2F%2Fanchor.fm%2Fafrifa-osei-kwame-jnr%2Fembed%2Fepisodes%2FThe-Veil-of-Truth-eq5ig2&amp;display_name=Anchor+FM+Inc.&amp;url=https%3A%2F%2Fanchor.fm%2Fafrifa-osei-kwame-jnr%2Fepisodes%2FThe-Veil-of-Truth-eq5ig2&amp;image=https%3A%2F%2Fd3t3ozftmdmh3i.cloudfront.net%2Fproduction%2Fpodcast_uploaded400%2F11547412%2F11547412-1609081638515-c8e39a4c381ba.jpg&amp;key=ed8fa8699ce04833838e66ce79ba05f1&amp;type=text%2Fhtml&amp;schema=anchor"" width=""400"" height=""102"" scrolling=""no"" title=""Anchor FM Inc. embed"" frameborder=""0"" allow=""autoplay; fullscreen"" allowfullscreen=""true""&gt;&lt;/iframe&gt;', 'provider_name': 'Anchor FM Inc.', 'provider_url': 'https://anchor.fm', 'thumbnail_height': 400, 'thumbnail_url': 'https://d3t3ozftmdmh3i.cloudfront.net/production/podcast_uploaded400/11547412/11547412-1609081638515-c8e39a4c381ba.jpg', 'thumbnail_width': 400, 'title': 'The Veil of Truth by Kwame Afrifa Podcast Show', 'type': 'rich', 'version': '1.0', 'width': 400}, 'type': 'anchor.fm'}, 'media_embed': {'content': '&lt;iframe class=""embedly-embed"" src=""https://cdn.embedly.com/widgets/media.html?src=https%3A%2F%2Fanchor.fm%2Fafrifa-osei-kwame-jnr%2Fembed%2Fepisodes%2FThe-Veil-of-Truth-eq5ig2&amp;display_name=Anchor+FM+Inc.&amp;url=https%3A%2F%2Fanchor.fm%2Fafrifa-osei-kwame-jnr%2Fepisodes%2FThe-Veil-of-Truth-eq5ig2&amp;image=https%3A%2F%2Fd3t3ozftmdmh3i.cloudfront.net%2Fproduction%2Fpodcast_uploaded400%2F11547412%2F11547412-1609081638515-c8e39a4c381ba.jpg&amp;key=ed8fa8699ce04833838e66ce79ba05f1&amp;type=text%2Fhtml&amp;schema=anchor"" width=""400"" height=""102"" scrolling=""no"" title=""Anchor FM Inc. embed"" frameborder=""0"" allow=""autoplay; fullscreen"" allowfullscreen=""true""&gt;&lt;/iframe&gt;', 'height': 102, 'scrolling': False, 'width': 400}, 'media_only': False, 'mod_note': None, 'mod_reason_by': None, 'mod_reason_title': None, 'mod_reports': [], 'name': 't3_lgbi6c', 'no_follow': False, 'num_comments': 0, 'num_crossposts': 1, 'num_reports': None, 'over_18': False, 'parent_whitelist_status': None, 'permalink': '/r/u_jakovinspire/comments/lgbi6c/the_veil_of_truth/', 'pinned': False, 'post_hint': 'link', 'preview': {'enabled': False, 'images': [{'id': 'A2qP_XcnZXAYnG7a6Vt0dMZJayf51QkfPk6IpgNtvGk', 'resolutions': [{'height': 108, 'url': 'https://external-preview.redd.it/9N_rqOSJQkjaDozS_kFgNvEZFUPefmCLZH1xCC0-r0c.jpg?width=108&amp;crop=smart&amp;auto=webp&amp;s=7c99f5c9fbc3593fdd73c9c3268e484f59add784', 'width': 108}, {'height': 216, 'url': 'https://external-preview.redd.it/9N_rqOSJQkjaDozS_kFgNvEZFUPefmCLZH1xCC0-r0c.jpg?width=216&amp;crop=smart&amp;auto=webp&amp;s=d1aeefe358ef8716573989609d1df06af5bf36c6', 'width': 216}, {'height': 320, 'url': 'https://external-preview.redd.it/9N_rqOSJQkjaDozS_kFgNvEZFUPefmCLZH1xCC0-r0c.jpg?width=320&amp;crop=smart&amp;auto=webp&amp;s=c5e1ff269f506e1687944af446153a0d2b3b6a32', 'width': 320}], 'source': {'height': 400, 'url': 'https://external-preview.redd.it/9N_rqOSJQkjaDozS_kFgNvEZFUPefmCLZH1xCC0-r0c.jpg?auto=webp&amp;s=3a049a5435f6d7552329ba706591283303fcbcea', 'width': 400}, 'variants': {}}]}, 'pwls': None, 'quarantine': False, 'removal_reason': None, 'removed_by': None, 'removed_by_category': None, 'report_reasons': None, 'saved': False, 'score': 1, 'secure_media': {'oembed': {'author_name': 'The Veil of Truth by Kwame Afrifa Podcast Show', 'description': 'In this episode learn about the subtlety of the secondary principle and how it take foothold to control all aspect of human lives. We reveal the primary principle as the truth we need in other to form a new lifestyle that depicts our relationship with God.', 'height': 102, 'html': '&lt;iframe class=""embedly-embed"" src=""https://cdn.embedly.com/widgets/media.html?src=https%3A%2F%2Fanchor.fm%2Fafrifa-osei-kwame-jnr%2Fembed%2Fepisodes%2FThe-Veil-of-Truth-eq5ig2&amp;display_name=Anchor+FM+Inc.&amp;url=https%3A%2F%2Fanchor.fm%2Fafrifa-osei-kwame-jnr%2Fepisodes%2FThe-Veil-of-Truth-eq5ig2&amp;image=https%3A%2F%2Fd3t3ozftmdmh3i.cloudfront.net%2Fproduction%2Fpodcast_uploaded400%2F11547412%2F11547412-1609081638515-c8e39a4c381ba.jpg&amp;key=ed8fa8699ce04833838e66ce79ba05f1&amp;type=text%2Fhtml&amp;schema=anchor"" width=""400"" height=""102"" scrolling=""no"" title=""Anchor FM Inc. embed"" frameborder=""0"" allow=""autoplay; fullscreen"" allowfullscreen=""true""&gt;&lt;/iframe&gt;', 'provider_name': 'Anchor FM Inc.', 'provider_url': 'https://anchor.fm', 'thumbnail_height': 400, 'thumbnail_url': 'https://d3t3ozftmdmh3i.cloudfront.net/production/podcast_uploaded400/11547412/11547412-1609081638515-c8e39a4c381ba.jpg', 'thumbnail_width': 400, 'title': 'The Veil of Truth by Kwame Afrifa Podcast Show', 'type': 'rich', 'version': '1.0', 'width': 400}, 'type': 'anchor.fm'}, 'secure_media_embed': {'content': '&lt;iframe class=""embedly-embed"" src=""https://cdn.embedly.com/widgets/media.html?src=https%3A%2F%2Fanchor.fm%2Fafrifa-osei-kwame-jnr%2Fembed%2Fepisodes%2FThe-Veil-of-Truth-eq5ig2&amp;display_name=Anchor+FM+Inc.&amp;url=https%3A%2F%2Fanchor.fm%2Fafrifa-osei-kwame-jnr%2Fepisodes%2FThe-Veil-of-Truth-eq5ig2&amp;image=https%3A%2F%2Fd3t3ozftmdmh3i.cloudfront.net%2Fproduction%2Fpodcast_uploaded400%2F11547412%2F11547412-1609081638515-c8e39a4c381ba.jpg&amp;key=ed8fa8699ce04833838e66ce79ba05f1&amp;type=text%2Fhtml&amp;schema=anchor"" width=""400"" height=""102"" scrolling=""no"" title=""Anchor FM Inc. embed"" frameborder=""0"" allow=""autoplay; fullscreen"" allowfullscreen=""true""&gt;&lt;/iframe&gt;', 'height': 102, 'media_domain_url': 'https://www.redditmedia.com/mediaembed/lgbi6c', 'scrolling': False, 'width': 400}, 'selftext': '', 'selftext_html': None, 'send_replies': True, 'spoiler': False, 'stickied': False, 'subreddit': 'u_jakovinspire', 'subreddit_id': 't5_37ixva', 'subreddit_name_prefixed': 'u/jakovinspire', 'subreddit_subscribers': 0, 'subreddit_type': 'user', 'suggested_sort': 'qa', 'thumbnail': 'https://b.thumbs.redditmedia.com/pafTOqMtb349fStx_cntyw-WD5UI0cW27B688HoaZHo.jpg', 'thumbnail_height': 140, 'thumbnail_width': 140, 'title': 'The Veil of Truth', 'top_awarded_type': None, 'total_awards_received': 0, 'treatment_tags': [], 'ups': 1, 'upvote_ratio': 1.0, 'url': 'https://anchor.fm/afrifa-osei-kwame-jnr/episodes/The-Veil-of-Truth-eq5ig2', 'url_overridden_by_dest': 'https://anchor.fm/afrifa-osei-kwame-jnr/episodes/The-Veil-of-Truth-eq5ig2', 'user_reports': [], 'view_count': None, 'visited': False, 'whitelist_status': None, 'wls': None}]",,,
77,[],False,doofgeek401,,[],,text,t2_13kzqx,False,False,[],False,False,1613008828,youtu.be,https://www.reddit.com/r/religion/comments/lha5bc/aztec_religion_explained/,{},lha5bc,True,False,False,False,True,False,False,,[],dark,text,False,False,True,0,0,False,all_ads,/r/religion/comments/lha5bc/aztec_religion_explained/,False,6,1613011205,1,,True,False,False,religion,t5_2qh39,62472,public,https://b.thumbs.redditmedia.com/Xr4jANsAp1U5u9YPTNYoUUvLWOk9ixLaUIPa9EAKQbE.jpg,Aztec Religion Explained,0,[],1.0,https://youtu.be/vdO-QB7weUs,all_ads,6,,rich:video,"{'enabled': False, 'images': [{'id': 'umSGBkCg5rbthizGG1IEGqs6-BR5tBjzUxB54aryi50', 'resolutions': [{'height': 81, 'url': 'https://external-preview.redd.it/0wk_-3gfkRYvTYywnsQyyjx76LymMtHDDWfAMsm8yHg.jpg?width=108&amp;crop=smart&amp;auto=webp&amp;s=8793e2668d8c7c7e5a8c6c1e0573d1e6f48f58b6', 'width': 108}, {'height': 162, 'url': 'https://external-preview.redd.it/0wk_-3gfkRYvTYywnsQyyjx76LymMtHDDWfAMsm8yHg.jpg?width=216&amp;crop=smart&amp;auto=webp&amp;s=90015b68804bdfe20d838da9db89d60e790e4e90', 'width': 216}, {'height': 240, 'url': 'https://external-preview.redd.it/0wk_-3gfkRYvTYywnsQyyjx76LymMtHDDWfAMsm8yHg.jpg?width=320&amp;crop=smart&amp;auto=webp&amp;s=8c3015ca6531cd175ec56d78db1796f7734c4f3c', 'width': 320}], 'source': {'height': 360, 'url': 'https://external-preview.redd.it/0wk_-3gfkRYvTYywnsQyyjx76LymMtHDDWfAMsm8yHg.jpg?auto=webp&amp;s=98f101aae9a4a09c7acabfdb0c942e5311926e4f', 'width': 480}, 'variants': {}}]}",105.0,140.0,https://youtu.be/vdO-QB7weUs,"{'oembed': {'author_name': 'ReligionForBreakfast', 'author_url': 'https://www.youtube.com/c/ReligionForBreakfast', 'height': 200, 'html': '&lt;iframe width=""356"" height=""200"" src=""https://www.youtube.com/embed/vdO-QB7weUs?feature=oembed&amp;enablejsapi=1"" frameborder=""0"" allow=""accelerometer; autoplay; clipboard-write; encrypted-media; gyroscope; picture-in-picture"" allowfullscreen&gt;&lt;/iframe&gt;', 'provider_name': 'YouTube', 'provider_url': 'https://www.youtube.com/', 'thumbnail_height': 360, 'thumbnail_url': 'https://i.ytimg.com/vi/vdO-QB7weUs/hqdefault.jpg', 'thumbnail_width': 480, 'title': 'Aztec Religion Explained', 'type': 'video', 'version': '1.0', 'width': 356}, 'type': 'youtube.com'}","{'content': '&lt;iframe width=""356"" height=""200"" src=""https://www.youtube.com/embed/vdO-QB7weUs?feature=oembed&amp;enablejsapi=1"" frameborder=""0"" allow=""accelerometer; autoplay; clipboard-write; encrypted-media; gyroscope; picture-in-picture"" allowfullscreen&gt;&lt;/iframe&gt;', 'height': 200, 'scrolling': False, 'width': 356}","{'oembed': {'author_name': 'ReligionForBreakfast', 'author_url': 'https://www.youtube.com/c/ReligionForBreakfast', 'height': 200, 'html': '&lt;iframe width=""356"" height=""200"" src=""https://www.youtube.com/embed/vdO-QB7weUs?feature=oembed&amp;enablejsapi=1"" frameborder=""0"" allow=""accelerometer; autoplay; clipboard-write; encrypted-media; gyroscope; picture-in-picture"" allowfullscreen&gt;&lt;/iframe&gt;', 'provider_name': 'YouTube', 'provider_url': 'https://www.youtube.com/', 'thumbnail_height': 360, 'thumbnail_url': 'https://i.ytimg.com/vi/vdO-QB7weUs/hqdefault.jpg', 'thumbnail_width': 480, 'title': 'Aztec Religion Explained', 'type': 'video', 'version': '1.0', 'width': 356}, 'type': 'youtube.com'}","{'content': '&lt;iframe width=""356"" height=""200"" src=""https://www.youtube.com/embed/vdO-QB7weUs?feature=oembed&amp;enablejsapi=1"" frameborder=""0"" allow=""accelerometer; autoplay; clipboard-write; encrypted-media; gyroscope; picture-in-picture"" allowfullscreen&gt;&lt;/iframe&gt;', 'height': 200, 'media_domain_url': 'https://www.redditmedia.com/mediaembed/lha5bc', 'scrolling': False, 'width': 356}",,,,,,,,
78,[],False,PhysicalElevator4427,,[],,text,t2_8iirud4c,False,False,[],False,False,1613008587,self.religion,https://www.reddit.com/r/religion/comments/lha2jx/khomeini_and_the_us_secret_relationships_before/,{},lha2jx,False,False,False,False,False,True,False,,[],dark,text,False,False,True,0,0,False,all_ads,/r/religion/comments/lha2jx/khomeini_and_the_us_secret_relationships_before/,False,6,1613011024,1,[removed],True,False,False,religion,t5_2qh39,62471,public,self,Khomeini and the US 'Secret' Relationships before the 1979 Islamic Revolution,0,[],1.0,https://www.reddit.com/r/religion/comments/lha2jx/khomeini_and_the_us_secret_relationships_before/,all_ads,6,reddit,self,"{'enabled': False, 'images': [{'id': 'zcxtbc2oJ6aU3Oi_qaGrQRE7Yp7xzBH4hoZq-RlMgdA', 'resolutions': [{'height': 108, 'url': 'https://external-preview.redd.it/cmLH5_KhNpwuUXn0_L5DIhSm5epCL070q6Txqz5c5Ro.jpg?width=108&amp;crop=smart&amp;auto=webp&amp;s=a59d442517fe2a7de37b209f6f0f99373690086f', 'width': 108}], 'source': {'height': 192, 'url': 'https://external-preview.redd.it/cmLH5_KhNpwuUXn0_L5DIhSm5epCL070q6Txqz5c5Ro.jpg?auto=webp&amp;s=27cae616f896fab4438f69a43f28967881f190c7', 'width': 192}, 'variants': {}}]}",,,,,,,,,,,,,,,
79,[],False,BoredAtHomeLockdown,,[],,text,t2_6zojfpdv,False,False,[],False,False,1613001597,self.religion,https://www.reddit.com/r/religion/comments/lh7r18/people_who_believe_in_heaven_the_afterlife_what/,{},lh7r18,True,False,False,False,True,True,False,,[],dark,text,False,False,True,10,0,False,all_ads,/r/religion/comments/lh7r18/people_who_believe_in_heaven_the_afterlife_what/,False,6,1613005830,1,"Do you think that your belief in Heaven causes you less anxiety?

Is grieving easier for you, seeing as you believe you will see your loved ones again?

Do you think that you feel less fear of death?

I really appreciate all responses - thank you!",True,False,False,religion,t5_2qh39,62468,public,self,"People who believe in Heaven / the afterlife, what is it like to live life believing that death is not the end?",0,[],1.0,https://www.reddit.com/r/religion/comments/lh7r18/people_who_believe_in_heaven_the_afterlife_what/,all_ads,6,,,,,,,,,,,,,,,,,,
