25,[],False,feline-a-holic,,[],,text,t2_3p1ehgvf,False,False,[],False,False,1613128686,self.religion,https://www.reddit.com/r/religion/comments/li93c8/who_tempted_eve/,{},li93c8,True,False,False,False,True,True,False,,[],dark,text,False,False,True,33,0,False,all_ads,/r/religion/comments/li93c8/who_tempted_eve/,False,6,1613128697,1,"People say it was the snake (devil).  We all know snakes don’t talk.  Is it a metaphor?  Some people say it’s our “desire.”  That was the original sin, isn’t it? 

You know snakes are poisonous..  Not sure why perfect Eden need snakes in the first place.  Kind of contradictory, don’t think?  I’m surprised Eve didn’t panic like most of us would.  So, it could not have been a literal snake.",True,False,False,religion,t5_2qh39,62538,public,self,Who tempted Eve?,0,[],1.0,https://www.reddit.com/r/religion/comments/li93c8/who_tempted_eve/,all_ads,6,,,,,,,,,,,,,,,,,,
26,[],False,Traditional-Class904,,[],,text,t2_75zw0p9r,False,False,[],False,False,1613121233,self.religion,https://www.reddit.com/r/religion/comments/li7h8x/anitya/,{},li7h8x,True,False,False,False,True,True,False,,[],dark,text,False,False,True,2,0,False,all_ads,/r/religion/comments/li7h8x/anitya/,False,6,1613121244,1,"Belief in the impermanence of the world is a common to both religions, which they recognize as a major source of suffering and the reason to practice Dharma and achieve liberation. Both agree that the world is in a state of flux and unstable, just as the mind and body are. Death, decay, aging, sickness and suffering are unavoidable problems of life. No one can escape from them. All objects in the objective realm are subject to decay and destruction. The impermanence of things becomes a problem when we become attached to them or form a relationship with them. Caught in between attraction and aversion to things, we experience gain and loss, and various conflicting states, emotions and feelings which constitute suffering. Hence, in both religions, you will find a great emphasis upon cultivating equanimity, sameness, detachment, renunciation, etc., to bring the mind to complete rest. However, as stated before, Buddhists believe that nothing in existence is permanent, while Hindus hold that the Self (Isvara) is eternal, constant and indestructible. Hence, one can escape from impermanence into permanence and immortality by knowing oneself and attaining liberation.",True,False,False,religion,t5_2qh39,62534,public,self,Anitya,0,[],1.0,https://www.reddit.com/r/religion/comments/li7h8x/anitya/,all_ads,6,,,,,,,,,,,,,,,,,,
27,[],False,SunsHeir,,[],,text,t2_a1fnsvi2,False,False,[],False,False,1613119666,self.religion,https://www.reddit.com/r/religion/comments/li75xr/modern_sun_worship/,{},li75xr,False,False,False,False,False,True,False,,[],dark,text,False,False,True,0,0,False,all_ads,/r/religion/comments/li75xr/modern_sun_worship/,False,6,1613119676,1,[removed],True,False,False,religion,t5_2qh39,62534,public,self,Modern Sun worship,0,[],1.0,https://www.reddit.com/r/religion/comments/li75xr/modern_sun_worship/,all_ads,6,automod_filtered,,,,,,,,,,,,,,,,,
28,[],False,kenssd,,[],,text,t2_va8e6,False,False,[],False,False,1613118971,self.religion,https://www.reddit.com/r/religion/comments/li718i/this_is_a_humble_invitation_to_include_the_non/,{},li718i,True,False,False,False,True,True,False,,[],dark,text,False,False,True,13,0,False,all_ads,/r/religion/comments/li718i/this_is_a_humble_invitation_to_include_the_non/,False,6,1613118982,1,,True,False,False,religion,t5_2qh39,62534,public,self,This is a humble invitation to include the non denominational Church of Christ (Iglesia Ni Cristo in Filipino/Taglog and Iglesia De Cristo in Spanish),0,[],1.0,https://www.reddit.com/r/religion/comments/li718i/this_is_a_humble_invitation_to_include_the_non/,all_ads,6,,,,,,,,,,,,,,,,,,
29,[],False,Jameswest0n,,[],,text,t2_862r3k1r,False,False,[],False,False,1613118593,self.religion,https://www.reddit.com/r/religion/comments/li6yjq/to_remain_unbiased_i_will_not_share_my_beliefs/,{},li6yjq,True,False,False,False,True,True,False,,[],dark,text,False,False,False,86,0,False,all_ads,/r/religion/comments/li6yjq/to_remain_unbiased_i_will_not_share_my_beliefs/,False,6,1613118603,1,"I have a deep faith, but can’t get over the fact that the most common faith in an area is purely geographical? How do you get past this? Someone that is looking to save his faith :) peace to all",True,False,False,religion,t5_2qh39,62533,public,self,"To remain unbiased, I will not share my beliefs. But I’m curious, what makes you so sure you chose the right religion?",0,[],1.0,https://www.reddit.com/r/religion/comments/li6yjq/to_remain_unbiased_i_will_not_share_my_beliefs/,all_ads,6,,,,,,,,,,,,,,,,,,
30,[],False,Religion_world,,[],,text,t2_9vohcwkq,False,False,[],False,False,1613116278,religionworld.in,https://www.reddit.com/r/religion/comments/li6hl0/वदवन_कभ_मल_वनदवन_म_हन_वल_कभ_मल_क_शह_सनन_क_तथय_घषत/,{},li6hl0,False,False,False,False,False,False,False,,[],dark,text,False,False,True,0,0,False,all_ads,/r/religion/comments/li6hl0/वदवन_कभ_मल_वनदवन_म_हन_वल_कभ_मल_क_शह_सनन_क_तथय_घषत/,False,6,1613116289,1,,True,False,False,religion,t5_2qh39,62533,public,https://b.thumbs.redditmedia.com/_pxTSUy3tctT1LBCIPJnGMQv8mC9pzXjA4dD2DfDZQo.jpg,वृंदावन कुंभ मेला: वृन्दावन में होने वाले कुंभ मेले की शाही स्नान की तिथियाँ घोषित,0,[],1.0,https://www.religionworld.in/vrindavan-kumbh-mela-the-royal-bath-dates-of-the-kumbh-mela-to-be-held-in-vrindavan-declared/,all_ads,6,moderator,link,"{'enabled': False, 'images': [{'id': 'U3jgZd65l2aB-p5vFhBtmkV7KJVUHfb7MCFDI8IF49M', 'resolutions': [{'height': 67, 'url': 'https://external-preview.redd.it/ZxDCx3chlIg5KJHoZm3ERyZSjhVDYEMpj9fZ_wAWhes.jpg?width=108&amp;crop=smart&amp;auto=webp&amp;s=a2a40a7e189afbf152b2471342b2deeeb5e79a36', 'width': 108}, {'height': 135, 'url': 'https://external-preview.redd.it/ZxDCx3chlIg5KJHoZm3ERyZSjhVDYEMpj9fZ_wAWhes.jpg?width=216&amp;crop=smart&amp;auto=webp&amp;s=f41ffebd9f586ad5917bbe6f2f8f4fc352c533cc', 'width': 216}, {'height': 200, 'url': 'https://external-preview.redd.it/ZxDCx3chlIg5KJHoZm3ERyZSjhVDYEMpj9fZ_wAWhes.jpg?width=320&amp;crop=smart&amp;auto=webp&amp;s=2f770fd5bc5bc50cb40940e6615c637106205629', 'width': 320}, {'height': 400, 'url': 'https://external-preview.redd.it/ZxDCx3chlIg5KJHoZm3ERyZSjhVDYEMpj9fZ_wAWhes.jpg?width=640&amp;crop=smart&amp;auto=webp&amp;s=e860b96d6822a071b853f15677d07255baf5e890', 'width': 640}], 'source': {'height': 500, 'url': 'https://external-preview.redd.it/ZxDCx3chlIg5KJHoZm3ERyZSjhVDYEMpj9fZ_wAWhes.jpg?auto=webp&amp;s=5ed44d54a5a9558e834ff0052a3cb42093247009', 'width': 800}, 'variants': {}}]}",87.0,140.0,https://www.religionworld.in/vrindavan-kumbh-mela-the-royal-bath-dates-of-the-kumbh-mela-to-be-held-in-vrindavan-declared/,,,,,,,,,,,,
31,[],False,Religion_world,,[],,text,t2_9vohcwkq,False,False,[],False,False,1613116136,self.religion,https://www.reddit.com/r/religion/comments/li6ghw/वदवन_कभ_मल_वनदवन_म_हन_वल_कभ_मल_क_शह_सनन_क_तथय_घषत/,{},li6ghw,False,False,False,False,False,True,False,,[],dark,text,False,False,True,0,0,False,all_ads,/r/religion/comments/li6ghw/वदवन_कभ_मल_वनदवन_म_हन_वल_कभ_मल_क_शह_सनन_क_तथय_घषत/,False,6,1613116147,1,[removed],True,False,False,religion,t5_2qh39,62533,public,self,वृंदावन कुंभ मेला: वृन्दावन में होने वाले कुंभ मेले की शाही स्नान की तिथियाँ घोषित,0,[],1.0,https://www.reddit.com/r/religion/comments/li6ghw/वदवन_कभ_मल_वनदवन_म_हन_वल_कभ_मल_क_शह_सनन_क_तथय_घषत/,all_ads,6,moderator,self,"{'enabled': False, 'images': [{'id': 'U3jgZd65l2aB-p5vFhBtmkV7KJVUHfb7MCFDI8IF49M', 'resolutions': [{'height': 67, 'url': 'https://external-preview.redd.it/ZxDCx3chlIg5KJHoZm3ERyZSjhVDYEMpj9fZ_wAWhes.jpg?width=108&amp;crop=smart&amp;auto=webp&amp;s=a2a40a7e189afbf152b2471342b2deeeb5e79a36', 'width': 108}, {'height': 135, 'url': 'https://external-preview.redd.it/ZxDCx3chlIg5KJHoZm3ERyZSjhVDYEMpj9fZ_wAWhes.jpg?width=216&amp;crop=smart&amp;auto=webp&amp;s=f41ffebd9f586ad5917bbe6f2f8f4fc352c533cc', 'width': 216}, {'height': 200, 'url': 'https://external-preview.redd.it/ZxDCx3chlIg5KJHoZm3ERyZSjhVDYEMpj9fZ_wAWhes.jpg?width=320&amp;crop=smart&amp;auto=webp&amp;s=2f770fd5bc5bc50cb40940e6615c637106205629', 'width': 320}, {'height': 400, 'url': 'https://external-preview.redd.it/ZxDCx3chlIg5KJHoZm3ERyZSjhVDYEMpj9fZ_wAWhes.jpg?width=640&amp;crop=smart&amp;auto=webp&amp;s=e860b96d6822a071b853f15677d07255baf5e890', 'width': 640}], 'source': {'height': 500, 'url': 'https://external-preview.redd.it/ZxDCx3chlIg5KJHoZm3ERyZSjhVDYEMpj9fZ_wAWhes.jpg?auto=webp&amp;s=5ed44d54a5a9558e834ff0052a3cb42093247009', 'width': 800}, 'variants': {}}]}",,,,,,,,,,,,,,,
32,[],False,Titicelina,,[],,text,t2_4sjhj6sc,False,False,[],False,False,1613114856,self.religion,https://www.reddit.com/r/religion/comments/li671d/god_is_good/,{},li671d,False,False,False,False,False,True,False,,[],dark,text,False,False,True,0,0,False,all_ads,/r/religion/comments/li671d/god_is_good/,False,6,1613114867,1,[removed],True,False,False,religion,t5_2qh39,62530,public,self,God is good,0,[],1.0,https://www.reddit.com/r/religion/comments/li671d/god_is_good/,all_ads,6,automod_filtered,,,,,,,,,,,,,,,,,
33,[],False,DewVasil,,[],Muslim like my father Adam (Peace be upon him),text,t2_8kdmk1qz,False,False,[],False,False,1613114561,/r/religion/comments/li64vr/faith/,https://www.reddit.com/r/religion/comments/li64vr/faith/,{},li64vr,True,False,False,False,True,False,True,,[],dark,text,False,False,True,0,0,False,all_ads,/r/religion/comments/li64vr/faith/,False,6,1613114571,1,,True,False,False,religion,t5_2qh39,62529,public,https://b.thumbs.redditmedia.com/tt_phi08qDJGRyRuTAGynjphy5MNpovSWGjK2Fanbes.jpg,Faith.,0,[],1.0,https://v.redd.it/szmgdnovzzg61,all_ads,6,,hosted:video,"{'enabled': False, 'images': [{'id': '7xF5QGf2zgqhOyGnGGr0bj91mZafajP5FnC1Cnz_l1w', 'resolutions': [{'height': 60, 'url': 'https://external-preview.redd.it/klF-f2iCYZAGJPfFlZQyGo_rJiyWo2Y0JJiLEcYXQjI.png?width=108&amp;crop=smart&amp;format=pjpg&amp;auto=webp&amp;s=585b8a1583aa6602e9e3995333a239e77595019b', 'width': 108}, {'height': 121, 'url': 'https://external-preview.redd.it/klF-f2iCYZAGJPfFlZQyGo_rJiyWo2Y0JJiLEcYXQjI.png?width=216&amp;crop=smart&amp;format=pjpg&amp;auto=webp&amp;s=36ad084d66f6fddc712944154f4cf640db1fcdd7', 'width': 216}, {'height': 179, 'url': 'https://external-preview.redd.it/klF-f2iCYZAGJPfFlZQyGo_rJiyWo2Y0JJiLEcYXQjI.png?width=320&amp;crop=smart&amp;format=pjpg&amp;auto=webp&amp;s=bed4286e75a86e4c80c664d9651f07b07418a80a', 'width': 320}, {'height': 359, 'url': 'https://external-preview.redd.it/klF-f2iCYZAGJPfFlZQyGo_rJiyWo2Y0JJiLEcYXQjI.png?width=640&amp;crop=smart&amp;format=pjpg&amp;auto=webp&amp;s=689df4d96f955d1caeec9193feadb32b4693f497', 'width': 640}], 'source': {'height': 480, 'url': 'https://external-preview.redd.it/klF-f2iCYZAGJPfFlZQyGo_rJiyWo2Y0JJiLEcYXQjI.png?format=pjpg&amp;auto=webp&amp;s=37c8e53823a50ee7b9fed08b1f7e15c0089adc5d', 'width': 854}, 'variants': {}}]}",78.0,140.0,https://v.redd.it/szmgdnovzzg61,,,,,e9960ca0-3f4e-11e4-87bd-12313d148adf,dark,,,,,,
34,[],False,Liecide,,[],,text,t2_i309a2x,False,False,[],False,False,1613108357,self.religion,https://www.reddit.com/r/religion/comments/li4pns/religiously_confused/,{},li4pns,True,False,False,False,True,True,False,,[],dark,text,False,False,True,18,0,False,all_ads,/r/religion/comments/li4pns/religiously_confused/,False,6,1613108368,1,"After ruminating with these thoughts for a few months I thought I would create this post in an attempt to get any input into my thinking as I have been swirling these thoughts around in my mind for a while.

I grew up in a Jehovah's Witness household. My parents were exemplary members of their congregation until they divorced when I was about 7-8 years old. Following this I was to live with my mother until I was 18, in a household that was not religious and through my mother's views we held great disdain for religion especially for the Jehovah's witness community. She convinced us that they were evil(though she would later join the faith once more) and that religion was a waste of time. However, I always felt a connection to ""God"" and to the views of the Jehovah's witnesses probably partly because my father remained in the faith and I wanted to seek his approval and a connection with him and those we left behind when we left the congregation, but mostly because it was something that was instilled in me when I was young. 

Fast forward to the present, I am a 30-something year-old struggling with finding any spiritual or religious meaning in my life. I wouldn't say I'm unhappy or desperate, but I have been curious as to what my religious standing is and how I view the concept of God and faith. I don't agree with all the teachings that come with being a Jehovah's witness, although I don't have a bad word to say about any of the people I have met both in my original congregation or those I have met more recently. I fully believe they are pure of heart in their beliefs but I have a hard time adhering to all their teachings. 

The way I currently practice faith and/or religion is through prayer every night(praying to Jehovah, the only deity I was taught to approach) and I ask for guidance / forgiveness. However, I have always felt a disconnection there, and prayer is just a way to try to find or keep a connection into faith for me. I don't go to church, or attend any Jehovah's witness meetings, or anything else of the sort. I want to believe in a deity of some sort, however it has become more and more difficult as I grow older. Regardless, I pray every night - out of habit if nothing else.

I have done some introspection into my spirituality recently and that is partly why I am writing this today. I don't believe myself to be very religious. However, I do believe in 'something' above/after this existence after I move on. I also believe in karma to some extent, and the Buddhist philosophies, views on karma, mediation, etc., and they are what have most keenly drawn my attention lately. The Ying and Yang concept has also always been a part of my thought process. I just don't know where I stand in terms of religion. I would like to believe in some deity that would understand my existence and appreciate my suffering and attempts at betterment, however I have a hard time conceptualizing that. 

To entertain my curiosity I used a few ""find you religion"" websites and they found me to be 'solidly secular' or atheist. I don't really want to accept these however. As I believe I am more religious than these labels appreciate. 

I pray daily, I practice a life that appreciates karma and the suffering of others. I try to be pure in my intensions and actions, and I want to leave this world knowing I didn't leave a 'net-suffering' through my actions as I exit, if that makes sense. That is to say I hope that my actions leave the world a slightly better place, as minor as it may be, as I leave this existence. I am not a huge fan of group gatherings for religion, or group prayer, but I am also not against it. I have recently started to meditate - trying various concepts for this such as the Jesus prayer and other more traditional ways of meditation. I also have difficulties believing that the Bible or other words of scripture are direct guidance from God, but I do believe they serve a purpose, regardless of their origin.

TLDR: I am not sure which religious 'sect' I fit into but I would like to find some guidance or advice into what I should study next to find my true spiritual meaning. Any advice or guidance would be appreciated.",True,False,False,religion,t5_2qh39,62528,public,self,Religiously confused,0,[],1.0,https://www.reddit.com/r/religion/comments/li4pns/religiously_confused/,all_ads,6,,,,,,,,,,,,,,,,,,
35,[],False,theocraticman,,[],,text,t2_nmqhc,False,False,[],False,False,1613100148,thevoiceslu.com,https://www.reddit.com/r/religion/comments/li2gql/jehovahs_witnesses_to_release_bibles_in_36/,{},li2gql,True,False,False,False,True,False,False,,[],dark,text,False,False,True,4,0,False,all_ads,/r/religion/comments/li2gql/jehovahs_witnesses_to_release_bibles_in_36/,False,6,1613100159,1,,False,False,False,religion,t5_2qh39,62523,public,https://b.thumbs.redditmedia.com/lwv6m42P-I8ebm7EeAcsiGu927u1x5gX4Rbc408Z-Hg.jpg,Jehovah’s Witnesses to Release Bibles in 36 Languages in 2021,0,[],1.0,https://www.thevoiceslu.com/2021/02/jehovahs-witnesses-to-release-bibles-in-36-languages-in-2021/,all_ads,6,,link,"{'enabled': False, 'images': [{'id': 'teV61t7DcKrhicR7Hv9dIrUR_eQEIN7f-66TP2PiZ0M', 'resolutions': [{'height': 83, 'url': 'https://external-preview.redd.it/bMr4i3UdDBESYM9UxLTeXeDgGCSh4JzhiGm3LVAOyAw.jpg?width=108&amp;crop=smart&amp;auto=webp&amp;s=f753d01eeddecc94c37313f7f42be81ad1038993', 'width': 108}, {'height': 167, 'url': 'https://external-preview.redd.it/bMr4i3UdDBESYM9UxLTeXeDgGCSh4JzhiGm3LVAOyAw.jpg?width=216&amp;crop=smart&amp;auto=webp&amp;s=bd4b4d13e5f9c2501d74080b9b99b508ccf6fe93', 'width': 216}, {'height': 248, 'url': 'https://external-preview.redd.it/bMr4i3UdDBESYM9UxLTeXeDgGCSh4JzhiGm3LVAOyAw.jpg?width=320&amp;crop=smart&amp;auto=webp&amp;s=e3c825251aeaca2f1ff5dcdb1e2436e1e545f652', 'width': 320}], 'source': {'height': 381, 'url': 'https://external-preview.redd.it/bMr4i3UdDBESYM9UxLTeXeDgGCSh4JzhiGm3LVAOyAw.jpg?auto=webp&amp;s=5613d4b7bc53583159cfda0003ff1fafb7e510fb', 'width': 491}, 'variants': {}}]}",108.0,140.0,https://www.thevoiceslu.com/2021/02/jehovahs-witnesses-to-release-bibles-in-36-languages-in-2021/,,,,,,,,,,,,
36,[],False,SilverAssasin337,,[],,text,t2_kn5ydvr,False,False,[],False,False,1613097728,self.religion,https://www.reddit.com/r/religion/comments/li1qnw/examples_of_patriarchy_in_the_bible/,{},li1qnw,True,False,False,False,True,True,False,,[],dark,text,False,False,True,20,0,False,all_ads,/r/religion/comments/li1qnw/examples_of_patriarchy_in_the_bible/,False,6,1613097739,1,"For example: Eve being made from Adam's rib, or different kings having multiple wives.",True,False,False,religion,t5_2qh39,62522,public,self,Examples of patriarchy in the bible?,0,[],1.0,https://www.reddit.com/r/religion/comments/li1qnw/examples_of_patriarchy_in_the_bible/,all_ads,6,,,,,,,,,,,,,,,,,,
37,[],False,Rtiwari454,,[],,text,t2_ab2la7rq,False,False,[],False,False,1613097328,self.religion,https://www.reddit.com/r/religion/comments/li1mai/xyz/,{},li1mai,False,False,False,False,False,True,False,,[],dark,text,False,False,True,0,0,False,all_ads,/r/religion/comments/li1mai/xyz/,False,6,1613097339,1,[removed],True,False,False,religion,t5_2qh39,62519,public,self,Xyz,0,[],1.0,https://www.reddit.com/r/religion/comments/li1mai/xyz/,all_ads,6,automod_filtered,self,"{'enabled': False, 'images': [{'id': 'V9VhdJov6ej4W4MEBUxlanCzwPAKHy5gehDyNztiFpg', 'resolutions': [{'height': 216, 'url': 'https://external-preview.redd.it/JkLBLu2el8tbfAMzPR9Dabio0xAchoxts0Porl_pf54.jpg?width=108&amp;crop=smart&amp;auto=webp&amp;s=04b68c28feb32a66d173cef7d41a2fb6c0bcb8ce', 'width': 108}, {'height': 432, 'url': 'https://external-preview.redd.it/JkLBLu2el8tbfAMzPR9Dabio0xAchoxts0Porl_pf54.jpg?width=216&amp;crop=smart&amp;auto=webp&amp;s=39ebcfdeb94ef79d091d01e6434bb3ef0dd6bb3e', 'width': 216}, {'height': 640, 'url': 'https://external-preview.redd.it/JkLBLu2el8tbfAMzPR9Dabio0xAchoxts0Porl_pf54.jpg?width=320&amp;crop=smart&amp;auto=webp&amp;s=f4ae4ba9766fa22c5ed868cfb4930316e94a74c9', 'width': 320}], 'source': {'height': 1200, 'url': 'https://external-preview.redd.it/JkLBLu2el8tbfAMzPR9Dabio0xAchoxts0Porl_pf54.jpg?auto=webp&amp;s=7e37844d3aa125c3392a87a23758baa6d62f9bb8', 'width': 600}, 'variants': {}}]}",,,,,,,,,,,,,,,
38,[],False,BlacknMild69,,[],,text,t2_7xo2y342,False,False,[],False,False,1613091897,self.religion,https://www.reddit.com/r/religion/comments/lhzwfe/if_god_is_real_then_why_dont_i_have_hoes/,{},lhzwfe,True,False,False,False,True,True,False,,[],dark,text,False,False,True,7,0,False,all_ads,/r/religion/comments/lhzwfe/if_god_is_real_then_why_dont_i_have_hoes/,False,6,1613091907,1,I prayed for hoes and friends every night and still dont got any,True,False,False,religion,t5_2qh39,62522,public,self,If God is real then why dont i have hoes?,0,[],1.0,https://www.reddit.com/r/religion/comments/lhzwfe/if_god_is_real_then_why_dont_i_have_hoes/,all_ads,6,,,,,,,,,,,,,,,,,,
39,[],False,Hello_bruh2,,[],,text,t2_aaa9r2gb,False,False,[],False,False,1613090822,self.religion,https://www.reddit.com/r/religion/comments/lhzjcg/do_morals_change_as_humanity_moves_on_if_yes_then/,{},lhzjcg,False,False,False,False,False,True,False,,[],dark,text,False,False,True,17,0,False,all_ads,/r/religion/comments/lhzjcg/do_morals_change_as_humanity_moves_on_if_yes_then/,False,6,1613090833,1,"[removed]

[View Poll](https://www.reddit.com/poll/lhzjcg)",True,False,False,religion,t5_2qh39,62521,public,self,"Do morals change as humanity moves on? If yes, then how?",0,[],1.0,https://www.reddit.com/r/religion/comments/lhzjcg/do_morals_change_as_humanity_moves_on_if_yes_then/,all_ads,6,automod_filtered,,,,,,,,,,,,,,,,,
40,[],False,No_Tea_4471,,[],,text,t2_9g730qeb,False,False,[],False,False,1613090265,youtu.be,https://www.reddit.com/r/religion/comments/lhzcwf/inside_view_on_the_teshuva_process_done_by/,{},lhzcwf,False,False,False,False,False,False,False,,[],dark,text,False,False,True,0,0,False,all_ads,/r/religion/comments/lhzcwf/inside_view_on_the_teshuva_process_done_by/,False,6,1613090276,1,,True,False,False,religion,t5_2qh39,62519,public,https://a.thumbs.redditmedia.com/_cnYs6dqCvPhETVHsIe-6cRCWveUi8t27sjGgVlH5u8.jpg,Inside view on the Teshuva process done by secular Jews who become orthodox,0,[],1.0,https://youtu.be/paJVDCYe99k,all_ads,6,moderator,rich:video,"{'enabled': False, 'images': [{'id': 'cpf1m3YTD8_wmYP5VjH-dqaSxoZvoT0DwgyjQj8kAvY', 'resolutions': [{'height': 81, 'url': 'https://external-preview.redd.it/xntkK9hYhtdxa2eiE57iWpghxS1pe4SYF66xr_ctwoY.jpg?width=108&amp;crop=smart&amp;auto=webp&amp;s=7d1f22caf67818006df3e921d6bbea3a9f0afbbf', 'width': 108}, {'height': 162, 'url': 'https://external-preview.redd.it/xntkK9hYhtdxa2eiE57iWpghxS1pe4SYF66xr_ctwoY.jpg?width=216&amp;crop=smart&amp;auto=webp&amp;s=f5d6a123581265c6921bebe3647cd58c286d50b3', 'width': 216}, {'height': 240, 'url': 'https://external-preview.redd.it/xntkK9hYhtdxa2eiE57iWpghxS1pe4SYF66xr_ctwoY.jpg?width=320&amp;crop=smart&amp;auto=webp&amp;s=33efd4ec2c82b717415406620824d96c2863b522', 'width': 320}], 'source': {'height': 360, 'url': 'https://external-preview.redd.it/xntkK9hYhtdxa2eiE57iWpghxS1pe4SYF66xr_ctwoY.jpg?auto=webp&amp;s=d615b2db16f67542b67563d1dee848fc59caeb80', 'width': 480}, 'variants': {}}]}",105.0,140.0,https://youtu.be/paJVDCYe99k,"{'oembed': {'author_name': 'Two Chassids In a Pod', 'author_url': 'https://www.youtube.com/channel/UCZBAXOYs6A7akXCWH79GajQ', 'height': 200, 'html': '&lt;iframe width=""356"" height=""200"" src=""https://www.youtube.com/embed/paJVDCYe99k?feature=oembed&amp;enablejsapi=1"" frameborder=""0"" allow=""accelerometer; autoplay; clipboard-write; encrypted-media; gyroscope; picture-in-picture"" allowfullscreen&gt;&lt;/iframe&gt;', 'provider_name': 'YouTube', 'provider_url': 'https://www.youtube.com/', 'thumbnail_height': 360, 'thumbnail_url': 'https://i.ytimg.com/vi/paJVDCYe99k/hqdefault.jpg', 'thumbnail_width': 480, 'title': ""Making Teshuva:  Shabbat, Torah Lifestyle, Nissim Black &amp; L'Chaim OG!"", 'type': 'video', 'version': '1.0', 'width': 356}, 'type': 'youtube.com'}","{'content': '&lt;iframe width=""356"" height=""200"" src=""https://www.youtube.com/embed/paJVDCYe99k?feature=oembed&amp;enablejsapi=1"" frameborder=""0"" allow=""accelerometer; autoplay; clipboard-write; encrypted-media; gyroscope; picture-in-picture"" allowfullscreen&gt;&lt;/iframe&gt;', 'height': 200, 'scrolling': False, 'width': 356}","{'oembed': {'author_name': 'Two Chassids In a Pod', 'author_url': 'https://www.youtube.com/channel/UCZBAXOYs6A7akXCWH79GajQ', 'height': 200, 'html': '&lt;iframe width=""356"" height=""200"" src=""https://www.youtube.com/embed/paJVDCYe99k?feature=oembed&amp;enablejsapi=1"" frameborder=""0"" allow=""accelerometer; autoplay; clipboard-write; encrypted-media; gyroscope; picture-in-picture"" allowfullscreen&gt;&lt;/iframe&gt;', 'provider_name': 'YouTube', 'provider_url': 'https://www.youtube.com/', 'thumbnail_height': 360, 'thumbnail_url': 'https://i.ytimg.com/vi/paJVDCYe99k/hqdefault.jpg', 'thumbnail_width': 480, 'title': ""Making Teshuva:  Shabbat, Torah Lifestyle, Nissim Black &amp; L'Chaim OG!"", 'type': 'video', 'version': '1.0', 'width': 356}, 'type': 'youtube.com'}","{'content': '&lt;iframe width=""356"" height=""200"" src=""https://www.youtube.com/embed/paJVDCYe99k?feature=oembed&amp;enablejsapi=1"" frameborder=""0"" allow=""accelerometer; autoplay; clipboard-write; encrypted-media; gyroscope; picture-in-picture"" allowfullscreen&gt;&lt;/iframe&gt;', 'height': 200, 'media_domain_url': 'https://www.redditmedia.com/mediaembed/lhzcwf', 'scrolling': False, 'width': 356}",,,,,,,,
