,all_awardings,allow_live_comments,author,author_flair_css_class,author_flair_richtext,author_flair_text,author_flair_type,author_fullname,author_patreon_flair,author_premium,awarders,can_mod_post,contest_mode,created_utc,domain,full_link,gildings,id,is_crosspostable,is_meta,is_original_content,is_reddit_media_domain,is_robot_indexable,is_self,is_video,link_flair_background_color,link_flair_richtext,link_flair_text_color,link_flair_type,locked,media_only,no_follow,num_comments,num_crossposts,over_18,parent_whitelist_status,permalink,pinned,pwls,retrieved_on,score,selftext,send_replies,spoiler,stickied,subreddit,subreddit_id,subreddit_subscribers,subreddit_type,thumbnail,title,total_awards_received,treatment_tags,upvote_ratio,url,whitelist_status,wls,removed_by_category,post_hint,preview,thumbnail_height,thumbnail_width,url_overridden_by_dest,media,media_embed,secure_media,secure_media_embed,author_flair_template_id,author_flair_text_color,author_flair_background_color,crosspost_parent,crosspost_parent_list,poll_data,edited,banned_by
0,[],False,Sunrisity,,[],,text,t2_7fs70k3q,False,False,[],False,False,1613197559,self.religion,https://www.reddit.com/r/religion/comments/liuzjm/does_anyone_else_see_religion_as_purely_functional/,{},liuzjm,True,False,False,False,True,True,False,,[],dark,text,False,False,True,12,0,False,all_ads,/r/religion/comments/liuzjm/does_anyone_else_see_religion_as_purely_functional/,False,6,1613197570,1,"Hi everyone! 

So I have come to the conclusion that religion was created for functional purposes only. This does not mean the whole “religion is just to control you!!!” line. 

For me, religion is about being the best person you can be and there are different ways to do that and earn “points” to get into a better place after death. To me heaven does not really exist or matter, it’s just the incentive. Same with god. If there is a god and heaven then great!! If not than the religion has taught you to be a better person. Some people don’t need religion to make them good (and no I don’t mean most of the atheist bros that come on here to harass people). 
I guess a big question I have is, why do you need to worship god to go to heaven? Can’t you just be a good person and that’s enough? It seems like god is really egotistical to me to need praise?

The reason why things you are meant to do for religion is for your own health and safety in my mind, it’s not for a god. If the Quran or Hadith asks you to do Wudu before prayer, it’s for your own health, because in ancient times it was important to be clean so as not to get sick. 
The reason to pray in all religions is to be mindful because it can make you more productive can feel better about yourself. 

So after all this thought, I wish there could be a new religion that could actually be updated to help people be the healthiest and best they could be in modern times. Like instead of praying, you spend 10 minutes without your phone 6 times a day. 

This is just my random thoughts but I’d be very interested to hear what you all think! Have a great day or night everyone :))!",True,False,False,religion,t5_2qh39,62570,public,self,Does anyone else see religion as purely functional?,0,[],1.0,https://www.reddit.com/r/religion/comments/liuzjm/does_anyone_else_see_religion_as_purely_functional/,all_ads,6,,,,,,,,,,,,,,,,,,
1,[],False,cheryl983,,[],,text,t2_a9al50g4,False,False,[],False,False,1613196296,self.religion,https://www.reddit.com/r/religion/comments/liuoik/35f_australia_available_for_hook_up_only_m/,{},liuoik,False,False,False,False,False,True,False,,[],dark,text,False,False,True,0,0,False,all_ads,/r/religion/comments/liuoik/35f_australia_available_for_hook_up_only_m/,False,6,1613196306,1,[removed],True,False,False,religion,t5_2qh39,62570,public,self,35F Australia available for hook up only M 🍓🍓🍓strictly on conversation.,0,[],1.0,https://www.reddit.com/r/religion/comments/liuoik/35f_australia_available_for_hook_up_only_m/,all_ads,6,automod_filtered,,,,,,,,,,,,,,,,,
2,[],False,Worthystats,,[],,text,t2_7neuzfpr,False,False,[],False,False,1613195049,i.redd.it,https://www.reddit.com/r/religion/comments/liud3b/dont_know_if_memes_are_allowed_or_not_but_i_found/,{},liud3b,False,False,False,True,False,False,False,,[],dark,text,False,False,True,0,0,False,all_ads,/r/religion/comments/liud3b/dont_know_if_memes_are_allowed_or_not_but_i_found/,False,6,1613195059,1,,True,False,False,religion,t5_2qh39,62568,public,https://b.thumbs.redditmedia.com/Itcekw-h9FzY40xdpjlgZfMkEc-Pkw4fAt31T80hgOE.jpg,don't know if memes are allowed or not but i found this gem.,0,[],1.0,https://i.redd.it/ubg4su5ln6h61.png,all_ads,6,automod_filtered,image,"{'enabled': True, 'images': [{'id': 'cGuBzvk4y1lSv1-0tbvyurTqvTgeErR869aNuoU8TG4', 'resolutions': [{'height': 113, 'url': 'https://preview.redd.it/ubg4su5ln6h61.png?width=108&amp;crop=smart&amp;auto=webp&amp;s=bea571aa73ce2f350f42350b2645091f7b59f750', 'width': 108}, {'height': 226, 'url': 'https://preview.redd.it/ubg4su5ln6h61.png?width=216&amp;crop=smart&amp;auto=webp&amp;s=d14f682d7f52f5efb17e5f1b2951c418c48c0ac7', 'width': 216}, {'height': 334, 'url': 'https://preview.redd.it/ubg4su5ln6h61.png?width=320&amp;crop=smart&amp;auto=webp&amp;s=1a37ab3fd65de165ef5573031d92b29f1b977f0c', 'width': 320}, {'height': 669, 'url': 'https://preview.redd.it/ubg4su5ln6h61.png?width=640&amp;crop=smart&amp;auto=webp&amp;s=3f17a0762b6fbae0a38d6d12f507eacc72b28a00', 'width': 640}], 'source': {'height': 785, 'url': 'https://preview.redd.it/ubg4su5ln6h61.png?auto=webp&amp;s=7bcdbf7977106a2edef443923740a92185b41766', 'width': 750}, 'variants': {}}]}",140.0,140.0,https://i.redd.it/ubg4su5ln6h61.png,,,,,,,,,,,,
3,[],False,sit_on_my_face_chica,,[],,text,t2_le9h0,False,False,[],False,False,1613193289,discord.gg,https://www.reddit.com/r/religion/comments/litwj2/join_the_official_rreligion_discord_100_members/,{},litwj2,True,False,False,False,True,False,False,,[],dark,text,False,False,True,5,0,False,all_ads,/r/religion/comments/litwj2/join_the_official_rreligion_discord_100_members/,False,6,1613193300,1,,True,False,False,religion,t5_2qh39,62568,public,https://b.thumbs.redditmedia.com/LusySFDM0W5RWIl-IQUg5cIrEu6-64nMbsx1cuH7HZE.jpg,"Join the official r/religion Discord. 100+ members, nitro boosted. Tons of fun for everyone!",0,[],1.0,https://discord.gg/MB9zZxWjrJ,all_ads,6,,link,"{'enabled': False, 'images': [{'id': 'HwvnuA1fpVDKPZt3-90Ip45zblBIFMefcNhR80zJy1I', 'resolutions': [{'height': 108, 'url': 'https://external-preview.redd.it/-O1_-TYIO_SbOBnISBkJsejwQyQmGTCquKemG9Qho1k.jpg?width=108&amp;crop=smart&amp;auto=webp&amp;s=3d227ef7b0945ccb6994e6a98509f929e8e19803', 'width': 108}, {'height': 216, 'url': 'https://external-preview.redd.it/-O1_-TYIO_SbOBnISBkJsejwQyQmGTCquKemG9Qho1k.jpg?width=216&amp;crop=smart&amp;auto=webp&amp;s=ce9fba2762377df2d58b2da8cef60ce55e50cb80', 'width': 216}], 'source': {'height': 256, 'url': 'https://external-preview.redd.it/-O1_-TYIO_SbOBnISBkJsejwQyQmGTCquKemG9Qho1k.jpg?auto=webp&amp;s=6b1d265b83084812ec30bfa3df187eae8d54d4c2', 'width': 256}, 'variants': {}}]}",140.0,140.0,https://discord.gg/MB9zZxWjrJ,,,,,,,,,,,,
4,[],False,SocietyOfBruhReddit,,[],,text,t2_9p6eyh5r,False,False,[],False,False,1613191917,self.religion,https://www.reddit.com/r/religion/comments/litixo/what_do_satanists_believe_do_they_just_not_want/,{},litixo,False,False,False,False,False,True,False,,[],dark,text,False,False,True,10,0,False,all_ads,/r/religion/comments/litixo/what_do_satanists_believe_do_they_just_not_want/,False,6,1613191927,1,[removed],True,False,False,religion,t5_2qh39,62568,public,self,What do Satanists believe? Do they just not want to serve God or something?,0,[],1.0,https://www.reddit.com/r/religion/comments/litixo/what_do_satanists_believe_do_they_just_not_want/,all_ads,6,automod_filtered,,,,,,,,,,,,,,,,,
5,[],False,ColoradoIsHeaven,,[],,text,t2_9k87be18,False,False,[],False,False,1613178478,self.religion,https://www.reddit.com/r/religion/comments/lipp0x/the_terror_of_existence/,{},lipp0x,True,False,False,False,True,True,False,,[],dark,text,False,False,True,19,0,False,all_ads,/r/religion/comments/lipp0x/the_terror_of_existence/,False,6,1613178490,1,"Has anyone ever had this experience: it sometimes happens as I lie in bed at night, but it can happen anytime. Suddenly I become hyper-aware of and overwhelmed by the very fact of existence. Why is there anything?  It almost feels as if I disconnect from space and time and am completely filled with dread because of the immensity of existence.  In some ways it feels like I connect to the ground of being, but it's terrifying.  

I think the experience could easily translate as a religious experience, but to me it feels more metaphysical than religious if that makes sense.  Fortunately it doesn't happen often and passes quickly...",True,False,False,religion,t5_2qh39,62560,public,self,The terror of existence,0,[],1.0,https://www.reddit.com/r/religion/comments/lipp0x/the_terror_of_existence/,all_ads,6,,,,,,,,,,,,,,,,,,
6,[],False,help4me_,,[],,text,t2_843i4v3x,False,False,[],False,False,1613173065,self.religion,https://www.reddit.com/r/religion/comments/linx0s/theists_how_do_you_explain_the_presence_of_evil/,{},linx0s,False,False,False,False,False,True,False,,[],dark,text,False,False,True,35,0,False,all_ads,/r/religion/comments/linx0s/theists_how_do_you_explain_the_presence_of_evil/,False,6,1613173076,1,[removed],True,False,False,religion,t5_2qh39,62556,public,self,"Theists, how do you explain the presence of evil in the world?",0,[],1.0,https://www.reddit.com/r/religion/comments/linx0s/theists_how_do_you_explain_the_presence_of_evil/,all_ads,6,automod_filtered,,,,,,,,,,,,,,,,,
7,[],False,HistoryLord,,[],,text,t2_3er6wm,False,False,[],False,False,1613172549,self.religion,https://www.reddit.com/r/religion/comments/linqqq/diddo_aboriginal_australians_believe_in_the_end/,{},linqqq,True,False,False,False,True,True,False,,[],dark,text,False,False,True,26,0,False,all_ads,/r/religion/comments/linqqq/diddo_aboriginal_australians_believe_in_the_end/,False,6,1613172560,1,"I'm from Australia and I know a little bit about Aboriginal mythology. I know some Dreamtime stories, but at least in my experience, I was never made to study it in-depth.   


I say that because I was curious if Aboriginal Australians have a concept that resembles what we consider the end of the world. Before anyone comments, I am fully aware that each region of Australia has different Aboriginal tribes with different belief systems. I am asking if said different tribes have their own interpretations of what we consider the end of the world.",True,False,False,religion,t5_2qh39,62555,public,self,Did/do Aboriginal Australians believe in the end of the world?,0,[],1.0,https://www.reddit.com/r/religion/comments/linqqq/diddo_aboriginal_australians_believe_in_the_end/,all_ads,6,,,,,,,,,,,,,,,,,,
8,[],False,Death_by_Jedi,,[],,text,t2_80u3mc6i,False,False,[],False,False,1613171879,youtube.com,https://www.reddit.com/r/religion/comments/liniky/getting_to_know_the_church_of_christ/,{},liniky,False,False,False,False,False,False,False,,[],dark,text,False,False,True,1,0,False,all_ads,/r/religion/comments/liniky/getting_to_know_the_church_of_christ/,False,6,1613171890,1,,True,False,False,religion,t5_2qh39,62554,public,https://b.thumbs.redditmedia.com/cbV4h9fut09lS9KuZAqIkNMTtN6PdRuVR45ZfBG5DIs.jpg,Getting to Know the Church Of Christ,0,[],1.0,https://youtube.com/watch?v=b8XBa5cIB8I&amp;feature=share,all_ads,6,moderator,rich:video,"{'enabled': False, 'images': [{'id': '2FpXtSJk4bs1fJXGfKo9caY8QsOTS1qk25XjQ0nM3xA', 'resolutions': [{'height': 81, 'url': 'https://external-preview.redd.it/9gBNq15yTZcBOTDKYA20TyTaQ6S94fxNeuF_SVgaDHg.jpg?width=108&amp;crop=smart&amp;auto=webp&amp;s=1fe38beec9921b80c58d5375879f935ff7f6957f', 'width': 108}, {'height': 162, 'url': 'https://external-preview.redd.it/9gBNq15yTZcBOTDKYA20TyTaQ6S94fxNeuF_SVgaDHg.jpg?width=216&amp;crop=smart&amp;auto=webp&amp;s=7a8c1885129e995e3f5d6b732c48e65f9d49ab11', 'width': 216}, {'height': 240, 'url': 'https://external-preview.redd.it/9gBNq15yTZcBOTDKYA20TyTaQ6S94fxNeuF_SVgaDHg.jpg?width=320&amp;crop=smart&amp;auto=webp&amp;s=15dd9b9a6b69b8476415a5ddc9935b8a8c299b67', 'width': 320}], 'source': {'height': 360, 'url': 'https://external-preview.redd.it/9gBNq15yTZcBOTDKYA20TyTaQ6S94fxNeuF_SVgaDHg.jpg?auto=webp&amp;s=6452b724206749818bdea824f0ee93222f32c4ba', 'width': 480}, 'variants': {}}]}",105.0,140.0,https://youtube.com/watch?v=b8XBa5cIB8I&amp;feature=share,"{'oembed': {'author_name': 'INC Media News', 'author_url': 'https://www.youtube.com/channel/UCVrtEeGnwAdvkWnd134AaLQ', 'height': 200, 'html': '&lt;iframe width=""356"" height=""200"" src=""https://www.youtube.com/embed/b8XBa5cIB8I?feature=oembed&amp;enablejsapi=1"" frameborder=""0"" allow=""accelerometer; autoplay; clipboard-write; encrypted-media; gyroscope; picture-in-picture"" allowfullscreen&gt;&lt;/iframe&gt;', 'provider_name': 'YouTube', 'provider_url': 'https://www.youtube.com/', 'thumbnail_height': 360, 'thumbnail_url': 'https://i.ytimg.com/vi/b8XBa5cIB8I/hqdefault.jpg', 'thumbnail_width': 480, 'title': 'Getting to Know the Church Of Christ', 'type': 'video', 'version': '1.0', 'width': 356}, 'type': 'youtube.com'}","{'content': '&lt;iframe width=""356"" height=""200"" src=""https://www.youtube.com/embed/b8XBa5cIB8I?feature=oembed&amp;enablejsapi=1"" frameborder=""0"" allow=""accelerometer; autoplay; clipboard-write; encrypted-media; gyroscope; picture-in-picture"" allowfullscreen&gt;&lt;/iframe&gt;', 'height': 200, 'scrolling': False, 'width': 356}","{'oembed': {'author_name': 'INC Media News', 'author_url': 'https://www.youtube.com/channel/UCVrtEeGnwAdvkWnd134AaLQ', 'height': 200, 'html': '&lt;iframe width=""356"" height=""200"" src=""https://www.youtube.com/embed/b8XBa5cIB8I?feature=oembed&amp;enablejsapi=1"" frameborder=""0"" allow=""accelerometer; autoplay; clipboard-write; encrypted-media; gyroscope; picture-in-picture"" allowfullscreen&gt;&lt;/iframe&gt;', 'provider_name': 'YouTube', 'provider_url': 'https://www.youtube.com/', 'thumbnail_height': 360, 'thumbnail_url': 'https://i.ytimg.com/vi/b8XBa5cIB8I/hqdefault.jpg', 'thumbnail_width': 480, 'title': 'Getting to Know the Church Of Christ', 'type': 'video', 'version': '1.0', 'width': 356}, 'type': 'youtube.com'}","{'content': '&lt;iframe width=""356"" height=""200"" src=""https://www.youtube.com/embed/b8XBa5cIB8I?feature=oembed&amp;enablejsapi=1"" frameborder=""0"" allow=""accelerometer; autoplay; clipboard-write; encrypted-media; gyroscope; picture-in-picture"" allowfullscreen&gt;&lt;/iframe&gt;', 'height': 200, 'media_domain_url': 'https://www.redditmedia.com/mediaembed/liniky', 'scrolling': False, 'width': 356}",,,,,,,,
9,[],False,88_bttf,,[],,text,t2_1kdw64dw,False,False,[],False,False,1613169059,self.religion,https://www.reddit.com/r/religion/comments/limiwp/is_it_wrong_for_me_to_want_to_draw_inspiration/,{},limiwp,True,False,False,False,True,True,False,,[],dark,text,False,False,False,31,0,False,all_ads,/r/religion/comments/limiwp/is_it_wrong_for_me_to_want_to_draw_inspiration/,False,6,1613169070,1,"My main belief is that there is one God who loves all His ( or their, or hers , whatever) creation and has no problem with LGBT+ people ( I'm a trans woman myself) . I have visited ( via Zoom ) a liberal masjid (al Rabia) and felt a sense of peace and ""rightness"" . I have been reading the Quran as well and it feels more ""right "" than what I've read of the Bible (I was raised a Christian) . I also like the idea of the hijab ( not as a tool of oppression or something that is forced, but as a personal choice and an identity thing ). I have considered converting but heres the problem:

A: I don't know that I believe the Quran is the literal word of God as opposed to an inspired text or that Mohammed was infallible , as some of the Quran and hadiths don't work when taken literally due to today's scientific and social knowledge.
B: I see good things in other religions . For example, I like the sense of tradition married to modern ethics of Reform Judaism ( and the holidays are beautiful ) and I think Jesus and Buddha, among others had wise words to take into consideration , whether or not they were inspired or just visionary thinkers. 
My question is, is being a generally spiritual person that draws life advice from multiple faiths wrong, if I'm not actually claiming to be a part of exclusive groups like the Jewish community ? I'm aware Unitarian Universalists kinda do this ( and I like that they're LGBT friendly, to boot  ) but I'm worried about offending people or somehow ""stealing"" their beliefs.",True,False,False,religion,t5_2qh39,62553,public,self,Is it wrong for me to want to draw inspiration from multiple religions?,0,[],1.0,https://www.reddit.com/r/religion/comments/limiwp/is_it_wrong_for_me_to_want_to_draw_inspiration/,all_ads,6,,,,,,,,,,,,,,,,,,
10,[],False,ahumanplace,,[],,text,t2_a627frzx,False,False,[],False,False,1613160560,self.religion,https://www.reddit.com/r/religion/comments/lijjtw/tattoos_and_god/,{},lijjtw,True,False,False,False,True,True,False,,[],dark,text,False,False,True,16,0,False,all_ads,/r/religion/comments/lijjtw/tattoos_and_god/,False,6,1613160571,1,Does your tattoos prevent you from expressing your faith/religion to others? Do you get judged by your religious community because of your tattoos? Are you losing faith in your religion because of the judgment of others due to your body art?,True,False,False,religion,t5_2qh39,62546,public,self,Tattoos and God,0,[],1.0,https://www.reddit.com/r/religion/comments/lijjtw/tattoos_and_god/,all_ads,6,,,,,,,,,,,,,,,,,,
11,[],False,hghjcfhh,,[],,text,t2_a7krd4fv,False,False,[],False,False,1613160357,self.religion,https://www.reddit.com/r/religion/comments/lijh6z/may_god_bless_you_all_much_love/,{},lijh6z,False,False,False,False,False,True,False,,[],dark,text,False,False,True,0,0,False,all_ads,/r/religion/comments/lijh6z/may_god_bless_you_all_much_love/,False,6,1613160368,1,[removed],True,False,False,religion,t5_2qh39,62546,public,self,May God bless you all! Much love❤️❤️,0,[],1.0,https://www.reddit.com/r/religion/comments/lijh6z/may_god_bless_you_all_much_love/,all_ads,6,automod_filtered,,,,,,,,,,,,,,,,,
12,[],False,DewVasil,,[],Muslim like my father Adam (Peace be upon him),text,t2_8kdmk1qz,False,False,[],False,False,1613160151,/r/religion/comments/lijeji/would_you_like_to_share_your_opinions/,https://www.reddit.com/r/religion/comments/lijeji/would_you_like_to_share_your_opinions/,{},lijeji,True,False,False,False,True,False,True,,[],dark,text,False,False,False,0,0,False,all_ads,/r/religion/comments/lijeji/would_you_like_to_share_your_opinions/,False,6,1613160162,1,,True,False,False,religion,t5_2qh39,62546,public,https://b.thumbs.redditmedia.com/crUjv7gEkl7UlJt1n-TW3sQn7B5kWYBUxEkX8cJPY6Q.jpg,Would you like to share your opinions ?,0,[],1.0,https://v.redd.it/f1ijgd4pr3h61,all_ads,6,,hosted:video,"{'enabled': False, 'images': [{'id': 'boO2dyNFPY__2RcW9VWH7z6OpWJ1X36gWoZbe44jMCk', 'resolutions': [{'height': 60, 'url': 'https://external-preview.redd.it/jMlNvcElr36EWUxAf0dEET1frJQel_SaeiPRVGY6PbY.png?width=108&amp;crop=smart&amp;format=pjpg&amp;auto=webp&amp;s=f09db7e7d91749eaa2cda0abcd37aea29b36951b', 'width': 108}, {'height': 121, 'url': 'https://external-preview.redd.it/jMlNvcElr36EWUxAf0dEET1frJQel_SaeiPRVGY6PbY.png?width=216&amp;crop=smart&amp;format=pjpg&amp;auto=webp&amp;s=91e34a1a25be79649649f505ee8fd9afc1fe26df', 'width': 216}, {'height': 179, 'url': 'https://external-preview.redd.it/jMlNvcElr36EWUxAf0dEET1frJQel_SaeiPRVGY6PbY.png?width=320&amp;crop=smart&amp;format=pjpg&amp;auto=webp&amp;s=f174dfd62cca24767c06dcaee9d56fe8e700fdc4', 'width': 320}, {'height': 359, 'url': 'https://external-preview.redd.it/jMlNvcElr36EWUxAf0dEET1frJQel_SaeiPRVGY6PbY.png?width=640&amp;crop=smart&amp;format=pjpg&amp;auto=webp&amp;s=98169be5bd6f0b0ef809c4da9929804c6c8fb770', 'width': 640}], 'source': {'height': 480, 'url': 'https://external-preview.redd.it/jMlNvcElr36EWUxAf0dEET1frJQel_SaeiPRVGY6PbY.png?format=pjpg&amp;auto=webp&amp;s=59edc6c9c07a2334efc7a61a0384b76cdbcbfcbc', 'width': 854}, 'variants': {}}]}",78.0,140.0,https://v.redd.it/f1ijgd4pr3h61,,,,,e9960ca0-3f4e-11e4-87bd-12313d148adf,dark,,,,,,
13,[],False,blspooner,,[],,text,t2_31kigum6,False,False,[],False,False,1613159419,i.redd.it,https://www.reddit.com/r/religion/comments/lij4oz/does_anyone_know_what_this_symbol_stands_for_i/,{},lij4oz,False,False,False,True,False,False,False,,[],dark,text,False,False,True,0,0,False,all_ads,/r/religion/comments/lij4oz/does_anyone_know_what_this_symbol_stands_for_i/,False,6,1613159430,1,,True,False,False,religion,t5_2qh39,62545,public,https://b.thumbs.redditmedia.com/xHx_Us_-x-l_OwQZitG1Ux_pFJJs7x8QngU3XSmihDQ.jpg,"Does anyone know what this symbol stands for? I realize it’s the Star of David, but it’s filled in, which I don’t think is common based on Google searches. A coworker has it for their Webex profile pic. Is there any special meaning behind it?",0,[],1.0,https://i.redd.it/ncvtfbpnp3h61.jpg,all_ads,6,automod_filtered,image,"{'enabled': True, 'images': [{'id': 'mSZI5ebmKTO-RYDnXLPNMqlOgH9qEMmNB70wbbNmkI0', 'resolutions': [{'height': 88, 'url': 'https://preview.redd.it/ncvtfbpnp3h61.jpg?width=108&amp;crop=smart&amp;auto=webp&amp;s=e4687c41dbfc12e23c23ef8ea866c4793873ae4c', 'width': 108}, {'height': 177, 'url': 'https://preview.redd.it/ncvtfbpnp3h61.jpg?width=216&amp;crop=smart&amp;auto=webp&amp;s=bb6df6c0871c6858e7e46c5b44ce9d7cdb5f786d', 'width': 216}, {'height': 263, 'url': 'https://preview.redd.it/ncvtfbpnp3h61.jpg?width=320&amp;crop=smart&amp;auto=webp&amp;s=732d1b5de58ee6bcf23e18c63ebc2d2d2f6f3258', 'width': 320}], 'source': {'height': 486, 'url': 'https://preview.redd.it/ncvtfbpnp3h61.jpg?auto=webp&amp;s=451861152a04b3700ee9f5727f21eb69f4b22c80', 'width': 590}, 'variants': {}}]}",115.0,140.0,https://i.redd.it/ncvtfbpnp3h61.jpg,,,,,,,,,,,,
14,[],False,Swordspirit2,,[],,text,t2_62lzo,False,False,[],False,False,1613153104,self.religion,https://www.reddit.com/r/religion/comments/ligrlc/if_you_like_many_have_been_dealing_with_fear_of/,{},ligrlc,True,False,False,False,True,True,False,,[],dark,text,False,False,True,1,0,False,all_ads,/r/religion/comments/ligrlc/if_you_like_many_have_been_dealing_with_fear_of/,False,6,1613153115,1,"""Even the definitions of heavens and hells are relative. For example, a place with constant bloody fighting, fiery sex, and feasts full of meat and drinks is heavenly to a 'Viking' and hellish to a typical 'Christian'; while for a warrior, a peaceful place would be hellish. Just as medicine to some is poison to others, paradise to one is infernal to the other. Fact is, what we see in many people from different religions concerning this is the same we see in many from different countries as ignorant patriotism: Everything that is not my heaven, is hell.""

From this book:
https://www.goodreads.com/book/show/54528383-servant-of-darkness-master-of-light

In my opinion this is a very good and logical way to think of different planes of existence: just like different countries... while lots of stupid judgmental people will always overvalue ""their"" country.",True,False,False,religion,t5_2qh39,62543,public,self,"If you, like many, have been dealing with fear of ""hell"", this is for you:",0,[],1.0,https://www.reddit.com/r/religion/comments/ligrlc/if_you_like_many_have_been_dealing_with_fear_of/,all_ads,6,,self,"{'enabled': False, 'images': [{'id': 'cup2v0K1Pzbxra4zB-rjlRMurVfnYuFYCzD5CLIh40c', 'resolutions': [{'height': 56, 'url': 'https://external-preview.redd.it/6ar6rhe6xmYKYkVw_kl8nmva-CbkhkREQUxrxaoBEtY.jpg?width=108&amp;crop=smart&amp;auto=webp&amp;s=c2e786c4245ef085bd060624250c84a50f191dbc', 'width': 108}, {'height': 113, 'url': 'https://external-preview.redd.it/6ar6rhe6xmYKYkVw_kl8nmva-CbkhkREQUxrxaoBEtY.jpg?width=216&amp;crop=smart&amp;auto=webp&amp;s=4fa80589cd548085419c9ff616b795ba22a82857', 'width': 216}, {'height': 168, 'url': 'https://external-preview.redd.it/6ar6rhe6xmYKYkVw_kl8nmva-CbkhkREQUxrxaoBEtY.jpg?width=320&amp;crop=smart&amp;auto=webp&amp;s=dca23d766a19098d1db78b86923de18b5f80f2d7', 'width': 320}, {'height': 336, 'url': 'https://external-preview.redd.it/6ar6rhe6xmYKYkVw_kl8nmva-CbkhkREQUxrxaoBEtY.jpg?width=640&amp;crop=smart&amp;auto=webp&amp;s=a0d97f762b631906b50bd3215476f3054909432f', 'width': 640}, {'height': 504, 'url': 'https://external-preview.redd.it/6ar6rhe6xmYKYkVw_kl8nmva-CbkhkREQUxrxaoBEtY.jpg?width=960&amp;crop=smart&amp;auto=webp&amp;s=99162095eb44c8c33f73b5be6e3bbd44bb1ef8f0', 'width': 960}, {'height': 567, 'url': 'https://external-preview.redd.it/6ar6rhe6xmYKYkVw_kl8nmva-CbkhkREQUxrxaoBEtY.jpg?width=1080&amp;crop=smart&amp;auto=webp&amp;s=f36ab3c61034e5c1c8deb9483109b26eb0531cd8', 'width': 1080}], 'source': {'height': 630, 'url': 'https://external-preview.redd.it/6ar6rhe6xmYKYkVw_kl8nmva-CbkhkREQUxrxaoBEtY.jpg?auto=webp&amp;s=2de4f797735fe1ac8a491a723fd4158ff96be67a', 'width': 1200}, 'variants': {}}]}",,,,,,,,,,,,,,,
