75,[],False,10beaufort,,[],,text,t2_pmiq3,False,False,[],False,False,1609578655,i.redd.it,https://www.reddit.com/r/religion/comments/kouglk/covid_churches_sin_not_welcoming_sinners/,{},kouglk,False,False,False,True,False,False,False,,[],dark,text,False,False,True,0,0,False,all_ads,/r/religion/comments/kouglk/covid_churches_sin_not_welcoming_sinners/,False,6,1609578666,1,,True,False,False,religion,t5_2qh39,60662,public,https://b.thumbs.redditmedia.com/vrzp-kwDKSoTswcdUAN9jG7q9tvAX8XWWNUbmLXGEzg.jpg,Covid churches sin not welcoming sinners,0,[],1.0,https://i.redd.it/izc4a1d7yv861.jpg,all_ads,6,automod_filtered,image,"{'enabled': True, 'images': [{'id': 'KpBPjn6xgpEW30isa7P_pE15_Yeboq62oludOnKKMCE', 'resolutions': [{'height': 81, 'url': 'https://preview.redd.it/izc4a1d7yv861.jpg?width=108&amp;crop=smart&amp;auto=webp&amp;s=1cda60ac094a3826114c9494d9612167b960a738', 'width': 108}, {'height': 162, 'url': 'https://preview.redd.it/izc4a1d7yv861.jpg?width=216&amp;crop=smart&amp;auto=webp&amp;s=e2de5b25579814f4ae6a2e5c21d89d1f746f6954', 'width': 216}, {'height': 240, 'url': 'https://preview.redd.it/izc4a1d7yv861.jpg?width=320&amp;crop=smart&amp;auto=webp&amp;s=325a73d5a940a8874cf798609048397527e46ec8', 'width': 320}, {'height': 480, 'url': 'https://preview.redd.it/izc4a1d7yv861.jpg?width=640&amp;crop=smart&amp;auto=webp&amp;s=520a6ab3bea63518e7be2c1e6da6d2714009810e', 'width': 640}, {'height': 720, 'url': 'https://preview.redd.it/izc4a1d7yv861.jpg?width=960&amp;crop=smart&amp;auto=webp&amp;s=fe116ba41a8525ed3f73a7fc308e358ace95c989', 'width': 960}, {'height': 810, 'url': 'https://preview.redd.it/izc4a1d7yv861.jpg?width=1080&amp;crop=smart&amp;auto=webp&amp;s=5995c238449854b4c4181f60342635227afcb026', 'width': 1080}], 'source': {'height': 3024, 'url': 'https://preview.redd.it/izc4a1d7yv861.jpg?auto=webp&amp;s=1cace55b66a4c9c8662eeed06b980bddf43cd768', 'width': 4032}, 'variants': {}}]}",105.0,140.0,https://i.redd.it/izc4a1d7yv861.jpg,,,,,,,,,,,
76,[],False,EliphaletZohar,,[],,text,t2_997rh4df,False,False,[],False,False,1609576886,self.religion,https://www.reddit.com/r/religion/comments/kou4jz/whats_the_difference_between_christianity_and/,{},kou4jz,True,False,False,False,True,True,False,,[],dark,text,False,False,False,8,0,False,all_ads,/r/religion/comments/kou4jz/whats_the_difference_between_christianity_and/,False,6,1609576896,1,,True,False,False,religion,t5_2qh39,60661,public,self,What's the difference between Christianity and Catholicism?,0,[],1.0,https://www.reddit.com/r/religion/comments/kou4jz/whats_the_difference_between_christianity_and/,all_ads,6,,,,,,,,,,,,,,,,,
77,[],False,ForeveranOasis,,[],,text,t2_7iqdqfxf,False,False,[],False,False,1609573397,self.religion,https://www.reddit.com/r/religion/comments/kotg5w/parents_dont_approve_of_my_new_girlfriend_because/,{},kotg5w,True,False,False,False,True,True,False,,[],dark,text,False,False,False,10,0,False,all_ads,/r/religion/comments/kotg5w/parents_dont_approve_of_my_new_girlfriend_because/,False,6,1609573407,1," Just in need of some opinions and advice on what to do

Long story short, my parents are very religious. When I was 12, they spoke to me about sexual purity and stuff from a very religious perspective, Christianity to be exact. It was a little cringy, but I survived lol. Fast forward to now, and I'm 17 years old. Have a friend who I've become close with from a school club, and after a few months, we began to talk about dating. However, after posting on FaceBook about us becoming official, I talked to my parents (out of respect) on the same day (recently), and they were happy for me, but asked to know a little more about her. I showed them her FaceBook and Instagram, only because they asked. Didn't think too much of it; she's a modest person lol. However, there are some photos of her gymnastics training and such, and my parents aren't crazy about her posting photos/images of her in a leotard (with shorts most of the time tho) and ""doing provocative things with her legs"", aka splits, to quote them directly. They continued, saying how a girlfriend should ""respect herself and you"" by ""not showing so much on social media""

They want to meet her soon, and now I regret showing them/telling them anything. I'm almost certain they'll bring it up to her, along with examples of how people from church wear t-shirts at pool parties to be ""modest among their Christian brethren"" and whatnot. Personally, I go to church, but I'm not very passionate/religious personally. She isn't religious either, and I don't want my parents to push their religious beliefs on her when she's not a part of their family and shouldn't have to pretend to be.

Do you have any advice on how to avoid this awkward situation that'll probably come off as weird and viewing a sport as wrongfully sexual and a portrayal of her character/morals?",True,False,False,religion,t5_2qh39,60662,public,self,Parents don't approve of my new girlfriend because she does gymnastics,0,[],1.0,https://www.reddit.com/r/religion/comments/kotg5w/parents_dont_approve_of_my_new_girlfriend_because/,all_ads,6,,,,,,,,,,,,,,,,,
78,[],False,zaksreddit,,[],,text,t2_51fcgxmt,False,False,[],False,False,1609570068,self.religion,https://www.reddit.com/r/religion/comments/kosrdm/a_major_thing_is_playing_out_before_our_eyes_from/,{},kosrdm,False,False,False,False,False,True,False,,[],dark,text,False,False,True,0,0,False,all_ads,/r/religion/comments/kosrdm/a_major_thing_is_playing_out_before_our_eyes_from/,False,6,1609570079,1,[removed],True,False,False,religion,t5_2qh39,60662,public,self,A major thing is playing out before our eyes from the religious texts about our world!,0,[],1.0,https://www.reddit.com/r/religion/comments/kosrdm/a_major_thing_is_playing_out_before_our_eyes_from/,all_ads,6,automod_filtered,self,"{'enabled': False, 'images': [{'id': 'Y0qdb0pltEaNZV3i_dM09_qr3P9Z__TQlaFht2hOpnw', 'resolutions': [{'height': 81, 'url': 'https://external-preview.redd.it/IMB8uJFjpgeFMfeyR-lCYjdDtVvsBajnJkC-sBKfbd0.jpg?width=108&amp;crop=smart&amp;auto=webp&amp;s=493d6562e6cb2993615ecfea11c60aedacf158dd', 'width': 108}, {'height': 162, 'url': 'https://external-preview.redd.it/IMB8uJFjpgeFMfeyR-lCYjdDtVvsBajnJkC-sBKfbd0.jpg?width=216&amp;crop=smart&amp;auto=webp&amp;s=18bd744044429902de2a1aaffc2c0bb6629817da', 'width': 216}, {'height': 240, 'url': 'https://external-preview.redd.it/IMB8uJFjpgeFMfeyR-lCYjdDtVvsBajnJkC-sBKfbd0.jpg?width=320&amp;crop=smart&amp;auto=webp&amp;s=b803d80d0618e3445a664c3f03c3833b7a14db8c', 'width': 320}], 'source': {'height': 360, 'url': 'https://external-preview.redd.it/IMB8uJFjpgeFMfeyR-lCYjdDtVvsBajnJkC-sBKfbd0.jpg?auto=webp&amp;s=047f26bbc7929d56004fe8f1516b8ea01102f8f1', 'width': 480}, 'variants': {}}]}",,,,,,,,,,,,,,
79,[],False,coconutpc,,[],,text,t2_81t9n1fu,False,False,[],False,False,1609568765,self.religion,https://www.reddit.com/r/religion/comments/kosgu0/relationship/,{},kosgu0,False,False,False,False,False,True,False,,[],dark,text,False,False,True,13,0,False,all_ads,/r/religion/comments/kosgu0/relationship/,False,6,1609568776,1,[removed],True,False,False,religion,t5_2qh39,60660,public,self,Relationship,0,[],1.0,https://www.reddit.com/r/religion/comments/kosgu0/relationship/,all_ads,6,automod_filtered,,,,,,,,,,,,,,,,
80,[],False,Traditional-Class904,,[],,text,t2_75zw0p9r,False,False,[],False,False,1609565325,self.religion,https://www.reddit.com/r/religion/comments/kornk9/monotheistic_base/,{},kornk9,True,False,False,False,True,True,False,,[],dark,text,False,False,False,15,0,False,all_ads,/r/religion/comments/kornk9/monotheistic_base/,False,6,1609565336,1,"The Rigveda speaks not only of the unity of gods but also of the organic unity of the entire existence. The ‘hymn of man’ (purusha sukta) delineates the heavens, the earth, planets, gods, living and non-living objects as the limbs of one great person who pervades the world and yet remains beyond it and inexhaustible. The characteristic of Vedic thought is that each god, when spoken of, is extolled as the supreme God, the creator of the universe and the lord of all gods. This led Prof Max Mueller to infer that Hinduism developed from polytheism through henotheism to monotheism. The fact, however, is that the Vedic religion has, from the beginning, a monotheistic orientation as evidenced by a number of hymns. ‘The One Reality is described by the wise in different ways’ (ekam sad viprā bahudā vadanti-Rig, I, clxiv, 46). ‘He is one without a second’ (ekamevadvityam-chandogya Upanisad, Vi, ii, 1), ‘All this verily is brahman’ (sarvam khalvidam brahme – chandogya, III, XIV, 1). Hindu cults like Śākta, Śaiva, Vaishnva, Saura and Ganapatya, though worshipping different deities, are at bottom, based on the concept of one supreme God. When the Azhvārs sing the glory of Vishnu, Nāyan(m)ars of Śiva, Vārkarīs of vitthal and Dhārkarīs of Rāma, they speak of the same God.",True,False,False,religion,t5_2qh39,60657,public,self,Monotheistic Base,0,[],1.0,https://www.reddit.com/r/religion/comments/kornk9/monotheistic_base/,all_ads,6,,,,,,,,,,,,,,,,,
81,[],False,MsWitchDoctor,,[],,text,t2_8cmeq5zc,False,False,[],False,False,1609561260,self.religion,https://www.reddit.com/r/religion/comments/koqmu2/the_angel/,{},koqmu2,True,False,False,False,True,True,False,,[],dark,text,False,False,True,0,0,False,all_ads,/r/religion/comments/koqmu2/the_angel/,False,6,1609561271,1,"Back in the late 90’s, I used to work for Movie Gallery. The best part of the job was talking to people, and everybody loved to talk to me because I was  a good listener. One day I was checking out a customer who was a preacher, we started talking and he told me  a story about one of his church members that was on her death bed and went to her home to comfort her and the family. He noticed that women kept looking at something in the room and he asked her what she was looking at. She told he she saw an angel, he asked her to to describe it. She said the angel was a male extremely tall and very handsome, she laughed after she said the handsome part.The preacher wanted his son to experience this so he said he was going to get his son, who was not far away. When they came back he asked the women where was the Angel now? She replied that the angel was standing right behind his son. The boy was scared and he moved away from the Angel. The women died with a smile on her face. I believe in angels, I never saw one but I know my guardian Angel is with me.",True,False,False,religion,t5_2qh39,60654,public,self,The Angel,0,[],1.0,https://www.reddit.com/r/religion/comments/koqmu2/the_angel/,all_ads,6,,,,,,,,,,,,,,,,,
82,[],False,ShampooZulu,,[],,text,t2_9ly2rtz9,False,False,[],False,False,1609558972,self.religion,https://www.reddit.com/r/religion/comments/koq1c1/what_makes_you_human/,{},koq1c1,False,False,False,False,False,True,False,,[],dark,text,False,False,True,6,0,False,all_ads,/r/religion/comments/koq1c1/what_makes_you_human/,False,6,1609558984,1,[removed],True,False,False,religion,t5_2qh39,60653,public,self,What Makes you Human?,0,[],1.0,https://www.reddit.com/r/religion/comments/koq1c1/what_makes_you_human/,all_ads,6,automod_filtered,,,,,,,,,,,,,,,,
83,[],False,GreenDeen_,,[],,text,t2_8hcwvbn7,False,False,[],False,False,1609557621,self.religion,https://www.reddit.com/r/religion/comments/kopof9/question_about_mark_1229_and_jesus/,{},kopof9,False,False,False,False,False,True,False,,[],dark,text,False,False,True,21,0,False,all_ads,/r/religion/comments/kopof9/question_about_mark_1229_and_jesus/,False,6,1609557632,1,[removed],True,False,False,religion,t5_2qh39,60654,public,self,Question about Mark 12:29 and Jesus,0,[],1.0,https://www.reddit.com/r/religion/comments/kopof9/question_about_mark_1229_and_jesus/,all_ads,6,automod_filtered,,,,,,,,,,,,,,,,
