54,[],False,EmbezzleMan,,[],,text,t2_8a977x06,False,False,[],False,False,1609619890,self.religion,https://www.reddit.com/r/religion/comments/kp57wx/isnt_the_devilsatan_actually_good_if_he_punishes/,{},kp57wx,True,False,False,False,True,True,False,,[],dark,text,False,False,True,21,0,False,all_ads,/r/religion/comments/kp57wx/isnt_the_devilsatan_actually_good_if_he_punishes/,False,6,1609619901,1,"I'm just a layman so please bear with me, but all I know is that the Devil is the ruler of hell. Naughty peeps get sent to hell and is then punished in a world ruled by the Devil...

&amp;#x200B;

Doesn't that make the Devil good in theory?",True,False,False,religion,t5_2qh39,60673,public,self,Isn't the devil/Satan actually good if he punishes the wicked?,0,[],1.0,https://www.reddit.com/r/religion/comments/kp57wx/isnt_the_devilsatan_actually_good_if_he_punishes/,all_ads,6,,,,,,,,,,,,,,,,,
55,[],False,RoscoeForthright2020,,[],,text,t2_8g6pvlap,False,False,[],False,False,1609618367,self.religion,https://www.reddit.com/r/religion/comments/kp4qw4/21st_century_religions_are_trapped_by_exhausted/,{},kp4qw4,False,False,False,False,False,True,False,,[],dark,text,False,False,True,11,0,False,all_ads,/r/religion/comments/kp4qw4/21st_century_religions_are_trapped_by_exhausted/,False,6,1609618378,1,[removed],True,False,False,religion,t5_2qh39,60672,public,self,21st Century religions are trapped by exhausted dogmas.,0,[],1.0,https://www.reddit.com/r/religion/comments/kp4qw4/21st_century_religions_are_trapped_by_exhausted/,all_ads,6,automod_filtered,,,,,,,,,,,,,,,,
56,[],False,KundalinirRZA,,[],,text,t2_3tyomzag,False,False,[],False,False,1609613756,self.religion,https://www.reddit.com/r/religion/comments/kp37m9/have_you_ever_felt_anxiety_taking_over_your/,{},kp37m9,True,False,False,False,True,True,False,,[],dark,text,False,False,False,0,0,False,all_ads,/r/religion/comments/kp37m9/have_you_ever_felt_anxiety_taking_over_your/,False,6,1609613767,1," I did untill I sat down and put all my attention on that area affected by my anxiety and started to slowly consciously guide my breath there.

What happened next was so unreal to me at that time.

I felt that area, which was hot from anxiety, become cold and colder as the ""stuck"" energy was being dispelled and after a while it felt as if I swallowed an ice cube which reached the depth of my stomach to that location.

To me this says a lot about how important it is to consciously breathe at specific times. 
For example did you know that certain diseases thrive in an oxygen less body?

The most interesting thing about breathing I learned is that it is one of the many expressions from what many would call prana (chi, life-force, prana, qi, ki, pitī, rapture, chills, spiritual chillls, goosebumps, ecstasy, euphoria, aura, mana, ruah, nephesch and many more). 

I made this [YouTube video](https://youtu.be/6F4Ux_V18bs) for you if you are interested in these concepts.",True,False,False,religion,t5_2qh39,60670,public,self,Have you ever felt anxiety taking over your stomach?,0,[],1.0,https://www.reddit.com/r/religion/comments/kp37m9/have_you_ever_felt_anxiety_taking_over_your/,all_ads,6,,self,"{'enabled': False, 'images': [{'id': 'SwTw_k5OA3hSjXSi6El8O9HSTMJT5BeUTzu8FirSjOw', 'resolutions': [{'height': 81, 'url': 'https://external-preview.redd.it/5L0gdD9Z3tw9EPBhA2-p-aeb0gxYqAZLs2P-O7eVK6c.jpg?width=108&amp;crop=smart&amp;auto=webp&amp;s=a613f950f032be691b91894e98ff33b18bde52d5', 'width': 108}, {'height': 162, 'url': 'https://external-preview.redd.it/5L0gdD9Z3tw9EPBhA2-p-aeb0gxYqAZLs2P-O7eVK6c.jpg?width=216&amp;crop=smart&amp;auto=webp&amp;s=7b85487fce0505e47b749bd87f9d6278fbf50fe6', 'width': 216}, {'height': 240, 'url': 'https://external-preview.redd.it/5L0gdD9Z3tw9EPBhA2-p-aeb0gxYqAZLs2P-O7eVK6c.jpg?width=320&amp;crop=smart&amp;auto=webp&amp;s=dc0a48382c8c56749ede46e02738961f74c4b384', 'width': 320}], 'source': {'height': 360, 'url': 'https://external-preview.redd.it/5L0gdD9Z3tw9EPBhA2-p-aeb0gxYqAZLs2P-O7eVK6c.jpg?auto=webp&amp;s=188fb8dc4dbd619809d209db5cd3649e6544de86', 'width': 480}, 'variants': {}}]}",,,,,,,,,,,,,,
57,[],False,VR360TV,,[],,text,t2_5zzpyeo,False,False,[],False,False,1609611001,youtu.be,https://www.reddit.com/r/religion/comments/kp2b5y/amazing_heavenly_video_that_demonstrates_the/,{},kp2b5y,False,False,False,False,False,False,False,,[],dark,text,False,False,True,0,0,False,all_ads,/r/religion/comments/kp2b5y/amazing_heavenly_video_that_demonstrates_the/,False,6,1609611012,1,,True,False,False,religion,t5_2qh39,60669,public,https://b.thumbs.redditmedia.com/u5Pmmd8EGlu7HDCNZmt_VKNCMPxRXwhQOstn0ZrvntI.jpg,"Amazing heavenly video that demonstrates the Lords power of creation, in a reading of Genesis for virtual reality.",0,[],1.0,https://youtu.be/QAOqct_BzAE,all_ads,6,moderator,rich:video,"{'enabled': False, 'images': [{'id': '-eXuG9kIacGjAKKcJPNWXQifqhstdw2t0vS1pAOy-l8', 'resolutions': [{'height': 81, 'url': 'https://external-preview.redd.it/9B0KrX2Mv6_q7mhpvQ3gN4xHuxwZAfmVFmnVA-R4pok.jpg?width=108&amp;crop=smart&amp;auto=webp&amp;s=df6e273b626209361e2526a6a14f0955fcfd2113', 'width': 108}, {'height': 162, 'url': 'https://external-preview.redd.it/9B0KrX2Mv6_q7mhpvQ3gN4xHuxwZAfmVFmnVA-R4pok.jpg?width=216&amp;crop=smart&amp;auto=webp&amp;s=46088418551b4aaec069bed9728a4dee8007ca24', 'width': 216}, {'height': 240, 'url': 'https://external-preview.redd.it/9B0KrX2Mv6_q7mhpvQ3gN4xHuxwZAfmVFmnVA-R4pok.jpg?width=320&amp;crop=smart&amp;auto=webp&amp;s=05de453397f7b0af507d52138672d71b93d2eee8', 'width': 320}], 'source': {'height': 360, 'url': 'https://external-preview.redd.it/9B0KrX2Mv6_q7mhpvQ3gN4xHuxwZAfmVFmnVA-R4pok.jpg?auto=webp&amp;s=c5ffbf54708664b41f869baa22f50fe918b01319', 'width': 480}, 'variants': {}}]}",105.0,140.0,https://youtu.be/QAOqct_BzAE,"{'oembed': {'author_name': 'VR 360 TV', 'author_url': 'https://www.youtube.com/channel/UCFnbMhff2fJ9Zf8i_vuRNIg', 'height': 200, 'html': '&lt;iframe width=""356"" height=""200"" src=""https://www.youtube.com/embed/QAOqct_BzAE?feature=oembed&amp;enablejsapi=1"" frameborder=""0"" allow=""accelerometer; autoplay; clipboard-write; encrypted-media; gyroscope; picture-in-picture"" allowfullscreen&gt;&lt;/iframe&gt;', 'provider_name': 'YouTube', 'provider_url': 'https://www.youtube.com/', 'thumbnail_height': 360, 'thumbnail_url': 'https://i.ytimg.com/vi/QAOqct_BzAE/hqdefault.jpg', 'thumbnail_width': 480, 'title': 'VR 360 Holy Bible - The book of Genesis in virtual reality from space', 'type': 'video', 'version': '1.0', 'width': 356}, 'type': 'youtube.com'}","{'content': '&lt;iframe width=""356"" height=""200"" src=""https://www.youtube.com/embed/QAOqct_BzAE?feature=oembed&amp;enablejsapi=1"" frameborder=""0"" allow=""accelerometer; autoplay; clipboard-write; encrypted-media; gyroscope; picture-in-picture"" allowfullscreen&gt;&lt;/iframe&gt;', 'height': 200, 'scrolling': False, 'width': 356}","{'oembed': {'author_name': 'VR 360 TV', 'author_url': 'https://www.youtube.com/channel/UCFnbMhff2fJ9Zf8i_vuRNIg', 'height': 200, 'html': '&lt;iframe width=""356"" height=""200"" src=""https://www.youtube.com/embed/QAOqct_BzAE?feature=oembed&amp;enablejsapi=1"" frameborder=""0"" allow=""accelerometer; autoplay; clipboard-write; encrypted-media; gyroscope; picture-in-picture"" allowfullscreen&gt;&lt;/iframe&gt;', 'provider_name': 'YouTube', 'provider_url': 'https://www.youtube.com/', 'thumbnail_height': 360, 'thumbnail_url': 'https://i.ytimg.com/vi/QAOqct_BzAE/hqdefault.jpg', 'thumbnail_width': 480, 'title': 'VR 360 Holy Bible - The book of Genesis in virtual reality from space', 'type': 'video', 'version': '1.0', 'width': 356}, 'type': 'youtube.com'}","{'content': '&lt;iframe width=""356"" height=""200"" src=""https://www.youtube.com/embed/QAOqct_BzAE?feature=oembed&amp;enablejsapi=1"" frameborder=""0"" allow=""accelerometer; autoplay; clipboard-write; encrypted-media; gyroscope; picture-in-picture"" allowfullscreen&gt;&lt;/iframe&gt;', 'height': 200, 'media_domain_url': 'https://www.redditmedia.com/mediaembed/kp2b5y', 'scrolling': False, 'width': 356}",,,,,,,
58,[],False,Boka_BB,,[],,text,t2_7np5atr8,False,False,[],False,False,1609610689,self.religion,https://www.reddit.com/r/religion/comments/kp27kt/rthereisgoda_community_defending_gods_existence/,{},kp27kt,True,False,False,False,True,True,False,,[],dark,text,False,False,True,21,0,False,all_ads,/r/religion/comments/kp27kt/rthereisgoda_community_defending_gods_existence/,False,6,1609610700,1,"Please join r/ThereIsGod,a community dedicated to the defending of the existence of God. We accept all people to discuss.
Have a good day!

Boka_BB",True,False,False,religion,t5_2qh39,60668,public,self,r/ThereIsGod:a community defending God's existence,0,[],1.0,https://www.reddit.com/r/religion/comments/kp27kt/rthereisgoda_community_defending_gods_existence/,all_ads,6,,,,,,,,,,,,,,,,,
59,[],False,qavempace,,[],Sunni Muslim - Hanafi,text,t2_4xfk95zq,False,False,[],False,False,1609608869,self.religion,https://www.reddit.com/r/religion/comments/kp1m95/new_years_thought_how_much_did_your_religious/,{},kp1m95,True,False,False,False,True,True,False,,[],dark,text,False,False,True,128,0,False,all_ads,/r/religion/comments/kp1m95/new_years_thought_how_much_did_your_religious/,False,6,1609608880,1,"For me its a lot. 2019, I was kind of a Sufi - philosophy mixed Muslim. Some of my friends  was even  predicting that I will become an atheist soon. 

But, the pandemic, forced me to stay home and read a lot. So, I discovered modernistic views on Islam.

Besides,  I studied Judaism a little more. And I studied divinity a little more than before. I started knowing deeper about different other religions.

In practice, I started praying in a more communicative way. I started reading Quran in a more investigative manner. Started regular fasting. I started following a Sharia, that is more robust and true to the original. 

So, 2020 made me humbler, more tolerant to other religious views and more devout to my own religion. 
Way more open. Way more closer. 

May God bless you all.",True,False,False,religion,t5_2qh39,60671,public,self,New Year's Thought: How much did your religious views change in 2020?,0,[],1.0,https://www.reddit.com/r/religion/comments/kp1m95/new_years_thought_how_much_did_your_religious/,all_ads,6,,,,,,,,,,,,,,e9960ca0-3f4e-11e4-87bd-12313d148adf,dark,,
60,[],False,qavempace,,[],Sunni Muslim - Hanafi,text,t2_4xfk95zq,False,False,[],False,False,1609608607,self.religion,https://www.reddit.com/r/religion/comments/kp1j39/how_much_your_religious_views_changed_in_2020_new/,{},kp1j39,True,False,False,False,True,True,False,,[],dark,text,False,False,True,0,0,False,all_ads,/r/religion/comments/kp1j39/how_much_your_religious_views_changed_in_2020_new/,False,6,1609608617,1,"For me its a lot. 2019, I was kind of a Sufi - philosophy mixed Muslim. Some of my friends  was even  predicting that I will become an atheist soon. 

But, the pandemic, forced me to stay home and read a lot. So, I discovered modernistic views on Islam.

Besides,  I studied Judaism a little more. And I studied divinity a little more than before. I started knowing deeper about different other religions.

In practice, I started praying in a more communicative way. I started reading Quran in a more investigative manner. Started regular fasting. I started following a Sharia, that is more robust and true to the original. 

So, 2020 made me humbler, more tolerant to other religious views and more devout to my own religion. 
Way more open. Way more closer. 

May God bless you all.",True,False,False,religion,t5_2qh39,60671,public,self,How much your religious views changed in 2020? (New Year Thought),0,[],1.0,https://www.reddit.com/r/religion/comments/kp1j39/how_much_your_religious_views_changed_in_2020_new/,all_ads,6,,,,,,,,,,,,,,e9960ca0-3f4e-11e4-87bd-12313d148adf,dark,,
61,[],False,Erudenam,,[],,text,t2_9lmcdu31,False,False,[],False,False,1609607445,self.religion,https://www.reddit.com/r/religion/comments/kp1625/what_are_the_chances_of_reincarnation_being_real/,{},kp1625,False,False,False,False,False,True,False,,[],dark,text,False,False,True,24,0,False,all_ads,/r/religion/comments/kp1625/what_are_the_chances_of_reincarnation_being_real/,False,6,1609607456,1,[removed],True,False,False,religion,t5_2qh39,60670,public,self,what are the chances of reincarnation being real?,0,[],1.0,https://www.reddit.com/r/religion/comments/kp1625/what_are_the_chances_of_reincarnation_being_real/,all_ads,6,automod_filtered,,,,,,,,,,,,,,,,
62,[],False,ThinkLots,,[],,text,t2_9jzyezjj,False,False,[],False,False,1609605829,self.religion,https://www.reddit.com/r/religion/comments/kp0ner/i_was_wondering_what_people_think_about_why_the/,{},kp0ner,False,False,False,False,False,True,False,,[],dark,text,False,False,True,17,0,False,all_ads,/r/religion/comments/kp0ner/i_was_wondering_what_people_think_about_why_the/,False,6,1609605842,1,[removed],True,False,False,religion,t5_2qh39,60669,public,self,"I was wondering what people think about why the major religions of the world have so many followers. Is it mainly because the followers of the faiths have true faith in the religions, or because of societal expectations, or economic and political security, or something else?",0,[],1.0,https://www.reddit.com/r/religion/comments/kp0ner/i_was_wondering_what_people_think_about_why_the/,all_ads,6,automod_filtered,,,,,,,,,,,,,,,,
63,[],False,ElliottLikesPlants,,[],,text,t2_8e8cibbs,False,False,[],False,False,1609605123,self.religion,https://www.reddit.com/r/religion/comments/kp0ft7/closed_religions_in_popculture/,{},kp0ft7,False,False,False,False,False,True,False,,[],dark,text,False,False,True,0,0,False,all_ads,/r/religion/comments/kp0ft7/closed_religions_in_popculture/,False,6,1609605134,1,[removed],True,False,False,religion,t5_2qh39,60670,public,self,Closed religions in pop-culture,0,[],1.0,https://www.reddit.com/r/religion/comments/kp0ft7/closed_religions_in_popculture/,all_ads,6,automod_filtered,,,,,,,,,,,,,,,,
64,[],False,NejdKing,,[],,text,t2_1y4w9zbm,False,False,[],False,False,1609604775,self.religion,https://www.reddit.com/r/religion/comments/kp0c5g/ive_noticed_that_western_world_contradict_almost/,{},kp0c5g,True,False,False,False,True,True,False,,[],dark,text,False,False,False,22,0,False,all_ads,/r/religion/comments/kp0c5g/ive_noticed_that_western_world_contradict_almost/,False,6,1609604786,1,"Western Socities which the majority consist of secular and pro-liberalism people ( Excluding a few convervative countries  like Poland) believe almost the opposite of Abrahamic religons ( Islam, Christianity, Judaism ).

**Here is some major examples:**

 **Sex outside marriage:**

*Religion : Forbidden / Western World : Legal and Allowed* 

**Alcohol :**

*Religion ( Islam ) : Forbidden / Western World : Legal and Allowed*

**Homosexuality :** 

*Religion : Forbidden / Western World : Pro LGBT+*

**Abortion :** 

*Religion : Forbidden / Western World ( Majority ) : Pro Abortion*

**Women to wear Skirts, Leggins and short clothes in Public :**

*Religion : Forbidden / Western World : Accepted and Promoted*

**Gambling :** 

*Religion : Forbidden / Western World : Legal and Allowed*

**Religion :**

*Western World : Secular and large number if not most of people are non believers /* 

*Other countries : Majority are believers* 

&amp;#x200B;

Now my question is, why is there so much contradiction between the western world and the others ?  Was it done on purpose to opposite every main rule of religion?",True,False,False,religion,t5_2qh39,60669,public,self,I've noticed that western world contradict almost every rule in Abrahamic religions,0,[],1.0,https://www.reddit.com/r/religion/comments/kp0c5g/ive_noticed_that_western_world_contradict_almost/,all_ads,6,,,,,,,,,,,,,,,,,
65,[],False,thedowcast,,[],,text,t2_5sd4k01y,False,False,[],False,False,1609600869,self.religion,https://www.reddit.com/r/religion/comments/koz65a/satan_seeks_expression_through_pacifism_in/,{},koz65a,False,False,False,False,False,True,False,,[],dark,text,False,False,True,0,0,False,all_ads,/r/religion/comments/koz65a/satan_seeks_expression_through_pacifism_in/,False,6,1609600880,1,[removed],True,False,False,religion,t5_2qh39,60669,public,self,Satan seeks expression through pacifism in Chapter 54 of Ares Le Mandat,0,[],1.0,https://www.reddit.com/r/religion/comments/koz65a/satan_seeks_expression_through_pacifism_in/,all_ads,6,automod_filtered,self,"{'enabled': False, 'images': [{'id': 'lQy2tarKlHXG8-unsT8yjlMHEZrbwkxn1oum8_B5ELQ', 'resolutions': [{'height': 162, 'url': 'https://external-preview.redd.it/-lho7TDep8xsyCqwWAsgEqnUx1vMUvWitiqh_JAUahg.jpg?width=108&amp;crop=smart&amp;auto=webp&amp;s=4ba7acbe13aeda843c621f1b7fbeb70a5e494158', 'width': 108}], 'source': {'height': 270, 'url': 'https://external-preview.redd.it/-lho7TDep8xsyCqwWAsgEqnUx1vMUvWitiqh_JAUahg.jpg?auto=webp&amp;s=03526c704b5c0ea08ac9b6f5504dd6d4a1147b91', 'width': 180}, 'variants': {}}]}",,,,,,,,,,,,,,
66,[],False,BoyDilly,,[],,text,t2_3kwsmof7,False,False,[],False,False,1609598285,self.religion,https://www.reddit.com/r/religion/comments/koyg9k/exposing_islam_you_should_know_this/,{},koyg9k,False,False,False,False,False,True,False,,[],dark,text,False,False,True,0,0,False,all_ads,/r/religion/comments/koyg9k/exposing_islam_you_should_know_this/,False,6,1609598297,1,[removed],True,False,False,religion,t5_2qh39,60669,public,self,Exposing Islam (you should know this),0,[],1.0,https://www.reddit.com/r/religion/comments/koyg9k/exposing_islam_you_should_know_this/,all_ads,6,automod_filtered,self,"{'enabled': False, 'images': [{'id': 'CV81f24nUnKNzh61zmDkFesqifn9sn68MBDT5lHs-0c', 'resolutions': [{'height': 81, 'url': 'https://external-preview.redd.it/yE3-sMHpRAnOd2c77k1OohOtfUdDFsMnJo8k9ubBrbM.jpg?width=108&amp;crop=smart&amp;auto=webp&amp;s=a3722de34f4931f2b50672a5c004401c0a39fb95', 'width': 108}, {'height': 162, 'url': 'https://external-preview.redd.it/yE3-sMHpRAnOd2c77k1OohOtfUdDFsMnJo8k9ubBrbM.jpg?width=216&amp;crop=smart&amp;auto=webp&amp;s=991b4cbb08131406b43e2264706f49031872fdf8', 'width': 216}, {'height': 240, 'url': 'https://external-preview.redd.it/yE3-sMHpRAnOd2c77k1OohOtfUdDFsMnJo8k9ubBrbM.jpg?width=320&amp;crop=smart&amp;auto=webp&amp;s=5ca51319672c75f5940b0bb9ff735be497a63d4b', 'width': 320}], 'source': {'height': 360, 'url': 'https://external-preview.redd.it/yE3-sMHpRAnOd2c77k1OohOtfUdDFsMnJo8k9ubBrbM.jpg?auto=webp&amp;s=6cf055d348437005299e6c0ed3aefef9c1309dca', 'width': 480}, 'variants': {}}]}",,,,,,,,,,,,,,
67,[],False,tripdarlyn,,[],,text,t2_6p99d9m5,False,False,[],False,False,1609591911,i.redd.it,https://www.reddit.com/r/religion/comments/kox08h/interesting_take_on_the_old_testament_of_the/,{},kox08h,False,False,False,True,False,False,False,,[],dark,text,False,False,True,0,0,False,all_ads,/r/religion/comments/kox08h/interesting_take_on_the_old_testament_of_the/,False,6,1609591921,1,,True,False,False,religion,t5_2qh39,60663,public,https://b.thumbs.redditmedia.com/9dpQ6Hh9x_lj34b6cKHZxlWoH_uGTShKmJ6AcxoZeBk.jpg,Interesting take on the old testament of the Bible written from Lucifer's perspective,0,[],1.0,https://i.redd.it/vep8zrcm1x861.jpg,all_ads,6,automod_filtered,image,"{'enabled': True, 'images': [{'id': 'VONZaU4XrUnc6ho1jmWqXGkuWruxtspV-fm5evHGGl4', 'resolutions': [{'height': 108, 'url': 'https://preview.redd.it/vep8zrcm1x861.jpg?width=108&amp;crop=smart&amp;auto=webp&amp;s=98fd723d0904a4156ff1c70792ebe4a868095c63', 'width': 108}, {'height': 216, 'url': 'https://preview.redd.it/vep8zrcm1x861.jpg?width=216&amp;crop=smart&amp;auto=webp&amp;s=0099d073d1e3a8576230a479a1024979406c9588', 'width': 216}, {'height': 320, 'url': 'https://preview.redd.it/vep8zrcm1x861.jpg?width=320&amp;crop=smart&amp;auto=webp&amp;s=6bced65cd5dce307f9c3f15c9764d3fc0d9bb6c1', 'width': 320}, {'height': 640, 'url': 'https://preview.redd.it/vep8zrcm1x861.jpg?width=640&amp;crop=smart&amp;auto=webp&amp;s=1d20b7c926c818fc57174b1912fc8b535308e046', 'width': 640}], 'source': {'height': 756, 'url': 'https://preview.redd.it/vep8zrcm1x861.jpg?auto=webp&amp;s=8f3038cb731d3ad861f749d88aa4a72df6d24de3', 'width': 756}, 'variants': {}}]}",140.0,140.0,https://i.redd.it/vep8zrcm1x861.jpg,,,,,,,,,,,
68,[],False,joeri1505,,[],,text,t2_fkltj,False,False,[],False,False,1609587914,self.religion,https://www.reddit.com/r/religion/comments/kow840/what_was_jezus_occupation/,{},kow840,True,False,False,False,True,True,False,,[],dark,text,False,False,False,13,0,False,all_ads,/r/religion/comments/kow840/what_was_jezus_occupation/,False,6,1609587924,1,"I'm not religious but I grew up in a moderate catholic family. I've always been taught that he was a fisherman and i know people use the symbol of a fish to reference him.
But lately i've been seeing people say that he was a carpenter. 

As far as i know, Josef was a carpenter, but not Jesus.

Im curious what you guys think and if anybody knows where this information comes from.",True,False,False,religion,t5_2qh39,60663,public,self,What was Jezus' occupation?,0,[],1.0,https://www.reddit.com/r/religion/comments/kow840/what_was_jezus_occupation/,all_ads,6,,,,,,,,,,,,,,,,,
69,[],False,Inflated-Charisma,,[],,text,t2_8m7docl1,False,False,[],False,False,1609587739,self.religion,https://www.reddit.com/r/religion/comments/kow6wn/why_did_god_make_us_so_imperfect_and_doesnt/,{},kow6wn,True,False,False,False,True,True,False,,[],dark,text,False,False,True,104,0,False,all_ads,/r/religion/comments/kow6wn/why_did_god_make_us_so_imperfect_and_doesnt/,False,6,1609587749,1,Why are so many people born with problems ranging from mild to extremely severe? Why do we have hair and nails that keep growing forever and why do our bodies need so much maintenance to remain good looking and clean? All of this can be explained by evolution and doesn't Darwinian theory of evolution disprove god?,True,False,False,religion,t5_2qh39,60663,public,self,Why did God make us so imperfect and doesn't evolution disprove God?,0,[],1.0,https://www.reddit.com/r/religion/comments/kow6wn/why_did_god_make_us_so_imperfect_and_doesnt/,all_ads,6,,,,,,,,,,,,,,,,,
70,[],False,Erudenam,,[],,text,t2_9lmcdu31,False,False,[],False,False,1609587690,self.religion,https://www.reddit.com/r/religion/comments/kow6ly/hypothetical_scenarios/,{},kow6ly,False,False,False,False,False,True,False,,[],dark,text,False,False,True,0,0,False,all_ads,/r/religion/comments/kow6ly/hypothetical_scenarios/,False,6,1609587700,1,[removed],True,False,False,religion,t5_2qh39,60663,public,self,Hypothetical Scenarios,0,[],1.0,https://www.reddit.com/r/religion/comments/kow6ly/hypothetical_scenarios/,all_ads,6,automod_filtered,,,,,,,,,,,,,,,,
71,[],False,ionised05,,[],,text,t2_9kkm9gbu,False,False,[],False,False,1609587639,self.religion,https://www.reddit.com/r/religion/comments/kow69c/why_did_god_make_us_imperfect_and_doesnt/,{},kow69c,False,False,False,False,False,True,False,,[],dark,text,False,False,True,0,0,False,all_ads,/r/religion/comments/kow69c/why_did_god_make_us_imperfect_and_doesnt/,False,6,1609587650,1,[removed],True,False,False,religion,t5_2qh39,60663,public,self,Why did God make us imperfect and doesn't evolution disprove god?,0,[],1.0,https://www.reddit.com/r/religion/comments/kow69c/why_did_god_make_us_imperfect_and_doesnt/,all_ads,6,automod_filtered,,,,,,,,,,,,,,,,
72,[],False,Mike_OxonFaier,,[],,text,t2_9jib263z,False,False,[],False,False,1609585852,self.religion,https://www.reddit.com/r/religion/comments/kovu6k/love_and_hate/,{},kovu6k,False,False,False,False,False,True,False,,[],dark,text,False,False,True,7,0,False,all_ads,/r/religion/comments/kovu6k/love_and_hate/,False,6,1609585862,1,[removed],True,False,False,religion,t5_2qh39,60662,public,self,Love and hate,0,[],1.0,https://www.reddit.com/r/religion/comments/kovu6k/love_and_hate/,all_ads,6,automod_filtered,,,,,,,,,,,,,,,,
73,[],False,torvliet,,[],,text,t2_nd3hn,False,False,[],False,False,1609582184,self.religion,https://www.reddit.com/r/religion/comments/kov5cw/to_all_of_those_out_there_who_were_secular_or/,{},kov5cw,True,False,False,False,True,True,False,,[],dark,text,False,False,False,30,0,False,all_ads,/r/religion/comments/kov5cw/to_all_of_those_out_there_who_were_secular_or/,False,6,1609582195,1,"Hello, I know this may seem like a provoking title, but there is only genuine interest as I am leaning towards a faith myself as a person who has renounced religions of all kinds for the better part of my life. So I have been curious what others may have arrived at before converting or changing so drastically. Any responses will be incredibly helpful. Thanks",True,False,False,religion,t5_2qh39,60663,public,self,"To all of those out there who were secular or anti-religion and converted, when did you know it was time?",0,[],1.0,https://www.reddit.com/r/religion/comments/kov5cw/to_all_of_those_out_there_who_were_secular_or/,all_ads,6,,,,,,,,,,,,,,,,,
74,[],False,Triceratop03,,[],,text,t2_4va4jb8o,False,False,[],False,False,1609579652,self.religion,https://www.reddit.com/r/religion/comments/koundw/im_searching_a_pantheistic_religion/,{},koundw,True,False,False,False,True,True,False,,[],dark,text,False,False,False,10,0,False,all_ads,/r/religion/comments/koundw/im_searching_a_pantheistic_religion/,False,6,1609579663,1,"Hi, I’m a guy from Italy who before the lockdowns considered himself atheist. But during the 2020 I’ve created a religious conscience. My family, obviously, is catholic but for me the divine figure of Jesus is unrealistic and the worship of the saint is idolatry. At school I’ve studied Giordano Bruno who was a pantheist philosopher and I’m agree with him. So I thought that in this subreddit someone could help me for the research of a pantheistic religion (please don’t Wicca or neopaganism). Thanks for the attention and excuse me for the English 🙃🤞",True,False,False,religion,t5_2qh39,60662,public,self,I’m searching a pantheistic religion,0,[],0.99,https://www.reddit.com/r/religion/comments/koundw/im_searching_a_pantheistic_religion/,all_ads,6,,,,,,,,,,,,,,,,,
