7,[],False,EconTonic,,[],,text,t2_63xz12ne,False,False,[],False,False,1612146010,self.religion,https://www.reddit.com/r/religion/comments/l9sden/thomas_jefferson_and_the_existence_of_god/,{},l9sden,True,False,False,False,True,True,False,,[],dark,text,False,False,False,32,0,False,all_ads,/r/religion/comments/l9sden/thomas_jefferson_and_the_existence_of_god/,False,6,1612428165,3,"I’m looking for a quote. 

The quote originally came from Thomas Jefferson but was repeated at some point by Ronald Reagan during his presidency. I heard it in a documentary called the “The Family 2019” a while ago but don’t want to rewatch the whole documentary for a single quote. 

I remember pretty much exactly what the quote was yet every time I search for it google just buries me in all things Thomas Jefferson except the thing I’m looking for. It’s basically this: I’m now more certain then ever that there is a god presiding over this world.”

Anyway, somebody was telling me that some scientists might be about to meaningfully disprove entropy(not sure if that’s true) and by extension give validity to intelligent design and that quote came to mind.

Edit: took a 45 minute course on thermodynamics and realize that whatever that guy was saying makes no sense, would still like to know what the quote is though.",True,False,False,religion,t5_2qh39,62176,public,self,Thomas Jefferson and the Existence of God?,0,[],1.0,https://www.reddit.com/r/religion/comments/l9sden/thomas_jefferson_and_the_existence_of_god/,all_ads,6,,,,,,,,,,,,,1612217737.0,,,,,,,,
8,[],False,TheRealNutMasterFlex,,[],,text,t2_a3nttyws,False,False,[],False,False,1612145590,self.religion,https://www.reddit.com/r/religion/comments/l9s8ng/help/,{},l9s8ng,False,False,False,False,False,True,False,,[],dark,text,False,False,True,0,0,False,all_ads,/r/religion/comments/l9s8ng/help/,False,6,1612427843,1,[removed],True,False,False,religion,t5_2qh39,62176,public,default,Help!,0,[],1.0,https://www.reddit.com/r/religion/comments/l9s8ng/help/,all_ads,6,,,,,,moderator,,,,,,,,,,,,,,,
9,[],False,NoxXNemesis,,[],,text,t2_80huxe7v,False,False,[],False,False,1612140838,self.religion,https://www.reddit.com/r/religion/comments/l9qpm4/a_question_for_religions_against_idolatry/,{},l9qpm4,True,False,False,False,True,True,False,,[],dark,text,False,False,False,30,0,False,all_ads,/r/religion/comments/l9qpm4/a_question_for_religions_against_idolatry/,False,6,1612424133,3,"Hello, as a pagan the top argument I hear for why I am evil is that I practice idolatry. I am not looking to put anyone down as everyone is free to believe what they want, but I am looking to educate myself on why that's so bad? From what I have gathered it is bad because I worship ""material wealth?"" Which isnt true obviously so I am kind of confused. Also what is the difference between me having and worshipping at an altar and let's say a Christian having and worshipping at a church for idolatry?",True,False,False,religion,t5_2qh39,62173,public,self,A question for religions against idolatry,0,[],0.8,https://www.reddit.com/r/religion/comments/l9qpm4/a_question_for_religions_against_idolatry/,all_ads,6,,,,,,,,,,,,,,,,,,,,,
10,[],False,Atomic_Dove,,[],,text,t2_2rddl1ao,False,False,[],False,False,1612139337,self.religion,https://www.reddit.com/r/religion/comments/l9q8f8/thank_you_god_but_no_thank_you_is_suicide_a_faith/,{},l9q8f8,True,False,False,False,True,True,False,,[],dark,text,False,False,False,48,0,False,all_ads,/r/religion/comments/l9q8f8/thank_you_god_but_no_thank_you_is_suicide_a_faith/,False,6,1612422980,2,,True,False,False,religion,t5_2qh39,62171,public,self,"Thank you, God, but no thank you: Is suicide a faith neutral option or do we have to suffer the Lord's wrath as well?",0,[],0.67,https://www.reddit.com/r/religion/comments/l9q8f8/thank_you_god_but_no_thank_you_is_suicide_a_faith/,all_ads,6,,,,,,,,,,,,,,,,,,,,,
11,[],True,RRModPostBot,,[],,text,t2_86hkjlbk,False,False,[],False,False,1612137617,self.religion,https://www.reddit.com/r/religion/comments/l9pnrt/weekly_what_is_my_religion_discussion/,{},l9pnrt,True,False,False,False,True,True,False,,[],dark,text,False,False,False,15,0,False,all_ads,/r/religion/comments/l9pnrt/weekly_what_is_my_religion_discussion/,False,6,1612421644,2,"Are you looking for suggestions of what religion suits your beliefs?
Or maybe you're curious about joining a religion with certain qualities but don't know if it exists?
Once a week, we provide an opportunity here for you to ask other users what religion fits you.",True,False,True,religion,t5_2qh39,62171,public,self,"Weekly ""What is my religion?"" discussion",0,[],0.67,https://www.reddit.com/r/religion/comments/l9pnrt/weekly_what_is_my_religion_discussion/,all_ads,6,,,,,,,,,,,,,,moderator,949383f4-9427-11e8-90d9-0ef42336c05a,Jan 31 - Feb 7,,,,,
12,"[{'award_sub_type': 'GLOBAL', 'award_type': 'global', 'awardings_required_to_grant_benefits': None, 'coin_price': 100, 'coin_reward': 0, 'count': 1, 'days_of_drip_extension': 0, 'days_of_premium': 0, 'description': ""Shows the Silver Award... and that's it."", 'end_date': None, 'giver_coin_reward': None, 'icon_format': None, 'icon_height': 512, 'icon_url': 'https://www.redditstatic.com/gold/awards/icon/silver_512.png', 'icon_width': 512, 'id': 'gid_1', 'is_enabled': True, 'is_new': False, 'name': 'Silver', 'penny_donate': None, 'penny_price': None, 'resized_icons': [{'height': 16, 'url': 'https://www.redditstatic.com/gold/awards/icon/silver_16.png', 'width': 16}, {'height': 32, 'url': 'https://www.redditstatic.com/gold/awards/icon/silver_32.png', 'width': 32}, {'height': 48, 'url': 'https://www.redditstatic.com/gold/awards/icon/silver_48.png', 'width': 48}, {'height': 64, 'url': 'https://www.redditstatic.com/gold/awards/icon/silver_64.png', 'width': 64}, {'height': 128, 'url': 'https://www.redditstatic.com/gold/awards/icon/silver_128.png', 'width': 128}], 'resized_static_icons': [{'height': 16, 'url': 'https://www.redditstatic.com/gold/awards/icon/silver_16.png', 'width': 16}, {'height': 32, 'url': 'https://www.redditstatic.com/gold/awards/icon/silver_32.png', 'width': 32}, {'height': 48, 'url': 'https://www.redditstatic.com/gold/awards/icon/silver_48.png', 'width': 48}, {'height': 64, 'url': 'https://www.redditstatic.com/gold/awards/icon/silver_64.png', 'width': 64}, {'height': 128, 'url': 'https://www.redditstatic.com/gold/awards/icon/silver_128.png', 'width': 128}], 'start_date': None, 'static_icon_height': 512, 'static_icon_url': 'https://www.redditstatic.com/gold/awards/icon/silver_512.png', 'static_icon_width': 512, 'subreddit_coin_reward': 0, 'subreddit_id': None, 'tiers_by_required_awardings': None}]",False,BlankVerse,,[],,text,t2_97a3,False,False,[],False,False,1612134269,latimes.com,https://www.reddit.com/r/religion/comments/l9ojd6/he_made_sure_the_bodies_of_the_muslim_dead_faced/,{'gid_1': 1},l9ojd6,True,False,False,False,True,False,False,,[],dark,text,False,False,False,6,0,False,all_ads,/r/religion/comments/l9ojd6/he_made_sure_the_bodies_of_the_muslim_dead_faced/,False,6,1612419048,76,,True,False,False,religion,t5_2qh39,62169,public,https://b.thumbs.redditmedia.com/Zn6-bHoumX4TujPKZxDxcig4gYCiCrXX_dTwmH89H7s.jpg,"He made sure the bodies of the Muslim dead faced Mecca. COVID-19 claimed his life [Riverside, California]",1,[],0.96,https://www.latimes.com/california/story/2021-01-31/muslim-funerals-islamic-burials-covid-19,all_ads,6,link,"{'enabled': False, 'images': [{'id': 'IPnNTC4se84RcLzuG0ImS4n-V75auNrQqQGCYILmGu0', 'resolutions': [{'height': 56, 'url': 'https://external-preview.redd.it/Vo8-Zz2Y9H9rNecLPECbxvDmDwVvqGOacsrAL3daIkA.jpg?width=108&amp;crop=smart&amp;auto=webp&amp;s=dbb23306a9034713b6fe90fecebc926d77c970f2', 'width': 108}, {'height': 113, 'url': 'https://external-preview.redd.it/Vo8-Zz2Y9H9rNecLPECbxvDmDwVvqGOacsrAL3daIkA.jpg?width=216&amp;crop=smart&amp;auto=webp&amp;s=0ad109a93cf3e923aa8e74fdd78b1c99784c3683', 'width': 216}, {'height': 168, 'url': 'https://external-preview.redd.it/Vo8-Zz2Y9H9rNecLPECbxvDmDwVvqGOacsrAL3daIkA.jpg?width=320&amp;crop=smart&amp;auto=webp&amp;s=ecd1168b917f0e2503908b555db0365385a168b8', 'width': 320}, {'height': 336, 'url': 'https://external-preview.redd.it/Vo8-Zz2Y9H9rNecLPECbxvDmDwVvqGOacsrAL3daIkA.jpg?width=640&amp;crop=smart&amp;auto=webp&amp;s=40b54259b34d5c98055439fc5ab5268227299cd9', 'width': 640}, {'height': 504, 'url': 'https://external-preview.redd.it/Vo8-Zz2Y9H9rNecLPECbxvDmDwVvqGOacsrAL3daIkA.jpg?width=960&amp;crop=smart&amp;auto=webp&amp;s=7be47cb7f88abb936b2989c0cbf6d432fa276150', 'width': 960}, {'height': 567, 'url': 'https://external-preview.redd.it/Vo8-Zz2Y9H9rNecLPECbxvDmDwVvqGOacsrAL3daIkA.jpg?width=1080&amp;crop=smart&amp;auto=webp&amp;s=b8192035c428e614f27c9f5a0a2c4016a1a5327d', 'width': 1080}], 'source': {'height': 630, 'url': 'https://external-preview.redd.it/Vo8-Zz2Y9H9rNecLPECbxvDmDwVvqGOacsrAL3daIkA.jpg?auto=webp&amp;s=0b991b7c3236843d11c3c5e5cf9fa6021ba5c7da', 'width': 1200}, 'variants': {}}]}",73.0,140.0,https://www.latimes.com/california/story/2021-01-31/muslim-funerals-islamic-burials-covid-19,,,,,,,,,,,,,,,,
13,[],False,hearthetruthnow,,[],,text,t2_5j7w5kur,False,False,[],False,False,1612133131,self.religion,https://www.reddit.com/r/religion/comments/l9o5ej/why_why_why/,{},l9o5ej,True,False,False,False,True,True,False,,[],dark,text,False,False,True,8,0,False,all_ads,/r/religion/comments/l9o5ej/why_why_why/,False,6,1612418173,0,"**There are almost 8 billion people on this earth and there must be something that they have in common that causes the virus to attack them.** Why don't they seek out what they have done 

why so many people are being killed by the virus? I think I know the answer but if I tell what the answer is people would not publish it. 

Why isn't this virus attacking animals? Why is it just the human beings? I would like to tell what it is but people will make fun of me and attack me. 

But I will continue trying to tell people that they need to think about the bacteria- that it is alive. And there is something that human race has done. Bye for now.",True,False,False,religion,t5_2qh39,62167,public,self,Why? Why? Why?,0,[],0.25,https://www.reddit.com/r/religion/comments/l9o5ej/why_why_why/,all_ads,6,,,,,,,,,,,,,,,,,,,,,
14,[],False,ARDO_official,,[],,text,t2_71wnnp8p,False,False,[],False,False,1612129352,youtu.be,https://www.reddit.com/r/religion/comments/l9msui/can_modern_altered_states_of_consciousness/,{},l9msui,False,False,False,False,False,False,False,,[],dark,text,False,False,True,0,0,False,all_ads,/r/religion/comments/l9msui/can_modern_altered_states_of_consciousness/,False,6,1612415241,1,,True,False,False,religion,t5_2qh39,62166,public,default,Can modern Altered States of Consciousness experiences research give us a better understanding of the original concept of 'Hamartia' as it was in the early scriptures? This concept is far from the current dogmatic understanding of the word.,0,[],1.0,https://youtu.be/9nUZddBGZeY,all_ads,6,,,105.0,140.0,https://youtu.be/9nUZddBGZeY,moderator,,,,,,,,,,,"{'oembed': {'author_name': 'A Rational Divine Outline', 'author_url': 'https://www.youtube.com/channel/UCChStvnK4jBOz9ar9a5N1DQ', 'height': 200, 'html': '&lt;iframe width=""267"" height=""200"" src=""https://www.youtube.com/embed/9nUZddBGZeY?feature=oembed&amp;enablejsapi=1"" frameborder=""0"" allow=""accelerometer; autoplay; clipboard-write; encrypted-media; gyroscope; picture-in-picture"" allowfullscreen&gt;&lt;/iframe&gt;', 'provider_name': 'YouTube', 'provider_url': 'https://www.youtube.com/', 'thumbnail_height': 360, 'thumbnail_url': 'https://i.ytimg.com/vi/9nUZddBGZeY/hqdefault.jpg', 'thumbnail_width': 480, 'title': 'A modern look at ‘Sin’, a morality based on theories of -Unified Consciousness-', 'type': 'video', 'version': '1.0', 'width': 267}, 'type': 'youtube.com'}","{'content': '&lt;iframe width=""267"" height=""200"" src=""https://www.youtube.com/embed/9nUZddBGZeY?feature=oembed&amp;enablejsapi=1"" frameborder=""0"" allow=""accelerometer; autoplay; clipboard-write; encrypted-media; gyroscope; picture-in-picture"" allowfullscreen&gt;&lt;/iframe&gt;', 'height': 200, 'scrolling': False, 'width': 267}","{'oembed': {'author_name': 'A Rational Divine Outline', 'author_url': 'https://www.youtube.com/channel/UCChStvnK4jBOz9ar9a5N1DQ', 'height': 200, 'html': '&lt;iframe width=""267"" height=""200"" src=""https://www.youtube.com/embed/9nUZddBGZeY?feature=oembed&amp;enablejsapi=1"" frameborder=""0"" allow=""accelerometer; autoplay; clipboard-write; encrypted-media; gyroscope; picture-in-picture"" allowfullscreen&gt;&lt;/iframe&gt;', 'provider_name': 'YouTube', 'provider_url': 'https://www.youtube.com/', 'thumbnail_height': 360, 'thumbnail_url': 'https://i.ytimg.com/vi/9nUZddBGZeY/hqdefault.jpg', 'thumbnail_width': 480, 'title': 'A modern look at ‘Sin’, a morality based on theories of -Unified Consciousness-', 'type': 'video', 'version': '1.0', 'width': 267}, 'type': 'youtube.com'}","{'content': '&lt;iframe width=""267"" height=""200"" src=""https://www.youtube.com/embed/9nUZddBGZeY?feature=oembed&amp;enablejsapi=1"" frameborder=""0"" allow=""accelerometer; autoplay; clipboard-write; encrypted-media; gyroscope; picture-in-picture"" allowfullscreen&gt;&lt;/iframe&gt;', 'height': 200, 'media_domain_url': 'https://www.redditmedia.com/mediaembed/l9msui', 'scrolling': False, 'width': 267}",
15,[],False,[deleted],,,,,,,,[],False,False,1612127902,self.religion,https://www.reddit.com/r/religion/comments/l9m9to/a_question_for_jewish_people_from_a_muslim/,{},l9m9to,False,False,False,False,False,True,False,,[],dark,text,False,False,False,177,0,False,all_ads,/r/religion/comments/l9m9to/a_question_for_jewish_people_from_a_muslim/,False,6,1612414090,13,[deleted],True,False,False,religion,t5_2qh39,62165,public,default,a question for jewish people from a muslim,0,[],0.88,https://www.reddit.com/r/religion/comments/l9m9to/a_question_for_jewish_people_from_a_muslim/,all_ads,6,,,,,,deleted,,dark,,,,,,,,,,,,,
16,[],False,AlderSkeggs,,[],,text,t2_a3ldl1bo,False,False,[],False,False,1612126740,self.religion,https://www.reddit.com/r/religion/comments/l9lulu/my_dissertation_faith_in_the_outdoors/,{},l9lulu,True,False,False,False,True,True,False,,[],dark,text,False,False,False,2,0,False,all_ads,/r/religion/comments/l9lulu/my_dissertation_faith_in_the_outdoors/,False,6,1612413179,6,"Good evening everyone, I am a student at the University of Cumbria in England and I need help completing my dissertation. I am going to conduct a study with the aim of answering this question, How does an individuals spiritual beliefs effect their experience and exploration of the outdoor? To do this I need participants from a wide array of religions and spiritual practices to take part, effectively this will mean me sending a questionnaire to be filled out asking specifics related to this question, your identity will remain completely anonymous in the study. If anyone is interested or would like to know more please send me a message and I would be happy to explain further. Thank you for reading.",True,False,False,religion,t5_2qh39,62165,public,self,My Dissertation: Faith in the Outdoors,0,[],1.0,https://www.reddit.com/r/religion/comments/l9lulu/my_dissertation_faith_in_the_outdoors/,all_ads,6,,,,,,,,,,,,,,,,,,,,,
17,[],False,[deleted],,,,,,,,[],False,False,1612126689,self.religion,https://www.reddit.com/r/religion/comments/l9ltyh/i_am_a_muslim_i_have_a_queation_for_the_jewish/,{},l9ltyh,False,False,False,False,False,True,False,,[],dark,text,False,False,True,0,0,False,all_ads,/r/religion/comments/l9ltyh/i_am_a_muslim_i_have_a_queation_for_the_jewish/,False,6,1612413141,1,,True,False,False,religion,t5_2qh39,62165,public,default,i am a muslim i have a queation for the jewish people here,0,[],1.0,https://www.reddit.com/r/religion/comments/l9ltyh/i_am_a_muslim_i_have_a_queation_for_the_jewish/,all_ads,6,,,,,,deleted,,dark,moderators,,,,,,,,,,,,
18,[],False,pixelsofhearth,,[],,text,t2_9rno32bj,False,False,[],False,False,1612124654,self.religion,https://www.reddit.com/r/religion/comments/l9l2yl/how_can_we_find_true/,{},l9l2yl,True,False,False,False,True,True,False,,[],dark,text,False,False,False,8,0,False,all_ads,/r/religion/comments/l9l2yl/how_can_we_find_true/,False,6,1612411509,2,At least how can we approach to it,True,False,False,religion,t5_2qh39,62164,public,self,How can we find true,0,[],1.0,https://www.reddit.com/r/religion/comments/l9l2yl/how_can_we_find_true/,all_ads,6,,,,,,,,,,,,,,,,,,,,,
19,[],False,sayswhatithink,,[],,text,t2_a3j7affi,False,False,[],False,False,1612121468,self.religion,https://www.reddit.com/r/religion/comments/l9jvi0/a_question/,{},l9jvi0,True,False,False,False,True,True,False,,[],dark,text,False,False,False,28,0,False,all_ads,/r/religion/comments/l9jvi0/a_question/,False,6,1612408926,0,"I have been in a certain Christian faith for years. In that time I have left it several times due to things that happened. One time I had a child who was sick in hospital. I went to front for prayer. The visiting pastor said infront of everyone I wasnt praying or fasting enough and I couldn't depend for others to do it. No one jumped to my defense. I left with blaming myself for my child's sickness. Also same time I was being abused by my x. I became full of guilt and suicidal. I stopped going. No one contacted me, no one called about my child nothing. I finally overcame the guilt. We didn't go for a year. A family member never stopped going and begged us to come back, so we did. I finally got rid.of my abusive x. I struggled financially but never said anything. I was a mess and my health started failing. I started to heal but health got worse. They did know about my health. Then covid hit and with my health I stopped going to protect myself. They didn't wear masks or social distance. Even after covid made some sick still didn't mask or social distance. So I just watched it online because they were also packed in there. I have 4 diseases racking my body so my boyfriend moved in to help me. We do nothing wrong. Even if we did it's no one business. Well then the election happened and the sad event of January 6.  I am a non-affiliated registered voter. I like everyone else posted things about it on Facebook. I know who I vote for is my business so I never share. Well they have yet contacted me in months but 1 time. My health continues to drop and no word or offer of prayer. Well someone high up in the church took me off their Facebook and I didn't know why. The information came to me it's because I posted political stuff. I went and looked and people they and me are friends with they do nothing but post political garbage. I mainly post funny pictures and animal videos. I know that can't be it. They never wrote and talked to me. The bible is clear if you have a problem with a brother or sister in Christ you are to go to them. I have been shunned and this has happened many times in this faith. I don't look like them. I can't figure out what I did and I shouldn't have to go and ask them. I was looking forward to go back after vaccine. What did I do? Why are Christians like this? There are so many churches in America no one should go hungry. I feel if I had money they would care more. All the years in this church I have seen them do NOTHING for their community. They did however get a new sound system. What did I do? Why would a church treat someone like this?",True,False,False,religion,t5_2qh39,62163,public,self,A question ❓❓,0,[],0.5,https://www.reddit.com/r/religion/comments/l9jvi0/a_question/,all_ads,6,,,,,,,,,,,,,,,,,,,,,
20,[],False,trt13shell,,[],,text,t2_kmfrd,False,False,[],False,False,1612118159,self.religion,https://www.reddit.com/r/religion/comments/l9im4e/why_would_one_worship_a_god_that_isnt_all_good/,{},l9im4e,True,False,False,False,True,True,False,,[],dark,text,False,False,False,120,0,False,all_ads,/r/religion/comments/l9im4e/why_would_one_worship_a_god_that_isnt_all_good/,False,6,1612406258,4,"This isn't a rhetorical question. This post is only for those who worship a God/gods who are not all good.

Why do you worship them? What function does it provide? How might it differ or how might it be better than only worshipping an all good God/gods?

How does it effect your life?

I've seen many people say that worshipping a God who isn't all good calls into question the morality of such a person who'd worship them.",True,False,False,religion,t5_2qh39,62162,public,self,Why would one worship a God that isn't all Good?,0,[],0.7,https://www.reddit.com/r/religion/comments/l9im4e/why_would_one_worship_a_god_that_isnt_all_good/,all_ads,6,,,,,,,,,,,,,,,,,,,,,
21,[],False,eichelon01,,[],,text,t2_9mrjj,False,False,[],False,False,1612117497,self.religion,https://www.reddit.com/r/religion/comments/l9icv6/true_identity_of_buddhism/,{},l9icv6,False,False,False,False,False,True,False,,[],dark,text,False,False,True,0,0,False,all_ads,/r/religion/comments/l9icv6/true_identity_of_buddhism/,False,6,1612405722,1,[removed],True,False,False,religion,t5_2qh39,62162,public,default,True identity of Buddhism,0,[],1.0,https://www.reddit.com/r/religion/comments/l9icv6/true_identity_of_buddhism/,all_ads,6,,,,,,moderator,,,,,,,,,,,,,,,
22,[],False,mrbbrj,,[],,text,t2_dm1cs,False,False,[],False,False,1612116405,self.atheism,https://www.reddit.com/r/religion/comments/l9hxfq/the_bible_happening_today/,{},l9hxfq,True,False,False,False,True,False,False,,[],dark,text,False,False,True,0,0,False,all_ads,/r/religion/comments/l9hxfq/the_bible_happening_today/,False,6,1612404832,0,,False,False,False,religion,t5_2qh39,62160,public,default,The bible happening today,0,[],0.5,/r/atheism/comments/l9hfnt/the_bible_happening_today/,all_ads,6,,,,,/r/atheism/comments/l9hfnt/the_bible_happening_today/,,,,,,t3_l9hfnt,"[{'all_awardings': [], 'allow_live_comments': False, 'approved_at_utc': None, 'approved_by': None, 'archived': False, 'author': 'mrbbrj', 'author_flair_background_color': None, 'author_flair_css_class': None, 'author_flair_richtext': [], 'author_flair_template_id': None, 'author_flair_text': None, 'author_flair_text_color': None, 'author_flair_type': 'text', 'author_fullname': 't2_dm1cs', 'author_patreon_flair': False, 'author_premium': False, 'awarders': [], 'banned_at_utc': None, 'banned_by': None, 'can_gild': True, 'can_mod_post': False, 'category': None, 'clicked': False, 'content_categories': None, 'contest_mode': False, 'created': 1612143931.0, 'created_utc': 1612115131.0, 'discussion_type': None, 'distinguished': None, 'domain': 'self.atheism', 'downs': 0, 'edited': False, 'gilded': 0, 'gildings': {}, 'hidden': False, 'hide_score': False, 'id': 'l9hfnt', 'is_crosspostable': True, 'is_meta': False, 'is_original_content': False, 'is_reddit_media_domain': False, 'is_robot_indexable': True, 'is_self': True, 'is_video': False, 'likes': None, 'link_flair_background_color': '', 'link_flair_css_class': None, 'link_flair_richtext': [], 'link_flair_text': None, 'link_flair_text_color': 'dark', 'link_flair_type': 'text', 'locked': False, 'media': None, 'media_embed': {}, 'media_only': False, 'mod_note': None, 'mod_reason_by': None, 'mod_reason_title': None, 'mod_reports': [], 'name': 't3_l9hfnt', 'no_follow': False, 'num_comments': 10, 'num_crossposts': 1, 'num_reports': None, 'over_18': False, 'parent_whitelist_status': 'some_ads', 'permalink': '/r/atheism/comments/l9hfnt/the_bible_happening_today/', 'pinned': False, 'pwls': 7, 'quarantine': False, 'removal_reason': None, 'removed_by': None, 'removed_by_category': None, 'report_reasons': None, 'saved': False, 'score': 10, 'secure_media': None, 'secure_media_embed': {}, 'selftext': 'Did you ever think what if the events of the new testament happened today. A virgin birth is reported. Man turns water to wine. Man restores vision with spit-mud. Man comes back from dead.\nYou would only see these reported in the National Enquirer in the supermarket checkout line.', 'selftext_html': '&lt;!-- SC_OFF --&gt;&lt;div class=""md""&gt;&lt;p&gt;Did you ever think what if the events of the new testament happened today. A virgin birth is reported. Man turns water to wine. Man restores vision with spit-mud. Man comes back from dead.\nYou would only see these reported in the National Enquirer in the supermarket checkout line.&lt;/p&gt;\n&lt;/div&gt;&lt;!-- SC_ON --&gt;', 'send_replies': True, 'spoiler': False, 'stickied': False, 'subreddit': 'atheism', 'subreddit_id': 't5_2qh2p', 'subreddit_name_prefixed': 'r/atheism', 'subreddit_subscribers': 2646420, 'subreddit_type': 'public', 'suggested_sort': None, 'thumbnail': 'self', 'thumbnail_height': None, 'thumbnail_width': None, 'title': 'The bible happening today', 'top_awarded_type': None, 'total_awards_received': 0, 'treatment_tags': [], 'ups': 10, 'upvote_ratio': 0.73, 'url': 'https://www.reddit.com/r/atheism/comments/l9hfnt/the_bible_happening_today/', 'user_reports': [], 'view_count': None, 'visited': False, 'whitelist_status': 'some_ads', 'wls': 7}]",,,,,,,,,
23,[],False,SnooDoughnuts3766,,[],New Muslim,text,t2_8jafeng0,False,False,[],False,False,1612109866,self.religion,https://www.reddit.com/r/religion/comments/l9fhoc/how_are_you_supposed_to_pray_according_to_your/,{},l9fhoc,True,False,False,False,True,True,False,,[],dark,text,False,False,False,21,0,False,all_ads,/r/religion/comments/l9fhoc/how_are_you_supposed_to_pray_according_to_your/,False,6,1612399580,4,"Let's say someone never prays but they want to start, how should they begin the prayer, how should they end, what position should they be in? Can you pray while laying down? 

What would you say to someone who feels unworthy of praying to god?",True,False,False,religion,t5_2qh39,62156,public,self,How are you supposed to pray according to your religion?,0,[],0.83,https://www.reddit.com/r/religion/comments/l9fhoc/how_are_you_supposed_to_pray_according_to_your/,all_ads,6,,,,,,,,dark,,e9960ca0-3f4e-11e4-87bd-12313d148adf,,,,,,,,,,,
