,all_awardings,allow_live_comments,author,author_flair_css_class,author_flair_richtext,author_flair_text,author_flair_type,author_fullname,author_patreon_flair,author_premium,awarders,can_mod_post,contest_mode,created_utc,domain,full_link,gildings,id,is_crosspostable,is_meta,is_original_content,is_reddit_media_domain,is_robot_indexable,is_self,is_video,link_flair_background_color,link_flair_richtext,link_flair_text_color,link_flair_type,locked,media_only,no_follow,num_comments,num_crossposts,over_18,parent_whitelist_status,permalink,pinned,pwls,retrieved_on,score,selftext,send_replies,spoiler,stickied,subreddit,subreddit_id,subreddit_subscribers,subreddit_type,thumbnail,title,total_awards_received,treatment_tags,upvote_ratio,url,whitelist_status,wls,removed_by_category,post_hint,preview,thumbnail_height,thumbnail_width,url_overridden_by_dest,media,media_embed,secure_media,secure_media_embed,crosspost_parent,crosspost_parent_list,distinguished,author_flair_template_id,author_flair_text_color,poll_data,author_flair_background_color
0,[],False,Sons_Of_Thunder7,,[],,text,t2_5xrthomb,False,False,[],False,False,1609741398,self.religion,https://www.reddit.com/r/religion/comments/kq2yqv/if_the_gospels_were_anonymous_how_did_the_church/,{},kq2yqv,True,False,False,False,True,True,False,,[],dark,text,False,False,True,0,0,False,all_ads,/r/religion/comments/kq2yqv/if_the_gospels_were_anonymous_how_did_the_church/,False,6,1609741411,1,"Furthermore, how do we trust Irenaeus' report that Papias and Polycarp were John's ""hearers""? Couldn't this just be a contrived means of trying to assert authority over the other Christian sects that Irenaeus was fighting (e.g. gnostics)? Papias seems to explicitly say that he didn't see John in his preface, contrary to Irenaeus. Polycarp not only does not mention any John in his composite letter, he does not seem to have any special connection with Johannine literature, as in, he quotes said literature seldomly.",True,False,False,religion,t5_2qh39,60751,public,self,"If the Gospels were anonymous, how did the church fathers know who wrote them many decades and centuries later?",0,[],1.0,https://www.reddit.com/r/religion/comments/kq2yqv/if_the_gospels_were_anonymous_how_did_the_church/,all_ads,6,,,,,,,,,,,,,,,,,
1,[],False,Cheerfulmuslimah,,[],,text,t2_8j0wghkg,False,False,[],False,False,1609741059,self.religion,https://www.reddit.com/r/religion/comments/kq2vvn/good_day_and_peace_and_blessings_to_all_of_you_i/,{},kq2vvn,False,False,False,False,False,True,False,,[],dark,text,False,False,True,8,0,False,all_ads,/r/religion/comments/kq2vvn/good_day_and_peace_and_blessings_to_all_of_you_i/,False,6,1609741070,1,[removed],True,False,False,religion,t5_2qh39,60751,public,self,Good day and peace and blessings to all of you I am a new member here . I hope I can benefit from you all and share my own religious experiences and beliefs and clear any misconception anyone has . I am a Muslim woman and happy to join here 😊,0,[],1.0,https://www.reddit.com/r/religion/comments/kq2vvn/good_day_and_peace_and_blessings_to_all_of_you_i/,all_ads,6,automod_filtered,,,,,,,,,,,,,,,,
2,[],False,Binod_Kafle_Type-1,,[],,text,t2_6xb8pxf3,False,False,[],False,False,1609737998,self.religion,https://www.reddit.com/r/religion/comments/kq24b5/can_the_religious_mind_help_us_to_attain_a/,{},kq24b5,False,False,False,False,False,True,False,,[],dark,text,False,False,True,2,0,False,all_ads,/r/religion/comments/kq24b5/can_the_religious_mind_help_us_to_attain_a/,False,6,1609738009,1,[removed],True,False,False,religion,t5_2qh39,60748,public,self,Can the religious mind help us to attain a holistic approach to healthy living? I have seen that it is beneficial if practiced thoughtfully. What are your thoughts?,0,[],1.0,https://www.reddit.com/r/religion/comments/kq24b5/can_the_religious_mind_help_us_to_attain_a/,all_ads,6,automod_filtered,,,,,,,,,,,,,,,,
3,[],False,shitstainstan671,,[],,text,t2_9lnnue9j,False,False,[],False,False,1609735853,self.religion,https://www.reddit.com/r/religion/comments/kq1jz4/eternal_damnation_from_suicide/,{},kq1jz4,False,False,False,False,False,True,False,,[],dark,text,False,False,True,2,0,False,all_ads,/r/religion/comments/kq1jz4/eternal_damnation_from_suicide/,False,6,1609735864,1,[removed],True,False,False,religion,t5_2qh39,60746,public,self,Eternal damnation from suicide,0,[],1.0,https://www.reddit.com/r/religion/comments/kq1jz4/eternal_damnation_from_suicide/,all_ads,6,automod_filtered,,,,,,,,,,,,,,,,
4,[],False,lotsofsweat,,[],,text,t2_3xjz35r0,False,False,[],False,False,1609732674,reuters.com,https://www.reddit.com/r/religion/comments/kq0nso/nuns_arrested_as_beijing_turns_up_heat_on_church/,{},kq0nso,True,False,False,False,True,False,False,,[],dark,text,False,False,True,10,0,False,all_ads,/r/religion/comments/kq0nso/nuns_arrested_as_beijing_turns_up_heat_on_church/,False,6,1609732685,1,,True,False,False,religion,t5_2qh39,60746,public,https://a.thumbs.redditmedia.com/O1XXwtyONykFa7zKIIdJtWgjix1U1bt3Pgssjyud-q0.jpg,Nuns arrested as Beijing turns up heat on Church in Hong Kong,0,[],1.0,https://www.reuters.com/investigates/special-report/hongkong-security-church/,all_ads,6,,link,"{'enabled': False, 'images': [{'id': 'uAdpY0U62oiLGksg1DUxwqVzPXRzN-7lHOYkYcdzTtI', 'resolutions': [{'height': 56, 'url': 'https://external-preview.redd.it/pLMfktu0bsc205Z-EZtbxNvMx7WFvtDmvuqLohpJ7IE.jpg?width=108&amp;crop=smart&amp;auto=webp&amp;s=ea7053308d1cb298846ff7f7c3c3539e1c734d4a', 'width': 108}, {'height': 113, 'url': 'https://external-preview.redd.it/pLMfktu0bsc205Z-EZtbxNvMx7WFvtDmvuqLohpJ7IE.jpg?width=216&amp;crop=smart&amp;auto=webp&amp;s=195c7a80d4c7a75b4bc5f8a7534fa1fac1beb0e5', 'width': 216}, {'height': 167, 'url': 'https://external-preview.redd.it/pLMfktu0bsc205Z-EZtbxNvMx7WFvtDmvuqLohpJ7IE.jpg?width=320&amp;crop=smart&amp;auto=webp&amp;s=6601e9158e2b06461b3b045b5a98b70d51e15944', 'width': 320}, {'height': 334, 'url': 'https://external-preview.redd.it/pLMfktu0bsc205Z-EZtbxNvMx7WFvtDmvuqLohpJ7IE.jpg?width=640&amp;crop=smart&amp;auto=webp&amp;s=f5c2c75bea5c756f680ccc74b999c0c82ed1fccf', 'width': 640}, {'height': 502, 'url': 'https://external-preview.redd.it/pLMfktu0bsc205Z-EZtbxNvMx7WFvtDmvuqLohpJ7IE.jpg?width=960&amp;crop=smart&amp;auto=webp&amp;s=a584b933e0ca39ce94c55efb31504a5c68a4ccf7', 'width': 960}, {'height': 565, 'url': 'https://external-preview.redd.it/pLMfktu0bsc205Z-EZtbxNvMx7WFvtDmvuqLohpJ7IE.jpg?width=1080&amp;crop=smart&amp;auto=webp&amp;s=eb3b4745c1230a2fe965918a01a242645e7781b9', 'width': 1080}], 'source': {'height': 628, 'url': 'https://external-preview.redd.it/pLMfktu0bsc205Z-EZtbxNvMx7WFvtDmvuqLohpJ7IE.jpg?auto=webp&amp;s=d577078999cbfca5811b113897b944345b5aa3be', 'width': 1200}, 'variants': {}}]}",73.0,140.0,https://www.reuters.com/investigates/special-report/hongkong-security-church/,,,,,,,,,,,
5,[],False,willing_fulfillment,,[],,text,t2_9lj7exwr,False,False,[],False,False,1609732380,self.religion,https://www.reddit.com/r/religion/comments/kq0kqm/how_exactly_do_buddhists_live_a_happy_and/,{},kq0kqm,False,False,False,False,False,True,False,,[],dark,text,False,False,True,5,0,False,all_ads,/r/religion/comments/kq0kqm/how_exactly_do_buddhists_live_a_happy_and/,False,6,1609732391,1,[removed],True,False,False,religion,t5_2qh39,60745,public,self,How exactly do Buddhists live a happy and prosperous life if they are not supposed to form attachments to material things and people and are supposed to reach a state of nirvana as their end goal?,0,[],1.0,https://www.reddit.com/r/religion/comments/kq0kqm/how_exactly_do_buddhists_live_a_happy_and/,all_ads,6,automod_filtered,,,,,,,,,,,,,,,,
6,[],False,ms5187,,[],,text,t2_7dw18tb6,False,False,[],False,False,1609731128,self.religion,https://www.reddit.com/r/religion/comments/kq07ow/fasting/,{},kq07ow,False,False,False,False,False,True,False,,[],dark,text,False,False,True,13,0,False,all_ads,/r/religion/comments/kq07ow/fasting/,False,6,1609731140,1,[removed],True,False,False,religion,t5_2qh39,60744,public,self,fasting,0,[],1.0,https://www.reddit.com/r/religion/comments/kq07ow/fasting/,all_ads,6,automod_filtered,,,,,,,,,,,,,,,,
7,[],False,Traditional-Class904,,[],,text,t2_75zw0p9r,False,False,[],False,False,1609729507,self.religion,https://www.reddit.com/r/religion/comments/kpzqd9/raison_detre_of_image_worship/,{},kpzqd9,True,False,False,False,True,True,False,,[],dark,text,False,False,True,3,0,False,all_ads,/r/religion/comments/kpzqd9/raison_detre_of_image_worship/,False,6,1609729518,1,"Hinduism is often dubbed as idolatrous by its critics If idolatry is sin as believed by the Abrahamic faiths each would get the taint to some extent. The crucifix is commonly used as a symbol of faith by the Christians. The consecrated bread and wine of the Eucharist are considered valid physical symbols. The Catholics make a superfluous distinction between idolatry and the veneration of images. While pagan images in stone, metal, wood or other stuff are ridiculed for being the work of man’s hands, icons works depicting the supreme savior or Christian saints are reverenced. In orthodox Christianity, worship in the form of latreia is prohibited but veneration to holy pictures is allowed. Miracles continue to be associated with the statues of Jesus and Mary. The holy custom of changing robes of the image of ‘the child of praque’ in Carmelite Church comes closer to Hindu temple rituals. Islam disdains the worship of religious figures represented in art but the tombs of saints are frequented by devotees. Image worship is abhorred because it is said to bestow on a creature the reverence due to god alone. The fact is that man who creates the image and the stuff he uses for it, is the creation of the creator himself. As God made man in His image man attempts to make an image of Him attributing to him the qualities which may signify His presence in the material world.

The image is like a finger raised towards the sky – a pointer to the higher form of being. The quest for god in human beings wants the formless to be portrayed in form. This precisely explains why the relics of a Buddha, prophet Mohammed or a Christian saint are considered sacred by the devout. The relics remind one of the person to whom they belong, and if they acquire sanctity, the worshipper may have an ecstatic feeling by just viewing them from a distance.

God or the Absolute is beyond the reach of the senses and the mind, A man of high intellect may be able to contemplate on the abstract Reality but an ordinary mind is unable to connect with something which it has not perceived before or which does not have a material form. An idol is not god but a representation of one of His countless attributes. When the form has beauty and grace, is associated with some awe-inspiring fable or myth, endowed with thaumaturgic power through some holy observance and turned into an object of faith, the mind can focus on it with whole-hearted devotion and take a quantum Jump from the sākāra to the nirākara form of God.

An Idol has its aesthetic aspect, its philosophical aspect, its esoteric aspect, its devotional aspect and its historical, mythological or sociological aspect. Each idol has a deep symbolism to it which is meaningful in may respects. Each stands for an ideal viz. the image of Lord Rama signifies dharma; of Hanuman, valour and loyalty, of the mother goddesses, power (śakti); and so on.

The idol is not equated with the Divine. It is like a staircase which helps one to climb but is abandoned as soon as one reaches the target. The fact of immersion (visarjana) of the idols of Lord Ganesha after the prescribed period of worship, is a classic example in this respect. Each image evokes a particular emotion, idea or thought in consonance with its form and character. By the law of Association, an image of the Lord Buddha evokes peace and that of a demon, fear. A figure in the nude evokes baser instinets while that of a saint dissipates it. The sight of even a handkerchief or a pair of spectacles of one’s diseased father reminds, one of him, and may brings tears. The belongings of a husband on tour remind the wife of him. Hinduism applies the law of Remembrance to the matters Divine so that the seeker could shed his feeling of I-ness and feel oneness with him.

The aesthetically-carved image pleases the eyes and goes straight to the heart. Its sacredness penetrates the soul. The devotee begins with faith; faith is transformed into feeling; feeling into emotion, the emotion into awareness and awareness into an undercurrent of consciousness beyond the form of the deity. The subtle vibrations of a consecrated image bring about transformation and inner Joy, as exemplified in the case of the saints of Maharashtra like Nivrittinatha, Jňānadeva Tukārama and others who worshipped god Vitthal in his Pandharpur shrine and of Sri Rāmakrishna who adored the goddess Kālī in the Dakshineśvara temple.",True,False,False,religion,t5_2qh39,60742,public,self,Raison d’etre of Image Worship,0,[],1.0,https://www.reddit.com/r/religion/comments/kpzqd9/raison_detre_of_image_worship/,all_ads,6,,,,,,,,,,,,,,,,,
8,[],False,ThePoetofFall,,[],,text,t2_247lnpm6,False,False,[],False,False,1609729461,i.redd.it,https://www.reddit.com/r/religion/comments/kpzpvl/does_anyone_recognize_this_figure/,{},kpzpvl,False,False,False,True,False,False,False,,[],dark,text,False,False,True,7,0,False,all_ads,/r/religion/comments/kpzpvl/does_anyone_recognize_this_figure/,False,6,1609729472,1,,True,False,False,religion,t5_2qh39,60742,public,https://b.thumbs.redditmedia.com/Qwp2iKH9s7Uq-nwKXdny2hmGvbKrM94vuWUUHbB6YsQ.jpg,Does anyone recognize this figure?,0,[],1.0,https://i.redd.it/c3hictnle8961.jpg,all_ads,6,automod_filtered,image,"{'enabled': True, 'images': [{'id': 'jBb9L3JtMTtB8NZ1xNyVrhqFlJnfTfVZ-2Ccf32JGZE', 'resolutions': [{'height': 144, 'url': 'https://preview.redd.it/c3hictnle8961.jpg?width=108&amp;crop=smart&amp;auto=webp&amp;s=6e7d69ced7cb2176ac5f1371cfe201cab9f099db', 'width': 108}, {'height': 288, 'url': 'https://preview.redd.it/c3hictnle8961.jpg?width=216&amp;crop=smart&amp;auto=webp&amp;s=4d661e7fcebc4dbf64cdd6ede9b1e66bdda88ccf', 'width': 216}, {'height': 426, 'url': 'https://preview.redd.it/c3hictnle8961.jpg?width=320&amp;crop=smart&amp;auto=webp&amp;s=d53b68ec4401ce48983bba571d47a24c771caeba', 'width': 320}, {'height': 853, 'url': 'https://preview.redd.it/c3hictnle8961.jpg?width=640&amp;crop=smart&amp;auto=webp&amp;s=868dc88a20c1dc49af448293bf7dec6647d498c8', 'width': 640}, {'height': 1280, 'url': 'https://preview.redd.it/c3hictnle8961.jpg?width=960&amp;crop=smart&amp;auto=webp&amp;s=3cb7c501d4072545b34d3404278fc07babc1219e', 'width': 960}, {'height': 1440, 'url': 'https://preview.redd.it/c3hictnle8961.jpg?width=1080&amp;crop=smart&amp;auto=webp&amp;s=cfa321e2140627f8866eef371ae7a09d235eb464', 'width': 1080}], 'source': {'height': 4032, 'url': 'https://preview.redd.it/c3hictnle8961.jpg?auto=webp&amp;s=c4a433ea8ab911249e16b1b67f55ec0bd3a76e90', 'width': 3024}, 'variants': {}}]}",140.0,140.0,https://i.redd.it/c3hictnle8961.jpg,,,,,,,,,,,
9,[],False,PenitantMajdala,,[],,text,t2_9jfi2lo8,False,False,[],False,False,1609728069,self.religion,https://www.reddit.com/r/religion/comments/kpzapt/figures_you_did_not_know_had_a_place_in_the/,{},kpzapt,False,False,False,False,False,True,False,,[],dark,text,False,False,True,0,0,False,all_ads,/r/religion/comments/kpzapt/figures_you_did_not_know_had_a_place_in_the/,False,6,1609728079,1,[removed],True,False,False,religion,t5_2qh39,60741,public,self,Figures You Did Not Know Had a Place in the Islamic Tradition:,0,[],1.0,https://www.reddit.com/r/religion/comments/kpzapt/figures_you_did_not_know_had_a_place_in_the/,all_ads,6,automod_filtered,,,,,,,,,,,,,,,,
10,[],False,coochierdestroyer,,[],,text,t2_60r2cchs,False,False,[],False,False,1609726893,self.religion,https://www.reddit.com/r/religion/comments/kpyxu5/any_muslims_wanna_be_friends/,{},kpyxu5,True,False,False,False,True,True,False,,[],dark,text,False,False,True,19,0,False,all_ads,/r/religion/comments/kpyxu5/any_muslims_wanna_be_friends/,False,6,1609726903,1,Hiya do any Muslims wanna be friends. After I reverted recently. I have realised I have no Muslim friend so if you’d like to talk pls message me or leave a comment!,True,False,False,religion,t5_2qh39,60739,public,self,Any Muslims wanna be friends??,0,[],1.0,https://www.reddit.com/r/religion/comments/kpyxu5/any_muslims_wanna_be_friends/,all_ads,6,,,,,,,,,,,,,,,,,
11,[],False,Who3121355,,[],,text,t2_869jcnke,False,False,[],False,False,1609726785,m.youtube.com,https://www.reddit.com/r/religion/comments/kpywo4/bible_quran_plato_and_aristotle_all_taughtteach/,{},kpywo4,False,False,False,False,False,False,False,,[],dark,text,False,False,True,0,0,False,all_ads,/r/religion/comments/kpywo4/bible_quran_plato_and_aristotle_all_taughtteach/,False,6,1609726796,1,,True,False,False,religion,t5_2qh39,60739,public,https://b.thumbs.redditmedia.com/v4NZjhg4bU07dyiFpuwp4ntzJqWYNBCHYKPIxssBYmw.jpg,"Bible, Qur’an, Plato, and Aristotle, all taught/teach that the Sun orbits the Earth",0,[],1.0,https://m.youtube.com/watch?v=iiXdFTi1AyY,all_ads,6,moderator,rich:video,"{'enabled': False, 'images': [{'id': 'fqq1MZu3NHDtxOSOK65ofxg22fsx0qe1lV_j5S_yKpI', 'resolutions': [{'height': 81, 'url': 'https://external-preview.redd.it/e8-kGJO9SF_CaRs7ukF5TWeafMdarnzkAlNg0wWHjdM.jpg?width=108&amp;crop=smart&amp;auto=webp&amp;s=37a944a0618b4b91d434a9b2d9c4abab8397db8a', 'width': 108}, {'height': 162, 'url': 'https://external-preview.redd.it/e8-kGJO9SF_CaRs7ukF5TWeafMdarnzkAlNg0wWHjdM.jpg?width=216&amp;crop=smart&amp;auto=webp&amp;s=4108558b16540dbb3c232b26939776751e3bfca7', 'width': 216}, {'height': 240, 'url': 'https://external-preview.redd.it/e8-kGJO9SF_CaRs7ukF5TWeafMdarnzkAlNg0wWHjdM.jpg?width=320&amp;crop=smart&amp;auto=webp&amp;s=f8e0ac0410e50f77d7f627dfc15b7cbba155be9d', 'width': 320}], 'source': {'height': 360, 'url': 'https://external-preview.redd.it/e8-kGJO9SF_CaRs7ukF5TWeafMdarnzkAlNg0wWHjdM.jpg?auto=webp&amp;s=c2699bf329e3ac5ec58eb82aa0054c7e17eacd6a', 'width': 480}, 'variants': {}}]}",105.0,140.0,https://m.youtube.com/watch?v=iiXdFTi1AyY,"{'oembed': {'author_name': 'المعتزلة', 'author_url': 'https://www.youtube.com/channel/UCwh29sRT7IitNFFGxaKXleQ', 'description': ""Mu'tazila | Qur'an | Tawrat | Plato | Aristotle | Ptolemy | Geocentric model | NASA | Astronomy | Science | Space | Islam | المعتزلة | القرآن | التورات | أفل..."", 'height': 338, 'html': '&lt;iframe class=""embedly-embed"" src=""https://cdn.embedly.com/widgets/media.html?src=https%3A%2F%2Fwww.youtube.com%2Fembed%2FiiXdFTi1AyY%3Ffeature%3Doembed&amp;display_name=YouTube&amp;url=https%3A%2F%2Fwww.youtube.com%2Fwatch%3Fv%3DiiXdFTi1AyY&amp;image=https%3A%2F%2Fi.ytimg.com%2Fvi%2FiiXdFTi1AyY%2Fhqdefault.jpg&amp;key=2aa3c4d5f3de4f5b9120b660ad850dc9&amp;type=text%2Fhtml&amp;schema=youtube"" width=""600"" height=""338"" scrolling=""no"" title=""YouTube embed"" frameborder=""0"" allow=""autoplay; fullscreen"" allowfullscreen=""true""&gt;&lt;/iframe&gt;', 'provider_name': 'YouTube', 'provider_url': 'https://www.youtube.com/', 'thumbnail_height': 360, 'thumbnail_url': 'https://i.ytimg.com/vi/iiXdFTi1AyY/hqdefault.jpg', 'thumbnail_width': 480, 'title': ""*NEW* Only IDIOTS oppose the Bible, Plato, Aristotle, Qur'an which teach the Sun orbits the Earth 🌍"", 'type': 'video', 'url': 'https://www.youtube.com/watch?v=iiXdFTi1AyY', 'version': '1.0', 'width': 600}, 'type': 'm.youtube.com'}","{'content': '&lt;iframe class=""embedly-embed"" src=""https://cdn.embedly.com/widgets/media.html?src=https%3A%2F%2Fwww.youtube.com%2Fembed%2FiiXdFTi1AyY%3Ffeature%3Doembed&amp;display_name=YouTube&amp;url=https%3A%2F%2Fwww.youtube.com%2Fwatch%3Fv%3DiiXdFTi1AyY&amp;image=https%3A%2F%2Fi.ytimg.com%2Fvi%2FiiXdFTi1AyY%2Fhqdefault.jpg&amp;key=2aa3c4d5f3de4f5b9120b660ad850dc9&amp;type=text%2Fhtml&amp;schema=youtube"" width=""600"" height=""338"" scrolling=""no"" title=""YouTube embed"" frameborder=""0"" allow=""autoplay; fullscreen"" allowfullscreen=""true""&gt;&lt;/iframe&gt;', 'height': 338, 'scrolling': False, 'width': 600}","{'oembed': {'author_name': 'المعتزلة', 'author_url': 'https://www.youtube.com/channel/UCwh29sRT7IitNFFGxaKXleQ', 'description': ""Mu'tazila | Qur'an | Tawrat | Plato | Aristotle | Ptolemy | Geocentric model | NASA | Astronomy | Science | Space | Islam | المعتزلة | القرآن | التورات | أفل..."", 'height': 338, 'html': '&lt;iframe class=""embedly-embed"" src=""https://cdn.embedly.com/widgets/media.html?src=https%3A%2F%2Fwww.youtube.com%2Fembed%2FiiXdFTi1AyY%3Ffeature%3Doembed&amp;display_name=YouTube&amp;url=https%3A%2F%2Fwww.youtube.com%2Fwatch%3Fv%3DiiXdFTi1AyY&amp;image=https%3A%2F%2Fi.ytimg.com%2Fvi%2FiiXdFTi1AyY%2Fhqdefault.jpg&amp;key=2aa3c4d5f3de4f5b9120b660ad850dc9&amp;type=text%2Fhtml&amp;schema=youtube"" width=""600"" height=""338"" scrolling=""no"" title=""YouTube embed"" frameborder=""0"" allow=""autoplay; fullscreen"" allowfullscreen=""true""&gt;&lt;/iframe&gt;', 'provider_name': 'YouTube', 'provider_url': 'https://www.youtube.com/', 'thumbnail_height': 360, 'thumbnail_url': 'https://i.ytimg.com/vi/iiXdFTi1AyY/hqdefault.jpg', 'thumbnail_width': 480, 'title': ""*NEW* Only IDIOTS oppose the Bible, Plato, Aristotle, Qur'an which teach the Sun orbits the Earth 🌍"", 'type': 'video', 'url': 'https://www.youtube.com/watch?v=iiXdFTi1AyY', 'version': '1.0', 'width': 600}, 'type': 'm.youtube.com'}","{'content': '&lt;iframe class=""embedly-embed"" src=""https://cdn.embedly.com/widgets/media.html?src=https%3A%2F%2Fwww.youtube.com%2Fembed%2FiiXdFTi1AyY%3Ffeature%3Doembed&amp;display_name=YouTube&amp;url=https%3A%2F%2Fwww.youtube.com%2Fwatch%3Fv%3DiiXdFTi1AyY&amp;image=https%3A%2F%2Fi.ytimg.com%2Fvi%2FiiXdFTi1AyY%2Fhqdefault.jpg&amp;key=2aa3c4d5f3de4f5b9120b660ad850dc9&amp;type=text%2Fhtml&amp;schema=youtube"" width=""600"" height=""338"" scrolling=""no"" title=""YouTube embed"" frameborder=""0"" allow=""autoplay; fullscreen"" allowfullscreen=""true""&gt;&lt;/iframe&gt;', 'height': 338, 'media_domain_url': 'https://www.redditmedia.com/mediaembed/kpywo4', 'scrolling': False, 'width': 600}",,,,,,,
