,all_awardings,allow_live_comments,author,author_flair_css_class,author_flair_richtext,author_flair_text,author_flair_type,author_fullname,author_patreon_flair,author_premium,awarders,can_mod_post,contest_mode,created_utc,domain,full_link,gildings,id,is_crosspostable,is_meta,is_original_content,is_reddit_media_domain,is_robot_indexable,is_self,is_video,link_flair_background_color,link_flair_richtext,link_flair_text_color,link_flair_type,locked,media_only,no_follow,num_comments,num_crossposts,over_18,parent_whitelist_status,permalink,pinned,pwls,retrieved_on,score,selftext,send_replies,spoiler,stickied,subreddit,subreddit_id,subreddit_subscribers,subreddit_type,thumbnail,title,total_awards_received,treatment_tags,upvote_ratio,url,whitelist_status,wls,post_hint,preview,thumbnail_height,thumbnail_width,url_overridden_by_dest,removed_by_category,author_flair_background_color,author_flair_text_color,banned_by,author_flair_template_id,crosspost_parent,crosspost_parent_list,edited,distinguished,link_flair_template_id,link_flair_text,media,media_embed,secure_media,secure_media_embed,poll_data
0,[],False,KingDevil666,,[],,text,t2_4uc49cq1,False,False,[],False,False,1612155960,self.religion,https://www.reddit.com/r/religion/comments/l9veme/help_me_sell_my_soul/,{},l9veme,True,False,False,False,True,True,False,,[],dark,text,False,False,True,48,0,False,all_ads,/r/religion/comments/l9veme/help_me_sell_my_soul/,False,6,1612435740,0,"This may sound stupid, and I’m aware. I don’t need to be reminded. Firstly I’d like to preface that I’m not a Christian (obviously) and am for the most part, non religious. However, I do have an open mind to basically anything. Due to my unique position, I would like to conduct an experiment, and I’d like your help.

I want to sell my soul to the devil, and I’m not quite sure how. I will be visiting other subreddits that may be able to guide me on my quest. ANY methods that you know of, I will try. (Within reason)

My only limits are things which lead to hurting others. I’ve done research on other “famous” cases of this, and I will attempt to recreate those as well. I’m essentially casting a very large net, and hoping that at least 1 method may actually yield an interesting result. 

It’s that simple, I want my soul to be in possession of the man downstairs, and I need your help. Cheers.",True,False,False,religion,t5_2qh39,62180,public,self,Help me sell my soul.,0,[],0.38,https://www.reddit.com/r/religion/comments/l9veme/help_me_sell_my_soul/,all_ads,6,,,,,,,,,,,,,,,,,,,,,
1,[],False,Chemical_Newt4907,,[],,text,t2_9xier3hs,False,False,[],False,False,1612154845,self.religion,https://www.reddit.com/r/religion/comments/l9v2vs/are_these_blasphemies_against_the_holy_spirit/,{},l9v2vs,True,False,False,False,True,True,False,,[],dark,text,False,False,True,10,0,False,all_ads,/r/religion/comments/l9v2vs/are_these_blasphemies_against_the_holy_spirit/,False,6,1612434895,0,"Are saying any of these things through your head blasphemy against the Holy Spirit:

“Dear God, I blaspheme the Holy Spirit”

“Dear the Holy Spirit, I blaspheme you”

“Dear God, the Holy Spirit was the work of the Devil”

“Dear the Holy Spirit, you’re the work of the Devil”

“Dear God, good is evil and evil is good”

“Dear God, the Holy Spirit is evil”

“Dear the Holy Spirit, you’re evil”


Are any of these considered blasphemy against the Holy Spirit? Now that stuff is for Protestant, and me as a Catholic, if Protestantism is true, and I said any of that stuff, am I damned?",True,False,False,religion,t5_2qh39,62180,public,self,Are these blasphemies against the Holy Spirit?,0,[],0.4,https://www.reddit.com/r/religion/comments/l9v2vs/are_these_blasphemies_against_the_holy_spirit/,all_ads,6,,,,,,,,,,,,,,,,,,,,,
2,[],False,Bomboclaat_Babylon,,[],,text,t2_6dfd4qnk,False,False,[],False,False,1612154208,cnn.com,https://www.reddit.com/r/religion/comments/l9uwaf/violence_and_slurs_from_some_of_israels/,{},l9uwaf,True,False,False,False,True,False,False,,[],dark,text,False,False,False,2,0,False,all_ads,/r/religion/comments/l9uwaf/violence_and_slurs_from_some_of_israels/,False,6,1612434420,2,,True,False,False,religion,t5_2qh39,62179,public,https://b.thumbs.redditmedia.com/WRMx9m_dJvMEli7Rpl8-0WY-QOUBptYWKQnlJuxDbEU.jpg,Violence and slurs from some of Israel's ultra-Orthodox Jews in battle over coronavirus lockdowns,0,[],0.75,https://www.cnn.com/2021/01/29/middleeast/israel-ultra-orthodox-coronavirus-intl/index.html,all_ads,6,link,"{'enabled': False, 'images': [{'id': 'wnh0E_98xSXP1xM_fBKl3WS_ez_HNWOLinarz-F-1W8', 'resolutions': [{'height': 60, 'url': 'https://external-preview.redd.it/iPh-9_6XLLisymjeDsL2Gwf_az66REVHIly7XLy3xF4.jpg?width=108&amp;crop=smart&amp;auto=webp&amp;s=492503390cbacf1b4705bb377fecc0653269aea3', 'width': 108}, {'height': 121, 'url': 'https://external-preview.redd.it/iPh-9_6XLLisymjeDsL2Gwf_az66REVHIly7XLy3xF4.jpg?width=216&amp;crop=smart&amp;auto=webp&amp;s=1b88adea1462c1e9078ee8684eaf766cf77d341e', 'width': 216}, {'height': 180, 'url': 'https://external-preview.redd.it/iPh-9_6XLLisymjeDsL2Gwf_az66REVHIly7XLy3xF4.jpg?width=320&amp;crop=smart&amp;auto=webp&amp;s=7d84b8d19750eb8e17ce12bfb5c777cd77ffe5e8', 'width': 320}, {'height': 360, 'url': 'https://external-preview.redd.it/iPh-9_6XLLisymjeDsL2Gwf_az66REVHIly7XLy3xF4.jpg?width=640&amp;crop=smart&amp;auto=webp&amp;s=9a8178d83c2638726e83e47f26e587612d927704', 'width': 640}, {'height': 540, 'url': 'https://external-preview.redd.it/iPh-9_6XLLisymjeDsL2Gwf_az66REVHIly7XLy3xF4.jpg?width=960&amp;crop=smart&amp;auto=webp&amp;s=21af258fb40b79af9f192b77e0f041855f5ef55c', 'width': 960}, {'height': 607, 'url': 'https://external-preview.redd.it/iPh-9_6XLLisymjeDsL2Gwf_az66REVHIly7XLy3xF4.jpg?width=1080&amp;crop=smart&amp;auto=webp&amp;s=8373040dfca49fbe8327ca439ecf9cf99413b8a4', 'width': 1080}], 'source': {'height': 619, 'url': 'https://external-preview.redd.it/iPh-9_6XLLisymjeDsL2Gwf_az66REVHIly7XLy3xF4.jpg?auto=webp&amp;s=431ed7ea623db8662ef8c91e08e2cc9e47cfb0d7', 'width': 1100}, 'variants': {}}]}",78.0,140.0,https://www.cnn.com/2021/01/29/middleeast/israel-ultra-orthodox-coronavirus-intl/index.html,,,,,,,,,,,,,,,,
3,[],False,cookingandcraft,,[],,text,t2_6jnzz734,False,False,[],False,False,1612153577,melodiespositive.com,https://www.reddit.com/r/religion/comments/l9upjh/prayers_for_the_day/,{},l9upjh,False,False,False,False,False,False,False,,[],dark,text,False,False,True,2,0,False,all_ads,/r/religion/comments/l9upjh/prayers_for_the_day/,False,6,1612433935,2,,True,False,False,religion,t5_2qh39,62179,public,default,Prayers for the day!,0,[],1.0,https://www.melodiespositive.com/p/prayers.html,all_ads,6,,,73.0,140.0,https://www.melodiespositive.com/p/prayers.html,moderator,,,,,,,,,,,,,,,
4,[],False,[deleted],,,,,,,,[],False,False,1612153060,self.religion,https://www.reddit.com/r/religion/comments/l9uk46/english_translation_of_meanings_of_quran_can_ship/,{},l9uk46,False,False,False,False,False,True,False,,[],dark,text,False,False,True,0,0,False,all_ads,/r/religion/comments/l9uk46/english_translation_of_meanings_of_quran_can_ship/,False,6,1612433541,1,,True,False,False,religion,t5_2qh39,62179,public,default,English translation of meanings of Quran. Can ship it for free as well. PM me if you are interested!,0,[],1.0,https://www.reddit.com/r/religion/comments/l9uk46/english_translation_of_meanings_of_quran_can_ship/,all_ads,6,,,140.0,140.0,,deleted,,dark,moderators,,,,,,,,,,,,
5,[],False,Godquotes,,[],,text,t2_8njms5cs,False,False,[],False,False,1612152878,self.religion,https://www.reddit.com/r/religion/comments/l9ui47/a_question_for_the_atheists_on_this_sub/,{},l9ui47,True,False,False,False,True,True,False,,[],dark,text,False,False,True,381,0,False,all_ads,/r/religion/comments/l9ui47/a_question_for_the_atheists_on_this_sub/,False,6,1612433404,0,"This question is not for those who are agnostic. It is for Atheists.  Those who lack belief in a higher power. 

 It would be my assumption for any human that might be in the middle of nowhere and stumble across something of complex and intelligent design (let's use a pocket watch for this example), that human would be curious of it's origin and intuitively understand that anything with such a complex design would have to have been created by someone or something intelligent. It would be irrational not to, right? 

So when we think of of the complexity of the human body, why would it be rational to believe that we simply evolved out of pure luck and coincidence, with no intelligent design?",True,False,False,religion,t5_2qh39,62179,public,self,A question for the atheists on this sub...,0,[],0.33,https://www.reddit.com/r/religion/comments/l9ui47/a_question_for_the_atheists_on_this_sub/,all_ads,6,,,,,,,,,,,,,,,,,,,,,
